type,name,steam_appid,developers,publishers,website,categories,genres,steam_url,detection_stage,api_response_type,potential_duplicate,release_date,description,supported_languages,followers,wishlists_est,wishlist_rank,discovery_date
game,限界シェフ,3683710,株式会社ワンコネクト,株式会社ワンコネクト,,Single-player;Custom Volume Controls;Partial Controller Support;Family Sharing,Indie,https://store.steampowered.com/app/3683710,public_unreleased,full_details,False,Coming soon,限界までドバドバ注げ！ 狂気のワンボタン・クッキングアクション。君は“最後の一滴”までいけるか？,Japanese,,,,2025-07-25
game,Slots & Daggers,3631290,Friedemann,Future Friends Games,,Single-player;Steam Achievements;Family Sharing,Indie;Simulation;Strategy,https://store.steampowered.com/app/3631290,public_unreleased,full_details,False,Coming soon,A retro-fantasy roguelike inside a slot machine. Steady your blade - and spin!,"*;, French, German, Japanese, Simplified Chinese;*",222,2664,,2025-07-25
game,Cousin Catcher,3896200,Camden Martin,Camden Martin;Andrew Aarons,,Single-player;Steam Achievements;Camera Comfort;Color Alternatives;Custom Volume Controls;Adjustable Difficulty;Keyboard Only Option;Save Anytime;Steam Cloud;Stats;Family Sharing,Adventure;Casual;Indie,https://store.steampowered.com/app/3896200,public_unreleased,full_details,False,August 2025,"A wacky upgrade-driven, physics-based arcade game where you launch a baby into the sky, collect coins, and catch them on the way down!",English,,,,2025-07-25
game,CODE::LUX,3850630,すやすやファクトリー,すやすやファクトリー,,Single-player;Family Sharing,Adventure,https://store.steampowered.com/app/3850630,public_unreleased,full_details,False,"Sep 1, 2025",泥沼化した世界大戦によって主要な電力インフラが失われ、文明が崩壊した未来。 遺物を求めて廃墟を渡るスカベンジャーのカイは、旧国家システムを掌握する謎の少女ミツハと出会う。 彼女の願いは、ただひとつ――かつて世界を支えた核融合炉を再び動かすこと。,Japanese,,,,2025-07-25
game,holoVillage: Our Cozy Days,3856280,Roboqlo,holo Indie,,Single-player;Multi-player;Co-op;Online Co-op;Steam Achievements;Full controller support;Custom Volume Controls;Stereo Sound;Steam Cloud;Family Sharing,Indie;RPG,https://store.steampowered.com/app/3856280,public_unreleased,full_details,False,December 2025,"Farm, fish, mine, craft, and decorate your home in this cozy multiplayer life sim. Venture into dungeons and take on bosses outside the village for some added excitement. Share relaxing and thrilling moments alike with hololive talents as you shape your countryside life.",English;Japanese,,,,2025-07-25
game,University Is Hell,3895680,Marcelinho Games,Marcelinho Games,,Single-player;Family Sharing,Adventure;Casual;Indie,https://store.steampowered.com/app/3895680,public_unreleased,full_details,False,Coming soon,"A twisted narrative adventure with branching quests and deadly choices. Relive the same cursed day in a darkly comedic university full of violent classes, shady professors, and disturbing secrets.",English,,,,2025-07-25
game,My Summer Cottage,3115420,Small Fish,Small Fish,https://smallfi.sh,Single-player;Multi-player;Co-op;Online Co-op;Full controller support;Captions available;Family Sharing,Casual;Indie;Simulation,https://store.steampowered.com/app/3115420,public_unreleased,full_details,False,Coming soon,"Experience the life of an average Finn in My Summer Cottage. After losing your job, you retreat to your cottage to indulge in booze, hobbies, and questionable activities—while dodging responsibility and embracing the chaos around you.",*;*,,,,2025-07-25
game,Unseen,3890580,Noxvale Studio,Noxvale Studio,,Single-player;Steam Achievements;Custom Volume Controls;Mouse Only Option;Save Anytime;Steam Cloud;Stats;Steam Leaderboards;Family Sharing,Indie;Simulation;Early Access,https://store.steampowered.com/app/3890580,public_unreleased,full_details,False,Q3 2025,"A story-driven visual novel set within the dark corridors of the mind. Uncover your past through choices, shape your fate with dice. Unseen blends psychological horror and eldritch atmosphere into a haunting narrative full of forgotten memories and buried fears.",English;Turkish,,,,2025-07-25
game,Hollowstride,3827620,VixVoid,VixVoid,,Single-player;Multi-player;PvP;Online PvP;LAN PvP;Co-op;Online Co-op;LAN Co-op;Steam Achievements;Camera Comfort;Custom Volume Controls;Save Anytime;Stereo Sound;Surround Sound;Family Sharing,Adventure;Casual;Simulation;Early Access,https://store.steampowered.com/app/3827620,public_unreleased,full_details,False,To be announced,"Explore, build, and survive in a living, procedural world. Hollowstride is a multiplayer voxel sandbox in early development, offering a moddable foundation for your next great adventure.",*;*,,,,2025-07-25
game,Your Another Wife,3723680,Kygua Tech,Kygua Tech,,Single-player;Steam Cloud;Family Sharing,Casual;Indie;RPG,https://store.steampowered.com/app/3723680,public_unreleased,full_details,False,2025,"Think you've had your fill of virtual waifu? It's Okay, step into the world of Your Other Waifu... She's developed a passion for dress-up and is waiting for you to join her in some delightful little games!","*;, Simplified Chinese;*;, Traditional Chinese;*;, Japanese;*;*",,,,2025-07-25
game,Ashen Destiny,3867040,Arrow & Blade Games,Arrow & Blade Games,https://discord.gg/X28muRGv4A,Single-player;Family Sharing,Strategy;Early Access,https://store.steampowered.com/app/3867040,public_unreleased,full_details,False,Coming soon,"Conquer randomized lands in a brutal turn-based strategy epic. Recruit generals with random stats and command massive armies in battle. Forge your legacy through tactical warfare, resource control, and ruthless ambition.","*;, Russian, Simplified Chinese, Spanish - Latin America;*",,,,2025-07-25
game,Pantheons Clash: Crystal,3882370,Crystal Studio,E·Mystic Games,,Single-player;Multi-player;MMO;PvP;Online PvP;Captions available;In-App Purchases,Adventure;Massively Multiplayer;RPG;Free To Play,https://store.steampowered.com/app/3882370,public_unreleased,full_details,False,2025,"In the new era of the divine calendar, all things undergo changes and chaos in time and space. The Gate of the Realm has emerged, connecting the various divine realms······","*;, Traditional Chinese;*;*",,,,2025-07-25
game,Fucked by the Princesses of the Realm,3809180,Fantasy Games,Fantasy Games,,Single-player;Custom Volume Controls;Mouse Only Option;Playable without Timed Input;Save Anytime;Family Sharing,Casual;Simulation,https://store.steampowered.com/app/3809180,public_unreleased,full_details,False,September 2025,"You live in Drosk, a dusty land... and where you don't throw any. One day, a crazy old man tells you that beyond the Red Valley there is a kingdom where only beautiful and hot women live. Without hesitation, you head straight for the steamy tale you've just been told, and you find out it's real.",English;Spanish - Spain;Simplified Chinese;Korean;Japanese;Russian,,,,2025-07-25
demo,The Beast Is Yet To Come Demo,3892650,Mileo.io,Mileo.io,,Game demo,,https://store.steampowered.com/app/3892650,public_unreleased,full_details,False,Coming soon,,,,,,2025-07-25
game,Pixel Dungeons,3896240,Alexi,Alexi,,Single-player;Playable without Timed Input;Family Sharing,Action;Casual;Indie,https://store.steampowered.com/app/3896240,public_unreleased,full_details,False,Coming soon,"A turn-based pixel dungeon game where every move counts. Drop bombs, unlock doors, and outsmart enemies in short tactical levels. Easy to pick up, challenging to master. Play at your own pace with no time pressure.",*;*,,,,2025-07-25
game,QuickFire,3899300,SHEN YI,SHEN YI,,Single-player;Family Sharing,Indie;Strategy,https://store.steampowered.com/app/3899300,public_unreleased,full_details,False,Coming soon,QuickFire: This Wild West shootout has no skill cooldowns—your speed decides victory.,"*;, French, Italian, German, Spanish - Spain, Russian, Japanese, Polish, Simplified Chinese;*;, Traditional Chinese;*;, Portuguese - Brazil, Korean;*",,,,2025-07-25
game,久美子之死：昭和少女血色告白,3891620,LingVision Games,LingVision Games,,Single-player;Family Sharing,Adventure;RPG,https://store.steampowered.com/app/3891620,public_unreleased,full_details,False,Coming soon,1988年，日本泡沫经济破灭前夕，化身被冤枉成嫌犯的刑警，侦查青梅奇怪自杀案，牵连出持续20年的连环杀人案秘密，穿梭烟酒与霓虹的昭和街头，在人心与生死的抉择中，搜查蛛丝马迹，找出血案真相。,*;*,,,,2025-07-25
demo,Echoes of the HIve Demo,3893660,Leon Twemlow,Leon Twemlow,,Single-player;Multi-player;Co-op;Online Co-op;LAN Co-op;Shared/Split Screen Co-op;Shared/Split Screen;Game demo;Remote Play Together,,https://store.steampowered.com/app/3893660,public_unreleased,full_details,False,Coming soon,"Team up with friends in this 2D fantasy sandbox adventure! Explore mysterious worlds, craft powerful gear, battle monsters, and delve deep underground to uncover secrets and challenge epic bosses.",,,,,2025-07-25
game,Perfect Diamond,3871170,Anthony Blackman,Enjoyance Games,,Single-player;Multi-player;PvP;Shared/Split Screen PvP;Shared/Split Screen;Camera Comfort;Color Alternatives;Adjustable Difficulty;Keyboard Only Option;Remote Play Together;Family Sharing,Indie,https://store.steampowered.com/app/3871170,public_unreleased,full_details,False,August 2025,"Perfect Diamond is a fast-paced puzzle game made for the NES. ROM included! Slide puzzle blocks into the grid to fill lines. Try to survive as the pieces move faster and faster. 3 single-player modes, local multiplayer battle, battle vs CPU.",English,,,,2025-07-25
dlc,Car Mechanic Simulator 2021 - Police DLC,3660210,GameFormatic s.a.,,,Single-player;Downloadable Content;Steam Achievements;Steam Trading Cards;Steam Workshop;Custom Volume Controls;Save Anytime;Stereo Sound;Subtitle Options;Partial Controller Support;Steam Cloud;Stats;Includes level editor;Family Sharing,Racing;Simulation,https://store.steampowered.com/app/3660210,public_unreleased,full_details,False,Coming soon,"The Police DLC for Car Mechanic Simulator 2021 adds 6 police cars inspired by real models, unique liveries – no new missions or glowing police lights.","*;, French, Italian, German, Spanish - Spain, Simplified Chinese, Japanese, Polish, Portuguese - Portugal, Portuguese - Brazil, Russian, Korean, Turkish, Czech, Romanian, Arabic, Hungarian;*",,,,2025-07-25
demo,Path of Gear: Blacksmith's Legend Demo,3869120,焊蛙遊戲工作室,焊蛙遊戲工作室,,Single-player;Game demo,Indie;Strategy,https://store.steampowered.com/app/3869120,public_unreleased,full_details,False,"Jul 31, 2025","Path of Gear: Blacksmith’s Legend is a timeline-based roguelite strategy game. As a legendary blacksmith whose weapons are too powerful to wield, you must command adventurers in battle. Explore random maps, gather materials, forge gear, and face powerful foes!",English;Japanese;Simplified Chinese;Traditional Chinese,,,,2025-07-25
demo,The Next Stop Demo,3877320,Paranoid Delusion,Paranoid Delusion,,Single-player;Game demo,Adventure;Indie;Simulation,https://store.steampowered.com/app/3877320,public_unreleased,full_details,False,Coming soon,"Play Chapter 0 of The Next Stop: a narrative point & click adventure set in a haunting subway. Interrogate passengers, solve puzzles, and begin uncovering what lies beneath the surface.","*;, Spanish - Spain;*;*",,,,2025-07-25
game,ロボロビ,3885010,wal,WAL STUDIO,,Single-player;Steam Achievements;Camera Comfort;Color Alternatives;Custom Volume Controls;Partial Controller Support;Family Sharing,Action;Indie,https://store.steampowered.com/app/3885010,public_unreleased,full_details,False,Coming soon,"ROBOROBI is a brutal 2D action platformer. Our little buddy Roborobi just can’t stop moving. Master a variety of moves to take control, and clear every stage to achieve victory.",Japanese,,,,2025-07-25
game,Pet Desktop Adventure,1983950,Triple Tails Software,Triple Tails Software,,Single-player;Custom Volume Controls;Mouse Only Option;Playable without Timed Input;Steam Cloud;Family Sharing,Adventure;Casual;Indie;Strategy,https://store.steampowered.com/app/1983950,public_unreleased,full_details,False,Coming soon,"Pet Desktop Adventure is your good company when you are working. Join a great adventure with your pets on your deskrop. You will facing waves and waves of enemies, take a good care of your pets, form an adventure team and stop your enemies.",Simplified Chinese;English;Japanese;Traditional Chinese,,,,2025-07-25
game,Sunset Suckerpunch,3651550,Virtual Unreality Inc.,Virtual Unreality Inc.,,Single-player;Full controller support;Camera Comfort;Custom Volume Controls;Adjustable Difficulty;Playable without Timed Input;Save Anytime;Stereo Sound;Subtitle Options;Family Sharing,Action,https://store.steampowered.com/app/3651550,public_unreleased,full_details,False,2026,"Meet K8E: a talking, transforming motorcycle-sword-gauntlet. Drive her to meet your enemies, and wield her to crater them into the asphalt. Don't let them take her voice, too.",*;*,,,,2025-07-25
game,Astral Takers,3681760,VANGUARD,KEMCO,https://www.kemco-games.com/,Single-player;Steam Achievements;Full controller support;Steam Cloud;Family Sharing,Adventure;RPG;Simulation;Strategy,https://store.steampowered.com/app/3681760,public_unreleased,full_details,False,"Jul 31, 2025",Shape your fate with the power of summoning in an immersive JRPG!,English;Japanese,,,,2025-07-25
game,PHARMA INC ™ SIMULATOR,3849690,Double Turbos,Double Turbos,,Single-player;Mouse Only Option;Family Sharing,Simulation,https://store.steampowered.com/app/3849690,public_unreleased,full_details,False,Coming soon,"Build your own pharma empire—on fair play or greed. Face the consequences of every decision in this darkly humorous, satirical sim: set market prices, manage production, boost your brand, make tough choices... and see where they take you.",English,,,,2025-07-25
game,Tavern Maid's Daily Life,3875830,koko games,koko games,,Single-player;Family Sharing,Adventure;Casual;Indie;RPG;Simulation,https://store.steampowered.com/app/3875830,public_unreleased,full_details,False,Q2 2026,"In 'Tavern Maid’s Daily Life' you play as a maid working at the 'Red Fox Tavern', serving all kinds of customers and enjoying a cozy, eventful everyday life. Between casual chats and daily chores, you’ll gradually uncover the deeper stories and mysteries of the fantasy world around you.",English;Simplified Chinese;Traditional Chinese,,,,2025-07-25
game,Delve,486390,Amelia Fletcher,N/A,,Single-player;Multi-player;PvP;Online PvP;LAN PvP;Shared/Split Screen PvP;Shared/Split Screen;Steam Achievements;Full controller support;Steam Cloud;Remote Play on TV;Remote Play Together;Family Sharing,Casual;Indie,https://store.steampowered.com/app/486390,public_unreleased,full_details,False,Coming soon,Delve is a multiplayer puzzle-platformer where players control adorable creatures as they dig through underground caverns in search of treasure.,*;*,,,,2025-07-25
game,Forced Entry,3843020,FourAM Games,FourAM Games,http://fouramgames.net,Single-player;Full controller support;Family Sharing,Indie;Simulation,https://store.steampowered.com/app/3843020,public_unreleased,full_details,False,Coming soon,"A masked serial killer has Forced Entry into your home knocking you out and locking you into the basement, You must now try to escape before its to late. Can you escape or will you become another victim of this relentless butcher.",*;*,,,,2025-07-25
game,College Baseball: Dynasty Builder,3897330,Rainey Studios,Rainey Studios,,Single-player;Family Sharing,Simulation;Sports;Strategy,https://store.steampowered.com/app/3897330,public_unreleased,full_details,False,"Aug 25, 2025","Your wait for a college baseball game is over. College Baseball: Dynasty Builder lets you take control of a college program, recruit top talent, manage your roster, and build a powerhouse over multiple seasons.",English,,,,2025-07-25
game,QPet Zoo,3894730,XDesktop,XDesktop,,,Casual;Indie;Simulation;Free To Play;Animation & Modeling;Utilities;Early Access,https://store.steampowered.com/app/3894730,public_unreleased,full_details,False,"Aug 17, 2025",A cartoon stylized idle zoo simulator designed to sit at the bottom of your screen allowing you to work on other tasks while caring for your zoo and animals!,*;*,,,,2025-07-25
