type,name,steam_appid,developers,publishers,website,categories,genres,steam_url,detection_stage,api_response_type,potential_duplicate,release_date,description,supported_languages,followers,wishlists_est,wishlist_rank,discovery_date
game,Tester Wanted,3899420,Mr_Bloodjack,Mr_Bloodjack,,Single-player;Adjustable Text Size;Camera Comfort;Color Alternatives;Custom Volume Controls;Keyboard Only Option;Stereo Sound;Subtitle Options;Family Sharing,Casual,https://store.steampowered.com/app/3899420,public_unreleased,full_details,False,Coming soon,"Help an incompetent game developer test out a bunch of game ideas he came up with in a desperate attempt to make it big. Don’t worry, everything will totally go according to plan! He’ll be keeping an eye on your progress anyway.",*;*,3,42,,2025-07-25
game,Dominated by: Yandere Goth Femdom Girlfriend,3896870,Bully Revenge Studios,Bully Revenge Studios,,Single-player;Steam Achievements;Custom Volume Controls;Mouse Only Option;Playable without Timed Input;Save Anytime;Family Sharing,Indie;Simulation,https://store.steampowered.com/app/3896870,public_unreleased,full_details,False,"Aug 7, 2025","Experience a day in the life of a hyper-masochist being bullied by his hyper-sadistic, yandere, goth girlfriend.",English;French;Italian;German;Spanish - Spain;Arabic;Bulgarian;Czech;Danish;Dutch;Finnish;Greek;Hungarian;Indonesian;Japanese;Korean;Norwegian;Polish;Portuguese - Brazil;Romanian;Russian;Simplified Chinese;Swedish;Thai;Traditional Chinese;Turkish;Ukrainian;Vietnamese,2,24,,2025-07-25
game,Stuck in a loop,3869190,FromGate,FromGate,,Single-player;Full controller support;Family Sharing,Indie;Strategy,https://store.steampowered.com/app/3869190,public_unreleased,full_details,False,Coming soon,"Stuck in a Loop is an innovative puzzle game where you don’t control the character… you program it. At each level, analyze the situation, plan the right instructions, and let the robot execute the plan. Thinking, logic, and creativity: your best allies to break the loop!","*;, French;*;*",1,12,,2025-07-25
game,Brew or Die,3893830,Crooked Road,LT-Games,,Single-player;Custom Volume Controls;Keyboard Only Option;Mouse Only Option;Stereo Sound;Family Sharing,Adventure;Indie;RPG;Early Access,https://store.steampowered.com/app/3893830,public_unreleased,full_details,False,Coming soon,"Brew or Die – an RPG game with TBS elements, where potion brewing is a matter of life, duty, and... possible wealth!",English;French;Italian;German;Spanish - Spain;Portuguese - Brazil;Russian,2,24,,2025-07-25
game,封神演义沙盘模拟器,3895300,GUO CHENGHAO,GUO CHENGHAO,,Single-player;Custom Volume Controls;Playable without Timed Input;Save Anytime;Family Sharing,Action;Indie;Simulation,https://store.steampowered.com/app/3895300,public_unreleased,full_details,False,Coming soon,"Command gods and armies in this unique blend of strategy and epic battles! Based on 'The Investiture of the Gods', build cities, train armies, and lead 2,000 soldiers in massive real-time battles. Expand your territory, develop your economy, and unite ancient China in your legendary conquest!",Simplified Chinese,1,11,,2025-07-25
game,Tales of Justice Academy: Winds Arise,3834880,九芽川 Ninth Leaf,九芽川 Ninth Leaf,,Single-player;Steam Achievements;Custom Volume Controls;Adjustable Difficulty;Mouse Only Option;Playable without Timed Input;Save Anytime;Steam Cloud;Family Sharing,Adventure;Casual;Indie;RPG;Simulation;Strategy,https://store.steampowered.com/app/3834880,public_unreleased,full_details,False,Q1 2026,"You can play as a young martial artist entering Justice Academy. Train through various courses, customize your build with different weapons, skills, and inner techniques. Explore the jianghu, bond with companions, and shape your fate across branching stories and three romanceable heroines.",English;Japanese;Simplified Chinese;Traditional Chinese,11,132,,2025-07-25
game,Dungeon Cleaners,3756600,Baguette Games,Baguette Games,,Multi-player;Co-op;Online Co-op;Family Sharing,Action;Adventure;Indie,https://store.steampowered.com/app/3756600,public_unreleased,full_details,False,Coming soon,They came; they died. Now it's your job to clean up their mess.,"*;, French;*;*",1,11,,2025-07-25
dlc,TerraScape Ancient Egypt,3868750,Bitfall Studios,Stray Fawn;INSTINCT3,https://terrascape.de/,Single-player;Multi-player;PvP;Online PvP;LAN PvP;Co-op;Online Co-op;LAN Co-op;Downloadable Content;Steam Achievements;Full controller support;Adjustable Text Size;Camera Comfort;Custom Volume Controls;Adjustable Difficulty;Mouse Only Option;Playable without Timed Input;Save Anytime;Stereo Sound;Surround Sound;Touch Only Option;Steam Cloud;Steam Leaderboards;Family Sharing,Casual;Indie;Simulation;Strategy,https://store.steampowered.com/app/3868750,public_unreleased,full_details,False,Q4 2025,"Expand your kingdom-building adventure in TerraScape Ancient Egypt! Master the sands by crafting irrigation systems to nourish the land, then raise mighty monuments under the desert sun. Discover new resources and mechanics as you lead your settlement to pharaonic glory. Will your legacy endure?",English;German;French;Italian;Spanish - Spain;Dutch;Japanese;Korean;Polish;Portuguese - Brazil;Russian;Simplified Chinese,,,,2025-07-25
game,Sea Hotel : Fish Scales,3864070,LionHead,LionHead,,Single-player;Steam Cloud;Family Sharing,Casual;Indie,https://store.steampowered.com/app/3864070,public_unreleased,full_details,False,Coming soon,"Experience the laid‑back joy of fishing in **Sea Hotel: Fish Scales**! Run your very own floating houseboat, explore uniquely themed ocean zones, and fully customize both your vessel and your character. Climb aboard now and embark on a deep‑sea fishing adventure that’s as stylish as it is relaxing!",English;Simplified Chinese,1,14,,2025-07-25
game,Another Shoplifting Simulator,3897440,Adam Kormos,Adam Kormos,,Single-player;Multi-player;Co-op;Online Co-op;Steam Achievements;Full controller support;Custom Volume Controls;Playable without Timed Input;Stats;Steam Leaderboards;Family Sharing,Casual;Indie;Simulation;Strategy,https://store.steampowered.com/app/3897440,public_unreleased,full_details,False,2026,"Pocket snacks. Dodge guards. Profit. Sneak your way through the store as the shoplifter to make enough money, with the goal doubling daily in this casual FPS simulator!",*;*,1,14,,2025-07-25
game,Pseudo World,3577440,Professional Bad Guys,Professional Bad Guys,,Single-player;Full controller support;Family Sharing,Action;Adventure;Indie;RPG,https://store.steampowered.com/app/3577440,public_unreleased,full_details,False,April 2026,"Roll your own story in Pseudo World, a third-person, endless-world ARPG with procedurally generated quests. Recruit any NPC into your party, for better or worse, and be the ""hero"" that Lan Redic needs!",English,1,11,,2025-07-25
demo,Desktown Demo,3898960,Deskteam,Deskteam,,Single-player;Game demo;Custom Volume Controls;Save Anytime;Steam Cloud,Casual;Indie;Simulation,https://store.steampowered.com/app/3898960,public_unreleased,full_details,False,July 2025,"A minimalist city-builder that sits on the bottom of your screen! Gather resources, set timers, and decorate your town while you do other activities.","*;, French;*;, German;*;, Spanish - Spain;*;, Indonesian;*;, Japanese;*;, Korean;*;, Portuguese - Brazil;*;, Russian;*;, Simplified Chinese;*;*",,,,2025-07-25
game,XETTER 2020,3609670,Ken'ichi Kuromusha,Ken'ichi Kuromusha,https://xetter.com/,Single-player;Partial Controller Support,Action;Free To Play,https://store.steampowered.com/app/3609670,public_unreleased,full_details,False,Coming soon,"Collect all the dots to clear each of the 30 action-puzzle scenes. Dodge two types of enemies, drop blocks to crush them, and avoid being crushed yourself. Use limited lives wisely, restart levels when needed, and unlock cleared scenes for replay. Can you beat them all?",English,2,22,,2025-07-25
game,Nakuma,3875920,Vision Interactive,Vision Interactive,,Single-player,RPG;Free To Play,https://store.steampowered.com/app/3875920,public_unreleased,full_details,False,"Aug 14, 2025","Nakuma is a singleplayer RPG with focus on grinding for gear and experience points. Obtain a variety of magical spells, upgrade your gear and invest stat-points as you progress!",*;*,1,11,,2025-07-25
game,Barrel Roll,3860590,Barrel Roll,Rubika,,Single-player;Family Sharing,Action;Indie;Strategy,https://store.steampowered.com/app/3860590,public_unreleased,full_details,False,Coming soon,"Barrel Roll is a turn based, roguelike, taking place in a futuristic far west. Gather bullets with special effects, customize your revolver's barrel to create strong synergies and take down as much criminal as you can. Don't forget to reload... If you have to of course !",*;*,6,66,,2025-07-25
game,Open Robot,3795000,Loomeit Studios,Loomeit Studios,https://www.loomeit.com/games/open-robot/,Single-player;Full controller support;Adjustable Text Size;Custom Volume Controls;Playable without Timed Input;Stereo Sound;Subtitle Options;Surround Sound;Family Sharing,Action;Adventure;Indie,https://store.steampowered.com/app/3795000,public_unreleased,full_details,False,Coming soon,"Experience the world of Open Robot in its debut episode. Fight back, explore the island and meet its characters in this quest-driven open world experience.",English,1,11,,2025-07-25
demo,Monitoring All Night Demo,3877490,PICKY / Jamila,Jamila(Single Item),,Single-player;Game demo;Camera Comfort;Custom Volume Controls;Keyboard Only Option;Mouse Only Option,Indie,https://store.steampowered.com/app/3877490,public_unreleased,full_details,False,Coming soon,"""Monitoring All Night"" is a horror-style game with no jump scares, so even those who are not good at horror can play with confidence. Report any unusual events appropriately and survive until the end of your shift! And watch out for the aliens!👽",English;Japanese,,,,2025-07-25
game,SCHOOL EXIT CLASS 8,3887110,J★PRODUCTION,J★PRODUCTION,,Single-player;Full controller support;Camera Comfort;Custom Volume Controls;Keyboard Only Option;Mouse Only Option;Family Sharing,Adventure,https://store.steampowered.com/app/3887110,public_unreleased,full_details,False,August 2025,"An ""Exit 8""-style anomaly-hunting horror game. In a haunted school, if something feels off—turn back. Classrooms, restrooms, the nurse’s office—nothing is quite right. The closer you get to the exit, the more your memory—and your self—begin to distort.",*;*,1,12,,2025-07-25
game,Clean Break,3828850,Benjamin Pilbrow,Benjamin Pilbrow,,Single-player;Steam Achievements;Full controller support;Custom Volume Controls;Playable without Timed Input;Save Anytime;Stereo Sound;Steam Cloud,Action;Adventure;Indie;Free To Play,https://store.steampowered.com/app/3828850,public_unreleased,full_details,False,"Aug 7, 2025",Explore a quiet house. Destroy any furniture that seems... off. Don’t think too hard. Break to your heart's content. This is just a bit of decluttering. Probably.,*;*,1,11,,2025-07-25
game,Outlive 25,2948680,Continuum Entertainment,Nuuvem,https://continuum.com.br/,Single-player;Multi-player;PvP;Online PvP;Co-op;Online Co-op;Family Sharing,Action;Simulation;Strategy,https://store.steampowered.com/app/2948680,public_unreleased,full_details,False,2025,"Build your base, prepare your troops, and face your most epic battle yet in this old-school real-time strategy game. Choose between two factions, test your skills in three epic campaigns and engage in online battles with up to 16 players simultaneously.","*;, Portuguese - Brazil;*;*",22,242,,2025-07-25
game,Drone District,3745400,Super Duper Vibes,Super Duper Vibes,,Single-player;Full controller support;Family Sharing,Action;Racing;Simulation,https://store.steampowered.com/app/3745400,public_unreleased,full_details,False,2025,"Drone District is an adrenaline-charged FPV arcade experience that mashes up the flow of Tony Hawk’s Pro Skater with the freedom of Burnout Paradise—but with drones. Master flight tricks, grind power lines, launch off rooftops, chain mid-air stunts, and explore an open world.",English,4,44,,2025-07-25
game,Epoch Spire,3806300,Prototaxite Productions,Prototaxite Productions,,Single-player;Custom Volume Controls;Playable without Timed Input;Stereo Sound;Surround Sound;Partial Controller Support,Action;Adventure;Indie;Free To Play,https://store.steampowered.com/app/3806300,public_unreleased,full_details,False,"Aug 18, 2025","Epoch Spire is a first-person shooter roguelike, where players improve by discovering and understanding the secrets of a spire on an alien planet.",English,1,11,,2025-07-25
game,Fall Or Nothing,3877980,Frogman Games,Frogman Games,,Single-player;Custom Volume Controls;Playable without Timed Input;Family Sharing,Casual;Indie;Racing,https://store.steampowered.com/app/3877980,public_unreleased,full_details,False,"Aug 29, 2025",Set the time trial world record in falling by guiding your stuntman through narrow gaps and launching them off of gnarly ramps as they rocket down a hill. Trade off with a friend to see who can slap the fastest time on the leaderboard and bop along to a most radical 80s synth score.,*;*,2,28,,2025-07-25
game,Rhino Express,3901520,SebGameDev,SebGameDev,,Single-player;Steam Achievements;Full controller support;Custom Volume Controls;Keyboard Only Option;Playable without Timed Input;Save Anytime;Steam Cloud;Family Sharing,Action;Casual;Indie,https://store.steampowered.com/app/3901520,public_unreleased,full_details,False,Coming soon,"Lost under the red sun, a rhino must deliver packages across the savanna! 🦏📦 Help our rhino through fun puzzle challenges where every step counts. Can you help complete all deliveries? ☀️",English,1,11,,2025-07-25
game,Amanita,3880050,Gibberi Games,Gibberi Games,,Single-player;Full controller support;Family Sharing,Action;Adventure;Indie;Strategy,https://store.steampowered.com/app/3880050,public_unreleased,full_details,False,Q4 2025,"Amanita is an introspective journey into your mind where the path seems to be only one, and it does not seem to be easy. Let yourself be guided by surreal characters in your thoughts, clash with your memories with sword blows, wander in your memory, play cards with your fears.",English;Italian;Spanish - Spain,2,22,,2025-07-25
game,Legendary Tomb digger,3816080,Tide Studio,Tide Studio,,Single-player;Steam Achievements;Captions available;Family Sharing,Adventure;Indie;Early Access,https://store.steampowered.com/app/3816080,public_unreleased,full_details,False,To be announced,"Legendary Tomb digger is a single player digger adventure game, You will play as a veteran tomb robbery expert, delving into a frozen ancient Arctic tomb. Dig deep to collect treasures from the tomb, sell them to purchase and upgrade tomb-raiding equipments, and search for a priceless secret.",English;Russian;Simplified Chinese;Traditional Chinese,2,24,,2025-07-25
game,Bit Buddy,3874950,Joe Zane,Joe Zane,,Single-player;Steam Achievements;Steam Cloud;Family Sharing,Casual,https://store.steampowered.com/app/3874950,public_unreleased,full_details,False,August 2025,"Bit Buddy reacts in real-time to your keyboard and mouse activity. Every click and movement brings an adorable response from your little companion. Even better, each interaction gives you a chance to unlock new decorations, with no extra effort required!",English;French;Italian;German;Spanish - Spain;Japanese;Simplified Chinese;Traditional Chinese;Russian;Turkish;Polish;Thai;Portuguese - Brazil;Vietnamese;Korean,1,14,,2025-07-25
game,Anime Dream Match: Birds,3900040,Blender Games,Blender Games,,Single-player;Steam Achievements;Camera Comfort;Custom Volume Controls;Mouse Only Option;Playable without Timed Input;Stereo Sound;Steam Cloud;Family Sharing,Casual;Indie,https://store.steampowered.com/app/3900040,public_unreleased,full_details,False,"Aug 6, 2025",A charming and relaxing memory game where you match pairs of adorable anime birds.,"*;, French;*;, Italian;*;, German;*;, Spanish - Spain;*;, Arabic;*;, Bulgarian;*;, Vietnamese;*;, Greek;*;, Danish;*;, Simplified Chinese;*;, Traditional Chinese;*;, Korean;*;, Norwegian;*;, Dutch;*;, Polish;*;, Portuguese - Brazil;*;, Portuguese - Portugal;*;, Russian;*;, Romanian;*;, Thai;*;, Turkish;*;, Hungarian;*;, Ukrainian;*;, Finnish;*;, Czech;*;, Swedish;*;, Japanese;*;, Indonesian;*;, Spanish - Latin America;*;, Azerbaijani;*;, Albanian;*;, Amharic;*;, Assamese;*;, Afrikaans;*;, Basque;*;, Bangla;*;, Bosnian;*;, Belarusian;*;, Valencian;*;, Welsh;*;, Wolof;*;, Armenian;*;, Galician;*;, Georgian;*;, Gujarati;*;, Hindi;*;, Dari;*;, Estonian;*;, Zulu;*;, Yoruba;*;, Kazakh;*;, Kannada;*;, Catalan;*;, Quechua;*;, Kyrgyz;*;, Konkani;*;, Khmer;*;, Xhosa;*;, K'iche';*;, Latvian;*;, Lithuanian;*;, Luxembourgish;*;, Macedonian;*;, Malay;*;, Malayalam;*;, Maltese;*;, Maori;*;, Marathi;*;, Mongolian;*;, Nepali;*;, Odia;*;, Punjabi (Shahmukhi);*;, Punjabi (Gurmukhi);*;, Persian;*;, Kinyarwanda;*;, Serbian;*;, Sotho;*;, Sinhala;*;, Sindhi;*;, Scots;*;, Slovak;*;, Slovenian;*;, Sorani;*;, Swahili;*;, Tajik;*;, Tamil;*;, Tatar;*;, Telugu;*;, Tigrinya;*;, Tswana;*;, Turkmen;*;, Uzbek;*;, Uyghur;*;, Urdu;*;, Filipino;*;, Hausa;*;, Croatian;*;, Cherokee;*;, Hebrew;*;, Irish;*;, Icelandic;*;, Igbo;*;*",1,14,,2025-07-25
game,Kevin Toms Football Star Manager,3707550,Kevin Toms,Curveball Games,,Single-player;Steam Cloud;Family Sharing,Casual;Simulation;Sports;Strategy,https://store.steampowered.com/app/3707550,public_unreleased,full_details,False,"Aug 14, 2025","The original retro-­styled football management game remade and re-released in 2025. It's a faithful recreation of Kevin Toms groundbreaking 1982 Football Manager, the title that effectively launched the football-management genre.",English,1,14,,2025-07-25
game,NO BACKUP,3894440,NOBACKUP DEV,NOBACKUP DEV,,Single-player;Multi-player;Co-op;Online Co-op;Family Sharing,Action;Indie;Early Access,https://store.steampowered.com/app/3894440,public_unreleased,full_details,False,Coming soon,"Escape together — or die alone. In this intense co-op bodycam horror game, you and your team are hunted by a relentless creature. Communicate, stay quiet, and fight to survive. Every move counts. Every sound could be your last.","*;, French, Italian, German, Spanish - Spain, Arabic, Portuguese - Brazil, Bulgarian, Traditional Chinese, Simplified Chinese, Danish, Finnish, Greek, Indonesian, Japanese, Korean, Dutch, Norwegian, Polish, Portuguese - Portugal, Romanian, Russian, Swedish, Spanish - Latin America, Thai, Czech, Turkish, Ukrainian, Hungarian, Vietnamese, Afrikaans, Albanian, Amharic, Armenian, Azerbaijani, Assamese, Basque, Belarusian, Bangla, Bosnian, Cherokee, Dari, Estonian, Filipino, Galician, Georgian, Gujarati, Hausa, Hebrew, Hindi, Igbo, Irish, Icelandic, Kannada, Kazakh, Catalan, Quechua, Khmer, Kinyarwanda, Kyrgyz, Konkani, Croatian, K'iche', Latvian, Lithuanian, Luxembourgish, Malayalam, Malay, Maltese, Maori, Marathi, Macedonian, Mongolian, Nepali, Odia, Punjabi (Gurmukhi), Punjabi (Shahmukhi), Persian, Scots, Serbian, Sindhi, Sinhala, Slovak, Slovenian, Sorani, Sotho, Swahili, Tajik, Tamil, Tatar, Telugu, Tigrinya, Tswana, Turkmen, Uyghur, Urdu, Uzbek, Valencian, Welsh, Wolof, Yoruba, Zulu, Xhosa;*",38,418,,2025-07-25
game,Contraria,3672210,HellYeah!,TBC,,Single-player;Steam Achievements;Full controller support;Family Sharing,Adventure;Indie,https://store.steampowered.com/app/3672210,public_unreleased,full_details,False,Coming soon,"Step into the shadows of Contraria where Step into the shadows of Contraria, solve 3D puzzles and collect ProtoCores while crew logs whisper from another time—or maybe another reality. Keep solving. Keep looping. Until the final room. The Answer… or just another Question.",English,1,12,,2025-07-25
demo,Path of the Bogatyr: Prologue,3903150,RUzura Interactive,Flex Turtle,,Single-player;Game demo;Custom Volume Controls;Keyboard Only Option;Mouse Only Option;Playable without Timed Input;Save Anytime;Touch Only Option;Steam Cloud,,https://store.steampowered.com/app/3903150,public_unreleased,full_details,False,"Oct 12, 2025",,English;Russian,,,,2025-07-25
game,Memento Machinam,3502260,MediaCity Games,MediaCity Games,https://www.mementomachinam.com/,Single-player;Steam Achievements;Full controller support;Family Sharing,Action;Adventure,https://store.steampowered.com/app/3502260,public_unreleased,full_details,False,Coming soon,"A cyberpunk survival horror set in a dystopian city devastated by a biomechanical malware outbreak. Fight deadly enemies and bosses, solve puzzles, and explore a world consumed by corruption. Classic survival horror mechanics meet modern innovations in a relentless fight for survival.","*;, French, Italian, German, Spanish - Spain, Simplified Chinese, Korean, Japanese;*",1,11,,2025-07-25
game,Mistbound Hearts — Season 1,2972850,Zhady,Zhady,,Single-player;Family Sharing,Indie;RPG;Early Access,https://store.steampowered.com/app/2972850,public_unreleased,full_details,False,Coming soon,"In a world fractured by a maddening Mist, every day is a struggle for survival, and trust is a rarer commodity than gold. You are a simple tavern boy from a backwater hamlet, content with your mundane life. But your life, and from those around you, are about to change.",English,3,36,,2025-07-25
dlc,Kasane Teto DLC,3681410,infiniteloop,infiniteloop,https://www.infiniteloop.co.jp/desktopmate/,Downloadable Content,Free To Play;Animation & Modeling;Utilities,https://store.steampowered.com/app/3681410,public_unreleased,full_details,False,Coming soon,"Kasane Teto Finally Arrives on Desktop Mate! Responding to passionate requests from the Steam community and inquiries for ""Kasane Teto implementation,"" we are thrilled to announce that Kasane Teto is now available as DLC for Desktop Mate!","*;, English;*",,,,2025-07-25
game,コ、今に在り - Ko ima ni ari,3517100,314isme;YoHokki;Tohomoko,Gray Owl,,Single-player,Casual;Free To Play,https://store.steampowered.com/app/3517100,public_unreleased,full_details,False,"Jul 31, 2025","Ko ima ni ari is an interactive story-driven game about the past, present and future of someone loosing slowly their sight.",English,3,42,,2025-07-25
game,WOODROT,3896040,The Midnight Token,The Midnight Token,,Single-player;Full controller support;Custom Volume Controls;Playable without Timed Input;Save Anytime;Stereo Sound;Family Sharing,Adventure,https://store.steampowered.com/app/3896040,public_unreleased,full_details,False,Coming soon,You're the maintenance man for an apartment complex that has mysteriously been transported to the middle of the ocean. Woodrot is a surreal adventure game about getting to know your neighbors who all seem to blame themselves for their recent relocation.,"*;, German;*;, Japanese;*;, Spanish - Latin America;*;*",,,,2025-07-25
game,687 Days on Mars,3850980,Games Incubator;Frozen Cave Studio,Games Incubator;PlayWay S.A.,https://games-i.com/,Single-player;Steam Achievements;Full controller support;Family Sharing,Action;Adventure;Casual;Indie;Simulation,https://store.steampowered.com/app/3850980,public_unreleased,full_details,False,2025,"687 Days on Mars is a survival game where you are stranded alone on Mars - your task is to manage resources, build a base from scratch, grow food, and explore the red planet in search of supplies and other hidden challenges. Every breath and decision counts - can you survive on the Red Planet?","*;, French, Italian, German, Spanish - Spain, Japanese, Korean, Polish, Portuguese - Brazil, Russian, Simplified Chinese, Traditional Chinese, Turkish;*",,,,2025-07-25
demo,Crisis of DreamCell - Demo,3277020,Dark Star Games,Dark Star Games,,Single-player;Game demo;Captions available;Camera Comfort;Custom Volume Controls;Playable without Timed Input;Stereo Sound;Subtitle Options;Partial Controller Support,,https://store.steampowered.com/app/3277020,public_unreleased,full_details,False,Coming soon,,*;*,,,,2025-07-25
demo,Doctor Dreams Simulator Demo,3900630,Papu's Studio,Papu's Studio,,Single-player;Game demo;Steam Achievements;Custom Volume Controls;Save Anytime;Stereo Sound;Surround Sound;Steam Cloud,Action;Adventure;Simulation,https://store.steampowered.com/app/3900630,public_unreleased,full_details,False,"Aug 20, 2025","Face an advanced AI, exterminate the chaos in your patients' dreams, manage your clinic, and use stealth to infiltrate the rival clinic and stop their dark plan.",English;Spanish - Spain;Simplified Chinese,,,,2025-07-25
game,Grim Axiom,3882150,Rare Soup,Rare Soup,,Single-player;Full controller support;Custom Volume Controls;Playable without Timed Input;Stereo Sound;Family Sharing,Action;Adventure;Indie,https://store.steampowered.com/app/3882150,public_unreleased,full_details,False,To be announced,"Enter a dark underground world in this soulslike adventure-horror game where undead monsters lurk around every corner, and uncover the mystery behind the ancient machines operating in its depths.",*;*,1,11,,2025-07-25
dlc,Mr. Prepper - Uranium Project DLC,3864310,Rejected Games,PlayWay S.A.;Rejected Games,,Single-player;Downloadable Content;Steam Achievements;Steam Trading Cards;Captions available;Custom Volume Controls;Adjustable Difficulty;Mouse Only Option;Save Anytime;Stereo Sound;Subtitle Options;Steam Cloud;Stats;Includes level editor;Remote Play on Tablet;Family Sharing,Action;Adventure;Casual;Indie;RPG;Simulation,https://store.steampowered.com/app/3864310,public_unreleased,full_details,False,"Sep 26, 2025","Gain access to a long-abandoned nuclear power plant, manage unstable uranium to craft powerful tools and weapons, advance through a new storyline, and decorate your bunker in a whole new way!","*;, Polish, French, German, Russian, Spanish - Spain, Turkish, Simplified Chinese, Dutch, Japanese, Italian, Portuguese - Brazil, Korean, Czech;*",,,,2025-07-25
