type,name,steam_appid,developers,publishers,website,categories,genres,steam_url,detection_stage,api_response_type,potential_duplicate,release_date,description,supported_languages,followers,wishlists_est,wishlist_rank,discovery_date
game,Reforest,3878640,KGAME,KGAME,,Single-player;Steam Achievements;Camera Comfort;Custom Volume Controls;Adjustable Difficulty;Playable without Timed Input;Save Anytime;Family Sharing,Casual;Indie;Simulation;Early Access,https://store.steampowered.com/app/3878640,public_unreleased,full_details,False,Coming soon,"You've inherited a tired farm, brimming with potential. Restore, cultivate, explore, and transform what's left into something yours—in your own time, at your own pace. Clean the pond, plant where there used to be weeds and discover, step by step, the beauty that still resides there.",Portuguese - Brazil,,,,2025-07-25
game,Buko Boko,3803390,Harmoen,Harmoen,,Single-player,Casual;Free To Play,https://store.steampowered.com/app/3803390,public_unreleased,full_details,False,Q3 2025,"Incremental Games inside an incremental game! In Buko Boko you'll collect tokens to spend on unlocking and upgrading new games, and completing their challenges.",English,,,,2025-07-25
game,The Calamity Trials,3877630,Deme Nowa,Deme Nowa,,Single-player,Action;Simulation;Free To Play,https://store.steampowered.com/app/3877630,public_unreleased,full_details,False,2025,"Complete platform parkour featuring multiple unique weapons and obstacles while IT chases you. These weapons will increase speed, or become another obstacle you must overcome.",*;*,,,,2025-07-25
game,Misdecayed,3900160,Hajimeli,Hajimeli,https://hajimeli.net/misdecayed,Single-player;Partial Controller Support;Family Sharing,Adventure;Indie;RPG,https://store.steampowered.com/app/3900160,public_unreleased,full_details,False,To be announced,"An adventure RPG about life, death, rebirth, and robots, from the team that brought you vivid/stasis.",English,,,,2025-07-25
game,Perfect Liar,3894020,eightworks allware,eightworks allware,https://www.eightworks.org/,Single-player;Full controller support;Family Sharing,Action;Indie,https://store.steampowered.com/app/3894020,public_unreleased,full_details,False,Coming soon,live the life of a scoundrel in this fast-paced modern juke-em-up; a bite-sized dose of cortisol combining roguish strategy with the speedrunner’s high.,English;French;Italian;German;Japanese;Korean;Portuguese - Brazil;Russian;Simplified Chinese;Spanish - Latin America,,,,2025-07-25
demo,Anomaly Observer Demo,3903230,Letalis Entertainment,Letalis Entertainment,,Single-player;Game demo;Steam Achievements;Adjustable Difficulty;Playable without Timed Input;Stereo Sound;Steam Cloud;Steam Leaderboards,,https://store.steampowered.com/app/3903230,public_unreleased,full_details,False,Coming soon,,"*;, French, Italian, German, Spanish - Spain, Portuguese - Brazil, Japanese, Korean, Polish, Russian, Simplified Chinese, Czech;*",,,,2025-07-25
demo,Slightly Overweight Superhero and the seven levels of death Demo,3874570,Nathan Laird,Spirit Engine Games,,Single-player;Game demo;Full controller support;Playable without Timed Input;Stereo Sound,Action;Adventure;Indie;Racing,https://store.steampowered.com/app/3874570,public_unreleased,full_details,False,"Dec 14, 2025","The year? 2140. The problem? You keep dying. Good news: your soul uploads to the Cloud. Bad news? The Cloud is full of things that want you dead again. This is just the taste test of your chubby superhero saga. Solve riddles, dodge traps, and survive the Seven Levels of Death.","*;, Bulgarian, Russian, Simplified Chinese, Ukrainian, Belarusian, Bosnian, Mongolian, Serbian, Uzbek;*",,,,2025-07-25
game,Pasta House Simulator,3883270,Unimy Studios,Unimy Studios,,Single-player;Family Sharing,Casual;Indie;Simulation,https://store.steampowered.com/app/3883270,public_unreleased,full_details,False,"Aug 15, 2025","A new challenge every day! Stay afloat on a tight budget, deliver orders on time, and be ready for surprise visitors!",English;Turkish,,,,2025-07-25
game,Single Scoop,3631360,CrunchySoft Studios,CrunchySoft Studios,,Single-player;Full controller support;Family Sharing,Action;Casual;Indie,https://store.steampowered.com/app/3631360,public_unreleased,full_details,False,Coming soon,Scoot and shoot to the finish line in this action puzzle game! Time your button press to advance towards the goal. Navigate through a maze of patterns and build your combo meter to break the rules!,English,,,,2025-07-25
dlc,Tentacles Party With Nuns-Chibi 3D high poly(Benson),3485440,Jeannine;Plumko,WeissGarden,,Single-player;Downloadable Content;Steam Achievements,Adventure;Simulation,https://store.steampowered.com/app/3485440,public_unreleased,full_details,False,Q3 2025,"Tentacles Party With Nuns-Chibi 3D high poly Character:Benson Files:Head, Hair, Body...etc STL",English;French;Italian;German;Spanish - Spain;Russian;Japanese;Thai;Simplified Chinese;Traditional Chinese;Dutch;Portuguese - Brazil;Portuguese - Portugal;Spanish - Latin America;Vietnamese;Arabic;Korean;Polish;Danish;Bulgarian;Hungarian;Indonesian;Turkish;Greek;Norwegian;Czech;Ukrainian;Swedish;Romanian;Finnish;Azerbaijani;Armenian;Igbo;Sindhi;Sinhala;Quechua;Croatian;Icelandic;Cherokee;Galician;Catalan;Afrikaans;Hindi;Gujarati;Swahili;Kyrgyz;Kazakh;Georgian;Turkmen;Tamil;K'iche';Tajik;Serbian;Sotho;Odia;Welsh;Konkani;Bangla;Amharic;Nepali;Basque;Hebrew;Kannada;Estonian;Irish;Latvian;Tigrinya;Slovak;Slovenian;Punjabi (Gurmukhi);Punjabi (Shahmukhi);Tswana;Maori;Wolof;Bosnian;Persian;Telugu;Urdu;Uzbek;Valencian;Belarusian;Kinyarwanda;Luxembourgish;Zulu;Xhosa;Lithuanian;Yoruba;Sorani;Uyghur;Filipino;Mongolian;Scots;Hausa;Dari;Albanian;Assamese;Tatar;Malay;Macedonian;Marathi;Malayalam;Maltese;Khmer,,,,2025-07-25
demo,Until the End,3795730,八萩（Yahagi）,八萩（Yahagi）,,Single-player;Game demo;Full controller support;Keyboard Only Option;Mouse Only Option;Playable without Timed Input;Save Anytime;Touch Only Option,Adventure;Casual;Indie,https://store.steampowered.com/app/3795730,public_unreleased,full_details,False,Coming soon,Love remembers you. Even if you’ve forgotten.,English;Japanese;Simplified Chinese,,,,2025-07-25
game,Waifu Quest,3759390,Seppe De Craene;Maxime Versluys,Xpress.gg,,Single-player;Playable without Timed Input;Save Anytime;Steam Cloud,Casual;Indie;Free To Play,https://store.steampowered.com/app/3759390,public_unreleased,full_details,False,Coming soon,"Your adorable waifu lives on your taskbar, always by your side as you work, browse, or game. Customize her look with cute accessories and enjoy her calming presence throughout your day.",*;*,,,,2025-07-25
game,神游课本,3825960,DayDayDreamers,DayDayDreamers,,Single-player;Custom Volume Controls;Mouse Only Option;Playable without Timed Input;Save Anytime,Casual;Indie;Simulation;Free To Play,https://store.steampowered.com/app/3825960,public_unreleased,full_details,False,Q3 2025,这是一本献给所有小朋友以及童心未泯者的互动解谜书！你将重回儿时的课桌，在语文、数学、英语的课本中畅游。动动脑袋，点点鼠标，破解谜题，收获乐趣！书里还有各种趣味插画和故事，大小朋友们都来试试吧！,*;*,,,,2025-07-25
game,A One-Week Wife,3893240,纯洁猫猫,纯洁猫猫,,Single-player;Steam Achievements;Full controller support;Captions available;Custom Volume Controls;Keyboard Only Option;Mouse Only Option;Save Anytime;Steam Cloud;Remote Play on TV;HDR available;Family Sharing,Adventure;Casual;RPG;Simulation,https://store.steampowered.com/app/3893240,public_unreleased,full_details,False,Q4 2025,A story-driven hidden object game. She forgets you every week.And reality begins to fall apart. 8 endings. 15 dynamic backgrounds. 200+ strange items.,English;French;Italian;German;Spanish - Spain;Japanese;Simplified Chinese;Traditional Chinese;Portuguese - Portugal;Korean,,,,2025-07-25
game,Desktop Raid,3122460,Lee_Studio,Lee_Studio,,Single-player;Family Sharing,Adventure;Casual;RPG,https://store.steampowered.com/app/3122460,public_unreleased,full_details,False,Q4 2025,"Assemble your adventure squad on the desktop! Classic RPG meets idle play—no grind, no stress, just nonstop progress. Your heroes fight, level up, and loot while you work or study. Explore rich classes, powerful skills, and thrilling gear drops. RPG excitement, anytime, anywhere!",Simplified Chinese;English;Traditional Chinese,,,,2025-07-25
game,The Shores of Stellaluna,3688220,Waite Industries,Waite Industries,,Single-player;Camera Comfort;Family Sharing,Adventure,https://store.steampowered.com/app/3688220,public_unreleased,full_details,False,Q2 2026,"Sail a fractured world. Battle through dangerous dungeons, Stack powerful abilities, Rebuild cities, Manage trade, Survive ever-changing islands to gather lumen, get more powerful and shape the fate of a broken world in this first person craft and build focused RPG with a strong storyline.",*;*,,,,2025-07-25
game,Sniperbot: The Hype Game,3897100,RLUX Studios,RLUX Studios,https://sniper-bot.com,Single-player;Full controller support;Family Sharing,Action;Indie,https://store.steampowered.com/app/3897100,public_unreleased,full_details,False,To be announced,"SNIPERBOT: THE HYPE GAME is a retro styled action platformer where the player traverses through the cybertech world of Meta Metro where Hypebeasts run wild, clout is currency and the only way to survive is attacking your enemies and fighting boss battles with a blaster and sword.",English,,,,2025-07-25
game,Chess of Mana,3778350,Monk Monkey,Monk Monkey,https://chess-of-mana.monkmonkey.com.br/pt-BR?_xm=215931.339614242518859790,Single-player;Multi-player;PvP;Shared/Split Screen PvP;Shared/Split Screen;Full controller support;Camera Comfort;Custom Volume Controls;Adjustable Difficulty;Mouse Only Option;Family Sharing,Indie;Strategy,https://store.steampowered.com/app/3778350,public_unreleased,full_details,False,Coming soon,"Now Celts and Orcs face off in a chess battle where fallen warriors can be revived by the Mana of the Kings! Choose your side of the battlefield—uh, we mean the board—plot the best strategy, use your mana, and defeat the enemy to claim glory!",English;Portuguese - Brazil;Spanish - Latin America,,,,2025-07-25
demo,Uh Oh Airlines Demo,3582760,Bomas Game Studio,Bomas Game Studio,,Single-player;Multi-player;Co-op;Shared/Split Screen Co-op;Shared/Split Screen;Game demo;Full controller support;Camera Comfort;Custom Volume Controls;Playable without Timed Input;Stereo Sound;Remote Play Together,Action;Indie,https://store.steampowered.com/app/3582760,public_unreleased,full_details,False,Coming soon,"Uh Oh Airlines is a silly, casual, single player or couch co-op flight attendant simulator where you and a friend perform normal flight attendant duties, but must also wrangle your passengers to make it through the day.",English,,,,2025-07-25
game,The Death Night Show,3846970,Studio Pathos,Studio Pathos,https://studiopathos.carrd.co/,Single-player;Family Sharing,Indie,https://store.steampowered.com/app/3846970,public_unreleased,full_details,False,To be announced,"The Death Night Show is a narrative game with multiple endings and unlockable scenes where you play as Death's intern in his own late night show. Control the audience's reactions to the events of the program, run errands, and uncover the overarching mystery with each new featured guest.",English,,,,2025-07-25
demo,Over Jump Rally Demo,3898690,Bonsai Rosso,Bonsai Rosso,,Single-player;Game demo;Full controller support;Camera Comfort;Color Alternatives;Custom Volume Controls;Playable without Timed Input;Stereo Sound,Casual;Indie;Racing;Simulation;Sports,https://store.steampowered.com/app/3898690,public_unreleased,full_details,False,Coming soon,"RALLY! Hot blazing sun! Relive arcade racing with Over Jump Rally – an homage to the arcade racing games from the '90s. Unreal Engine 5-powered stunning graphics, nostalgic music, and intuitive controls bring classic racing to a new generation. Easy, right? Maybe!",*;*,,,,2025-07-25
demo,Forester: First Step Demo,3755330,Batareika007,Batareika007,,Single-player;Game demo;Steam Achievements;Playable without Timed Input;Stereo Sound,Adventure;Indie;Simulation,https://store.steampowered.com/app/3755330,public_unreleased,full_details,False,July 2025,"Dive into the events preceding the main plot. Explore the environment, look for items and understand why it is now almost impossible to get out.",English;Russian,,,,2025-07-25
demo,Bru & Boegie: Episode 1 - Get da MILK! Demo,3890500,MIKDOG,MIKDOG,https://www.MIKDOG.com,Single-player;Game demo;Color Alternatives;Custom Volume Controls;Mouse Only Option;Playable without Timed Input;Save Anytime;Stereo Sound;Touch Only Option;Steam Cloud,,https://store.steampowered.com/app/3890500,public_unreleased,full_details,False,Coming soon,Get a generous feel for Bru & Boegie's ridiculous world by playing the demo for 'Bru & Boegie: EPISODE 1 - Get da MILK!',*;*,,,,2025-07-25
game,Tiny Chills - Not From Ear,3878740,Ducktopus Games,Ducktopus Games,,Single-player;Full controller support;Family Sharing,Indie,https://store.steampowered.com/app/3878740,public_unreleased,full_details,False,2025,Tiny Chills - Not from Ear is a short Atmospheric Body Horror game in which you clean people's Ears as you uncover a grotesque and unnatural mystery,English,,,,2025-07-25
game,Dark Land,3889450,HDGames,HDGames,,Single-player;Multi-player;Co-op;LAN Co-op;Family Sharing,Action;Adventure;Indie;RPG,https://store.steampowered.com/app/3889450,public_unreleased,full_details,False,To be announced,"Battle against the dark forces that have plunged the world into chaos. Experience an action-packed journey solo or in online/offline co-op mode. Fight, survive, and complete quests across a cursed land. Will you rise as a hero, or fall into the shadows?",English;Vietnamese,,,,2025-07-25
game,造梦西游：无双,3867950,造梦工作室,造梦工作室,,Single-player,Action;Adventure;RPG;Free To Play,https://store.steampowered.com/app/3867950,public_unreleased,full_details,False,Coming soon,"Journey to the West: Unparalleled ""is an adventure RPG based on the theme of Journey to the West. It tells the story of seven demon kings causing chaos, and Wukong adventuring to defeat them and protect Dongsheng Shenzhou.",*;*,,,,2025-07-25
game,Nachtmahr,3900740,"Mangy Goblin Games, LLC","Mangy Goblin Games, LLC",https://mangygoblingames.com/game/nachtmahr/,Single-player;Steam Achievements;Full controller support;Camera Comfort;Color Alternatives;Custom Volume Controls;Save Anytime;Stereo Sound;Steam Cloud;HDR available;Family Sharing,Adventure;Casual;Indie,https://store.steampowered.com/app/3900740,public_unreleased,full_details,False,Q3 2025,"Nachtmahr is a third-person adventure where you play as a magical unicorn, exploring five realms filled with puzzles, collectibles, and secrets. Uncover a poetic story as you journey through a world of wonder and magic.","*;, French, Italian, German, Portuguese - Brazil, Spanish - Latin America;*",,,,2025-07-25
game,Battle Frontier,3883330,Sky-E Red Games,Sky-E Red Games,https://skyeredgames.de/,Single-player;Multi-player;PvP;Online PvP;Co-op;Online Co-op;Steam Achievements;Full controller support;Stats;Remote Play Together;HDR available;Family Sharing;Steam Timeline,Action;Adventure;Indie;RPG,https://store.steampowered.com/app/3883330,public_unreleased,full_details,False,To be announced,"Master deep third-person combat as you explore a world filled with powerful creatures to collect. Merge with your BattleBeasts to unlock their abilities, uncover the mysteries of Almana or dominate the arena in online multiplayer.","*;, French, Italian, German;*;, Spanish - Spain, Japanese, Portuguese - Brazil, Portuguese - Portugal, Russian, Simplified Chinese, Spanish - Latin America, Turkish;*",,,,2025-07-25
game,A Pirate Game About Digging For Treasure And Getting Drunk,3894070,Benito Moises Monagas Rosario,Benito Moises Monagas Rosario,,Single-player;Steam Achievements;Family Sharing,Adventure;Casual;Indie,https://store.steampowered.com/app/3894070,public_unreleased,full_details,False,Coming soon,"A pirate game about digging through a treasure-filled dungeon, which you can then spend on booze at the bar. Collect as much gold as possible and beware of the dangers that lurk in the shadows...",English;Spanish - Spain,,,,2025-07-25
game,Age of Druids,3798340,Dejima Studios,Dejima Studios,https://www.dejimastudios.com/,Single-player;Custom Volume Controls;Adjustable Difficulty;Playable without Timed Input;Save Anytime;Family Sharing,Indie;Simulation;Strategy,https://store.steampowered.com/app/3798340,public_unreleased,full_details,False,2026,"Age of Druids is a historical turn-based strategy game, based on the Roman conquest of Britannia. Lead your Roman legions or Celtic tribes in operational level tactical campaigns to decide the fate of the Britons and walk in the footsteps of Julius Caesar and Boudicca.",*;*,,,,2025-07-25
game,Misty Island: The Forgotten Story,3873620,XiangFeng Li,XiangFeng Li,,Single-player;Family Sharing,Action;Adventure;Indie;RPG,https://store.steampowered.com/app/3873620,public_unreleased,full_details,False,Coming soon,"On this island perpetually shrouded in mist, time seems to condense into damp droplets, with every breeze whispering untold secrets. This action RPG introduces survival mechanics where hunger gradually sets in over time, demanding careful resource management and strategic use of skills.",English;Simplified Chinese,,,,2025-07-25
game,Dominated by: Yandere Goth Weeb Girlfriend,3897670,Bully Revenge Studios,Bully Revenge Studios,,Single-player;Steam Achievements;Custom Volume Controls;Mouse Only Option;Playable without Timed Input;Save Anytime;Family Sharing,Indie;Simulation,https://store.steampowered.com/app/3897670,public_unreleased,full_details,False,"Aug 7, 2025","Experience what it's like to have a giant, sadistic, yandere goth weeb girlfriend that bullies you all day long every day.",English;French;Italian;German;Spanish - Spain;Arabic;Bulgarian;Czech;Danish;Dutch;Finnish;Greek;Hungarian;Indonesian;Japanese;Korean;Norwegian;Polish;Portuguese - Brazil;Romanian;Russian;Simplified Chinese;Swedish;Thai;Traditional Chinese;Turkish;Ukrainian;Vietnamese,,,,2025-07-25
game,Cryptadia Village,3900240,LiviaCryptadia,LiviaCryptadia,,Single-player;Steam Achievements;Family Sharing,Adventure;Casual;Indie;RPG,https://store.steampowered.com/app/3900240,public_unreleased,full_details,False,Coming soon,"Cryptadia Village is a 2D RPG where you follow quests to save a village from dark spirits. Explore an interactive world filled with puzzles and side quests, engage with villagers, and uncover the mysteries of a cozy, magical land full of adventure.",English,,,,2025-07-25
game,Coup d'Koala,3850090,Victor Liu,Victor Liu,,Single-player;Custom Volume Controls;Adjustable Difficulty;Playable without Timed Input;Steam Cloud;Family Sharing,Action;RPG,https://store.steampowered.com/app/3850090,public_unreleased,full_details,False,To be announced,"Seize back the crown in Coup d’Koala, a bullet hell roguelite of furious rebellion. As an exiled koala monarch, unleash spells and steel against relentless undead legions to reclaim your throne. Build your deck of cards, die, upgrade your character, repeat.",English,,,,2025-07-25
demo,Shadow Project Demo,3638110,SK Studios,SK Studios,,Single-player;Game demo;Color Alternatives;Adjustable Difficulty;Playable without Timed Input;Stereo Sound;Partial Controller Support;HDR available,Action;Adventure,https://store.steampowered.com/app/3638110,public_unreleased,full_details,False,"Aug 8, 2025","Shadow Project is a narrative-focused, horror FPS that takes place during the fall of the Soviet Union. Immerse yourself in a world of brutal historical fiction, where the events of the late 20th century have taken a dark turn.","*;, French, Italian, German, Spanish - Spain, Japanese, Portuguese - Brazil, Russian, Simplified Chinese;*",,,,2025-07-25
game,Marshals of Yore,3868490,One Man Horde,One Man Horde,,Single-player;Steam Achievements;Custom Volume Controls;Keyboard Only Option;Mouse Only Option;Playable without Timed Input;Save Anytime;Steam Cloud;Family Sharing,Indie;RPG;Strategy,https://store.steampowered.com/app/3868490,public_unreleased,full_details,False,Coming soon,"Marshals of Yore is a hybrid of three genres: RTS, tower defense, and RPG. It's easy to learn and play. Engage the enemy on 100+ stages. Pick your perks as you level up and win. As you complete stages, you will unlock new and powerful items. Upgrade your units, unlock new marshals, and more.",English,,,,2025-07-25
game,Woe Reigns Unending,3600220,Joshua Sarver,n/a,,Single-player;Family Sharing,RPG,https://store.steampowered.com/app/3600220,public_unreleased,full_details,False,Q3 2027,"Lead a cursed party through a ruined world in this grimdark side-scrolling RPG. Build your team, master tactical combat, and unleash forbidden powers to survive an endless parade of nightmares. Decide what, if anything, is worth salvaging from a world that has been reduced to ashes.",*;*,,,,2025-07-25
game,Flux Empyrean,3843410,ChillCash,ChillCash,,Single-player;Custom Volume Controls;Playable without Timed Input;Save Anytime;Family Sharing,Adventure;Indie;Simulation,https://store.steampowered.com/app/3843410,public_unreleased,full_details,False,Coming soon,"Flux Empyrean is an open-world mystery where knowledge is your only form of progression. Sail a vast ocean planet, navigate by the stars, and uncover a forgotten past. Use instruments and logic to solve mysteries in this atmospheric, narrative-driven exploration game.",*;*,,,,2025-07-25
game,Gun Garden,3673950,NEETNectar,NEETNectar,,Single-player;Family Sharing,Action;Indie,https://store.steampowered.com/app/3673950,public_unreleased,full_details,False,Coming soon,"Gun Garden is a dungeon crawler top-down shooter with rogue-like elements. Explore rooms, find gear, fight enemies, and level up your stats as you progress through the various floors, attempting to find the lost treasure of the Gun Garden.",*;*,,,,2025-07-25
demo,超光速小队 Demo,3848050,Bulletproof Pudding Studio,Bulletproof Pudding Studio,,Single-player;Game demo;Steam Achievements;Adjustable Difficulty;Mouse Only Option;Playable without Timed Input;Save Anytime;Partial Controller Support;Steam Cloud;Stats;Steam Leaderboards,Strategy,https://store.steampowered.com/app/3848050,public_unreleased,full_details,False,"Aug 14, 2025","​​This is a turn-based strategy adventure game. Assemble a five-hero squad, each with unique strengths. Collect mysterious artifacts, build potent hero abilities, defeat powerful monsters, and eliminate galactic threats.​",English;Simplified Chinese,,,,2025-07-25
game,Serpent Rising,3880810,StudyFun,StudyFun,,Single-player;Family Sharing,Strategy,https://store.steampowered.com/app/3880810,public_unreleased,full_details,False,To be announced,"A Realtime Strategy (RTS) game like none before! Attack, defend, build, explore, kidnap, steal, scorch earth, hunt, domesticate animals, evolve or devolve, evade radiation, starvation and predators, be good or evil, as you command your tribe in a post-apocalytic world turned archaic and brutal.",*;*,,,,2025-07-25
game,Tales of Eden: Midgard,3877750,Train wreck studios,Train wreck studios,,Single-player;Custom Volume Controls;Playable without Timed Input;Stereo Sound;Family Sharing,Action;Adventure;Indie;RPG,https://store.steampowered.com/app/3877750,public_unreleased,full_details,False,Coming soon,"Midgard is a single-player, unforgiving, action-RPG with a handcrafted open world steeped in Norse mythology. Encounter intense combat and level up your character's skill sets to fight your way across the kingdoms of Midgard. Save the people from evil as you trade, craft, hunt and fish to survive!",*;*,,,,2025-07-25
game,仿品一號 | Imitation: No.1,3861880,17:00 Workshop,17:00 Workshop,,Single-player;Captions available;Family Sharing,Adventure;Indie,https://store.steampowered.com/app/3861880,public_unreleased,full_details,False,To be announced,"Imitation: No.1 is a first-person 3D puzzle game with a mechanical-craft style. Explore freely, uncover clues, and operate strange machines to create “slides” said to hold the essence of things. Dive into an alchemist’s memory and reveal secrets beyond gold.",English;Japanese;Traditional Chinese,,,,2025-07-25
demo,EmyLiveShow: Beach Days of Sun and Moon Demo,3869050,Team Emily,Team Emily,,Single-player;Game demo,Casual,https://store.steampowered.com/app/3869050,public_unreleased,full_details,False,July 2025,Join the beach games of four charming girls during the day or their dark fetish fantasies at night. Choose your side at the Sun and Moon hotel!,English;Russian;French;Italian;German;Spanish - Spain;Traditional Chinese;Simplified Chinese;Korean;Polish;Portuguese - Brazil;Turkish;Japanese,,,,2025-07-25
demo,LingTian2 Demo: Your Destined Prince,3891050,琴研 Ginyan,琴研 Ginyan,https://www.1000.rainbo.asia,Single-player;Game demo,,https://store.steampowered.com/app/3891050,public_unreleased,full_details,False,"Aug 7, 2025","LingTian 2 is a gorgeous and exquisite otome visual novel game. You are ordinary girl experiencing a sweet royal romance with Prince LingTian of Fang Kingdom! The game features over 1,000 stunning scenes, full voice acting, a main storyline, and 10 interactive sections.","*;, Thai, Traditional Chinese, Turkish, Vietnamese;*",,,,2025-07-25
game,Critical Ops - Dead Zone,3895160,Kâzım KINCI,HYPERMECH,,Single-player;Multi-player;PvP;Online PvP;Co-op;Online Co-op;Family Sharing,Action;Indie;Strategy,https://store.steampowered.com/app/3895160,public_unreleased,full_details,False,To be announced,Critical Ops - Dead Zone is a multiplayer shooter where players must kill enemies to complete specific objectives.,English,,,,2025-07-25
