type,name,steam_appid,developers,publishers,website,categories,genres,steam_url,detection_stage,api_response_type,potential_duplicate,release_date,description,supported_languages,followers,wishlists_est,wishlist_rank,discovery_date
game,SEMO,3858810,Hard Coders,Hard Coders,https://hardcoders.clickn.co.kr/,Single-player;Multi-player;Co-op;Online Co-op;Shared/Split Screen Co-op;Shared/Split Screen;Remote Play Together;Family Sharing,Action;Casual;Indie,https://store.steampowered.com/app/3858810,public_unreleased,full_details,False,Coming soon,Move the SEMO horizontally and jump to hit the circle and make it reach the target point!,English;Japanese;Korean,,,,2025-07-19
game,Slashzone,3885940,Nowhere Exit,Nowhere Exit,,Multi-player;PvP;Online PvP;LAN PvP;Co-op;Online Co-op;LAN Co-op;Cross-Platform Multiplayer;Steam Achievements;Custom Volume Controls;Playable without Timed Input;Stereo Sound;Steam Cloud;Stats;Steam Leaderboards;Family Sharing,Action;Indie,https://store.steampowered.com/app/3885940,public_unreleased,full_details,False,To be announced,"A multiplayer horror game for 5 players. In each round, one becomes the slasher. Work as a team—until you don't. Manipulate, survive, and escape with the most points. Only one will earn their freedom.",*;*,,,,2025-07-19
game,Awakeroots,3882880,LukasD,LukasD,,Single-player;Camera Comfort;Custom Volume Controls;Adjustable Difficulty;Mouse Only Option;Playable without Timed Input;Save Anytime;Family Sharing,Indie,https://store.steampowered.com/app/3882880,public_unreleased,full_details,False,Q4 2025,Awakeroots is a passion project—crafted by two brothers who combine creativity with a deep love for Slavic culture and storytelling. It’s not just a game—it’s a journey into a world that could have been… and now awakens again.,"*;, Polish;*;*",,,,2025-07-19
game,Blackjack Simulator 2025,3887010,FlagmanJeremy,FlagmanJeremy,,Single-player;Steam Achievements;Family Sharing,Casual;Simulation,https://store.steampowered.com/app/3887010,public_unreleased,full_details,False,"Aug 1, 2025",Blackjack Simulator 2025 puts you in position to build your bankroll and experience what it's like to be a competitive blackjack player. Will you succeed or lose all of your money trying?,*;*,,,,2025-07-19
game,睢阳：诗与火,3860310,绘诗社PoetryCanvas,绘诗社PoetryCanvas,,Single-player;Steam Achievements;Custom Volume Controls;Mouse Only Option;Playable without Timed Input;Save Anytime;Steam Cloud;Family Sharing,Adventure;Casual;Indie;RPG,https://store.steampowered.com/app/3860310,public_unreleased,full_details,False,To be announced,唐天宝十一载的上元夜，浮浪子弟韩承业在盛世长安城邂逅一位神秘的贵族少女。三年后，安史之乱爆发。本不可能走到一起的两个人，会被命运的漩涡抛向何处？玩家将经历多个主角生命中一系列的变故，以及，投入到那场中国古代史上最为惨烈的守城战中。是死守，是挽救，还是逃亡？做出你的抉择。,*;*,,,,2025-07-19
game,幸存者小队,3357060,游心,游心,,Single-player;Multi-player;Co-op;Online Co-op;Family Sharing,Adventure;Casual;Indie;Early Access,https://store.steampowered.com/app/3357060,public_unreleased,full_details,False,Coming soon,这是一款多人联机类幸存者游戏，邪恶的恶魔被封印祭坛封印，现在他们蠢蠢欲动。而你，勇者小队，你们是拯救世界的强大力量，强化祭坛的封印，击退恶魔的来袭，你们将重新守护世界的和平。勇者小队将合作击退邪恶怪物的来袭，你们的部分技能有协同效果，寒冰屏障+激光=多重激光！还有许多独特的协同效果等你发现！恶魔祭坛中存在提供封印力量的宝珠，完成祭坛挑战，获取祭坛宝珠，击杀怪物并提升宝珠功能，你将变的越来越强大！来和你的同伴一起封印各个世界中的恶魔吧！,Simplified Chinese,,,,2025-07-19
game,Food Facility,3880880,Lemo-Logic Studios,Lemo-Logic Studios,,Single-player;Steam Achievements;Steam Cloud;Family Sharing,Casual;Indie;Simulation;Strategy,https://store.steampowered.com/app/3880880,public_unreleased,full_details,False,2025,"Food Facility is a 2D factory automation game where you design and build complex production lines to create delicious food, sell your goods, and grow your business empire!",English,,,,2025-07-19
demo,睢阳：诗与火 Demo,3860320,绘诗社PoetryCanvas,绘诗社PoetryCanvas,,Single-player;Game demo;Steam Achievements;Custom Volume Controls;Mouse Only Option;Playable without Timed Input;Save Anytime;Steam Cloud,Adventure;Casual;Indie;RPG,https://store.steampowered.com/app/3860320,public_unreleased,full_details,False,To be announced,唐天宝十一载的上元夜，浮浪子弟韩承业在盛世长安城邂逅一位神秘的贵族少女。三年后，安史之乱爆发。本不可能走到一起的两个人，会被命运的漩涡抛向何处？玩家将经历多个主角生命中一系列的变故，以及，投入到那场中国古代史上最为惨烈的守城战中。是死守，是挽救，还是逃亡？做出你的抉择。,*;*,,,,2025-07-19
music,STOCKWAVE ONLINE Official Soundtrack,3849130,Humano Guy,Humano Guy,,,,https://store.steampowered.com/app/3849130,public_unreleased,full_details,False,To be announced,The official soundtrack pack for STOCKWAVE ONLINE (2025).,,,,,2025-07-19
game,A Spooky Item Game,3669400,Fralf Games,Fralf Games,,Single-player;Steam Achievements;Playable without Timed Input;Stereo Sound;Family Sharing,Adventure;Casual;Indie;Simulation,https://store.steampowered.com/app/3669400,public_unreleased,full_details,False,"Aug 15, 2025","Figure out what type of entity is haunting your object, correctly dispose of it and try not to fall victim to madness. Progress to uncover new hauntings, make it to the end of the week and you might just get yourself a pretty paycheck.",*;*,,,,2025-07-19
game,Alebound,3538800,Minimusmax,Minimusmax,,Single-player;Family Sharing,Action;Indie;Strategy;Early Access,https://store.steampowered.com/app/3538800,public_unreleased,full_details,False,2025,"Alebound is a fast-paced, wave-based action brawler where you play as a battle-hardened dwarf, wielding fists of fury and drunken might. Unleash devastating melee combos, hurl barrels, and harness ale-fueled power-ups to crush relentless waves of orcs and goblins. Survive as long as possible!",*;*,,,,2025-07-19
game,Mad Birds,3865970,Andrei Chakhovich,Anch Dev,,Single-player;Steam Achievements;Mouse Only Option;Playable without Timed Input;Touch Only Option;Steam Cloud;Steam Leaderboards;Family Sharing,Casual;Indie,https://store.steampowered.com/app/3865970,public_unreleased,full_details,False,Coming soon,Mad Birds is a casual physics-based game where the player uses a slingshot to launch birds at opponents and various buildings from the other side to destroy them. Step into the feathered skins of winged avengers whose world has been taken over by greedy monsters!,English;French;Italian;German;Spanish - Spain;Russian;Turkish,,,,2025-07-19
game,FOREST SURVIVAL,3863990,友茘ゲームズ,友茘ゲームズ,,Single-player;Custom Volume Controls;Adjustable Difficulty;Playable without Timed Input;Family Sharing,Action;Indie,https://store.steampowered.com/app/3863990,public_unreleased,full_details,False,To be announced,A 2D survival action game in which the player aims to survive by using a flashlight to illuminate the enemy.,Japanese,,,,2025-07-19
game,W3DGE,3882340,Nephilim,Nephilim,,Single-player;Steam Achievements;Full controller support;Keyboard Only Option;Steam Cloud;Steam Leaderboards;Family Sharing,Action;Indie,https://store.steampowered.com/app/3882340,public_unreleased,full_details,False,September 2025,"W3DGE is a fast-paced, minimalist arcade game about swallowing wedges before they can stab into you. The walls are closing in and the wedges are lined up endlessly in every direction. How long can you survive?",*;*,,,,2025-07-19
game,WTF AM I PLAYING?!,3880350,Meka Games,Meka Games,https://mekagames.net,Single-player;Steam Achievements;Custom Volume Controls;Save Anytime;Stereo Sound;Family Sharing,Action;Adventure;Indie,https://store.steampowered.com/app/3880350,public_unreleased,full_details,False,Coming soon,"Why play this? You could read, run, or stare at a wall. But if you do, expect fast and unpredictable retro FPS action.","*;, French, Italian, German, Spanish - Spain, Simplified Chinese, Japanese, Korean, Spanish - Latin America, Portuguese - Portugal, Russian, Turkish;*",,,,2025-07-19
game,HyakuTyping,3830720,Hyakuren Soft,Hyakuren Soft,,Single-player;Steam Achievements;Custom Volume Controls;Adjustable Difficulty;Steam Cloud;Family Sharing,Casual;Indie,https://store.steampowered.com/app/3830720,public_unreleased,full_details,False,"Mar 4, 2026","HyakuTyping is a typing software with a Roman alphabet input only theme based on the Hyakunin Isshu poems. You can play by looking at the display from the top and typing the lower verse, or by looking at the card with the lower verse and typing the first two characters of the upper verse.",Japanese,,,,2025-07-19
demo,Gamblers Table Demo,3747250,greenpixels;Bossforge,greenpixels;Bossforge,,Single-player;Game demo;Full controller support;Color Alternatives;Custom Volume Controls;Mouse Only Option;Save Anytime;Touch Only Option,Casual;Indie;Strategy,https://store.steampowered.com/app/3747250,public_unreleased,full_details,False,"Jul 23, 2025","Gamblers Table is an automation game where you toss coins to earn money. Buy bigger and better coins, unlock upgrades and hire little helpers to automate the process and take care of all the busy flipping work for you. Simple. Satisfying. Strangely compelling...",English;German;Simplified Chinese;Traditional Chinese;French;Russian;Spanish - Spain;Japanese;Korean;Polish;Portuguese - Brazil;Portuguese - Portugal;Spanish - Latin America;Italian,,,,2025-07-19
game,Airship,2381730,easy.gg,easy.gg,https://airship.gg,Multi-player;PvP;Online PvP;Co-op;Online Co-op;Cross-Platform Multiplayer,Action;Indie;Massively Multiplayer;RPG,https://store.steampowered.com/app/2381730,public_unreleased,full_details,False,Coming soon,Airship is a multiplayer game platform in early development! Play BedWars 2 and other indie games.,*;*,,,,2025-07-19
game,Geodyssey,3878850,Nilpotent,Nilpotent,,Single-player;Partial Controller Support;Family Sharing,Adventure;Indie,https://store.steampowered.com/app/3878850,public_unreleased,full_details,False,To be announced,Geodyssey is a mind-bending first-person adventure game that challenges your perception with confusing environments. Explore spaces that defy logic and experience a reality that cannot exist. Immerse in a Non-Euclidean world that you cannot wrap your head around.,*;*,,,,2025-07-19
game,Beaver TD,3875260,ptgame,ptgame,,Single-player;Custom Volume Controls;Keyboard Only Option;Mouse Only Option;Playable without Timed Input;Save Anytime;Family Sharing,Indie;Strategy,https://store.steampowered.com/app/3875260,public_unreleased,full_details,False,Coming soon,"A tower defense game with roguelite elements, where you build wooden rafts, summon beaver warriors, and strategically control enemy paths to lead them into traps. Gather resources, upgrade your base, unlock powerful skills, and adapt to chaotic enemy waves to survive as long as possible!",English;Vietnamese,,,,2025-07-19
game,Norn's Dine,3664240,HIC*,HIC*,https://www.hichicgames.com/,Single-player;Custom Volume Controls;Mouse Only Option;Playable without Timed Input;Save Anytime;Family Sharing,Adventure;Casual,https://store.steampowered.com/app/3664240,public_unreleased,full_details,False,Coming soon,"In Asgard, deepen your bonds with the fascinating characters who visit “Norn's Dine” and release their unique episodes! The large volume of character episodes includes erotic scenes newly drawn by the illustrator in charge of designing them!",English;Traditional Chinese;Japanese,,,,2025-07-19
game,Mumu's Soup Adventure SAMSARA,3827640,LYNISOFT,LYNISOFT,https://lynisoft.wixsite.com/mumusoupadventure,Single-player;Keyboard Only Option;Save Anytime;Stereo Sound;Family Sharing,Adventure;Casual;Indie,https://store.steampowered.com/app/3827640,public_unreleased,full_details,False,Q4 2025,"The recipe is soup, the ingredient is your heart! An escape room styled adventure game set in the town basked in twilight, uncovering the stories from lost souls. Will Mumu reach the path of enlightenment? Or perhaps...",English,,,,2025-07-19
game,Jump Greed,3887540,Robert Childress,Robert Childress,,Single-player;Family Sharing,Action;Indie,https://store.steampowered.com/app/3887540,public_unreleased,full_details,False,"Aug 5, 2025",A simple arcade platformer where you try and collect as many coins as possible.,English,,,,2025-07-19
game,SOR.OP: Dark Shades,3883470,SNRCStudios,SNRCStudios,,Single-player;Multi-player;PvP;Online PvP;LAN PvP;Steam Achievements;HDR available,Action;Early Access;Free To Play,https://store.steampowered.com/app/3883470,public_unreleased,full_details,False,Coming soon,"SOR.OP: Dark Shades is a realistic first-person shooter from SNRC Studios with beautiful graphics, precise controls, and over 40 maps. Play in 7 modes, including Team Deathmatch, Free For All, Domination, and Zombie Mode. Tactics, skill, and teamwork are the key to victory.",*;*,,,,2025-07-19
game,Celestial Visitor,3874760,Malingshulaile,Malingshulaile,,Single-player;Family Sharing,Action;Adventure;Casual;Indie;RPG,https://store.steampowered.com/app/3874760,public_unreleased,full_details,False,Coming soon,"As a warrior chosen by a desperate group, you must use your own abilities, even the enemy's magic, to lead your people in a counterattack against the monsters, in order to reclaim everything that has been lost.",English;French;Italian;German;Spanish - Spain;Russian;Japanese;Simplified Chinese;Traditional Chinese;Korean,,,,2025-07-19
demo,Keep Fire Demo,3886060,YIxia Studio,YIxia Studio,,Single-player;Game demo,Adventure;Indie,https://store.steampowered.com/app/3886060,public_unreleased,full_details,False,Coming soon,​​Fight nonstop! Repel zombie hordes with vast arsenals — or beat the clock in sieges. Strategize. Aim. Fire. CRUSH UNDEAD LEGIONS! Keep fire！,"*;, Simplified Chinese;*;*",,,,2025-07-19
game,Fix & Flick,3880420,SparkyDose Studios,SparkyDose Studios,,Single-player;Family Sharing,Indie;Simulation,https://store.steampowered.com/app/3880420,public_unreleased,full_details,False,2026,"Welcome to Fix & Flick, where we fix anything in a flick! Here, you can play as Jimmy and look after the store from where your father left off. Grow your business. Manage your second-hand products. Sell some, buy some, and mostly fix some, while things start to get a little... fearsome.",English;Turkish,,,,2025-07-19
game,The Inescapable Nightmare,3881970,HGamesStudio,HGamesStudio,,Single-player;Custom Volume Controls;Mouse Only Option;Stereo Sound;Family Sharing,Action;Indie;Strategy,https://store.steampowered.com/app/3881970,public_unreleased,full_details,False,"Jul 28, 2025",There Is No Escape.,English,,,,2025-07-19
demo,ZOOM Demo,3883000,3 ALIENS IN A SAUCER,3 ALIENS IN A SAUCER,,Game demo,,https://store.steampowered.com/app/3883000,public_unreleased,full_details,False,"Jul 31, 2025",,*;*,,,,2025-07-19
game,Autumn's Dungeoneering,3403760,Purple Xanmal,Nekojin Interactive LLC,,Single-player;Family Sharing,Action;Indie;RPG;Simulation;Strategy;Early Access,https://store.steampowered.com/app/3403760,public_unreleased,full_details,False,Q2 2026,"You're the pet, they're the hero. Follow orders, fight monsters, and try not to get fired by your owner. Because nothing says ""fantasy adventure"" like navigating workplace dynamics with someone who can literally dismiss you.",*;*,,,,2025-07-19
game,Kraken's Bar,3861910,Playactive Games;Crow Interactive,Playactive Games;Crow Interactive,,Single-player;Multi-player;Co-op;Online Co-op;LAN Co-op;Steam Achievements;Camera Comfort;Custom Volume Controls;Partial Controller Support;Steam Cloud;Family Sharing,Casual;Indie;Strategy;Early Access,https://store.steampowered.com/app/3861910,public_unreleased,full_details,False,Coming soon,"Place your cards, pass your hand, and pray you’re not the one who drinks. A 4-player online party game of rotating hands, cursed drinks, and ruthless eliminations.",English;German;Portuguese - Brazil;Russian;Simplified Chinese;Turkish;Portuguese - Portugal;Spanish - Latin America,,,,2025-07-19
game,Phantom Feline,3835880,Scott Serafin;Jet Thompson;Evan McRae;Aidan Brown,UMBC Game Developers Club,,Single-player;Full controller support;Camera Comfort;Custom Volume Controls;Keyboard Only Option;Playable without Timed Input,Casual;Indie;Free To Play,https://store.steampowered.com/app/3835880,public_unreleased,full_details,False,Coming soon,Play with light and shadow in this Game Boy–inspired puzzle game!,English,,,,2025-07-19
