type,name,steam_appid,developers,publishers,website,categories,genres,steam_url,detection_stage,api_response_type,potential_duplicate,release_date,description,supported_languages,followers,wishlists_est,wishlist_rank,discovery_date
dlc,Sixtar Gate: STARTRAIL - KALPA Collaboration Pack,3913740,Starlike Inc.,Starlike Inc.;Smilegate,,Single-player;Multi-player;Co-op;Online Co-op;Downloadable Content;Steam Achievements;Color Alternatives;Custom Volume Controls;Keyboard Only Option;Stereo Sound;Family Sharing,Action;Casual;Indie,https://store.steampowered.com/app/3913740,public_unreleased,full_details,False,Coming soon,"Enjoy Sixtar Gate: STARTRAIL X KALPA collaboration DLC! The DLC includes a total of 8 songs, 2 gear skin, 2 notes skin, and 1 original theme.","*;, Korean;*;*",,,,2025-08-02
game,Void Jump VR,3911690,LemmoLab,LemmoLab,https://x.com/lemmolab,Single-player;Custom Volume Controls;Playable without Timed Input;Stereo Sound;Family Sharing,Action;Adventure;Indie;Simulation,https://store.steampowered.com/app/3911690,public_unreleased,full_details,False,2025,"Void Jump VR - platformer where precision jumping and perfect timing are your only lifelines in a stylish, sci-fi void","*;, French;*;, Italian;*;, German;*;, Spanish - Spain;*;, Arabic;*;, Bulgarian;*;, Vietnamese;*;, Greek;*;, Danish;*;, Simplified Chinese;*;, Traditional Chinese;*;, Korean;*;, Norwegian;*;, Dutch;*;, Polish;*;, Portuguese - Brazil;*;, Portuguese - Portugal;*;, Russian;*;, Romanian;*;, Thai;*;, Turkish;*;, Hungarian;*;, Ukrainian;*;, Finnish;*;, Czech;*;, Swedish;*;, Japanese;*;, Indonesian;*;, Spanish - Latin America;*;, Azerbaijani;*;, Albanian;*;, Amharic;*;, Assamese;*;, Afrikaans;*;, Basque;*;, Bangla;*;, Bosnian;*;, Belarusian;*;, Valencian;*;, Welsh;*;, Wolof;*;, Armenian;*;, Galician;*;, Georgian;*;, Gujarati;*;, Hindi;*;, Dari;*;, Estonian;*;, Zulu;*;, Yoruba;*;, Kazakh;*;, Kannada;*;, Catalan;*;, Quechua;*;, Kyrgyz;*;, Konkani;*;, Khmer;*;, Xhosa;*;, K'iche';*;, Latvian;*;, Lithuanian;*;, Luxembourgish;*;, Macedonian;*;, Malay;*;, Malayalam;*;, Maltese;*;, Maori;*;, Marathi;*;, Mongolian;*;, Nepali;*;, Odia;*;, Punjabi (Shahmukhi);*;, Punjabi (Gurmukhi);*;, Persian;*;, Kinyarwanda;*;, Serbian;*;, Sotho;*;, Sinhala;*;, Sindhi;*;, Scots;*;, Slovak;*;, Slovenian;*;, Sorani;*;, Swahili;*;, Tajik;*;, Tamil;*;, Tatar;*;, Telugu;*;, Tigrinya;*;, Tswana;*;, Turkmen;*;, Uzbek;*;, Uyghur;*;, Urdu;*;, Filipino;*;, Hausa;*;, Croatian;*;, Cherokee;*;, Hebrew;*;, Irish;*;, Icelandic;*;, Igbo;*;*",2,22,,2025-08-02
game,FORMIDO,3913230,Tonguç Bodur,Tonguç Bodur,https://tongucbodur.com/formido,Single-player;Steam Achievements;Steam Cloud;HDR available;Family Sharing,Indie,https://store.steampowered.com/app/3913230,public_unreleased,full_details,False,2025,Wander through hauntingly beautiful environments with two unlikely companions.,English,1,12,,2025-08-02
game,Bloom N Buzz,3919370,Damon Hazelden,Damon Hazelden,,Single-player;Custom Volume Controls;Mouse Only Option;Playable without Timed Input;Family Sharing,Casual;Indie;Simulation,https://store.steampowered.com/app/3919370,public_unreleased,full_details,False,Coming soon,"Serve your hive in this relaxing tycoon-style game. Fill the role of a dedicated worker bee, pollinate flowers! Build up your hive! Produce honey.",English,2,28,,2025-08-02
game,The Node,3896350,Just'Studio,Just'Studio,,Single-player;Playable without Timed Input;Steam Cloud,Action;Adventure;Indie;Free To Play,https://store.steampowered.com/app/3896350,public_unreleased,full_details,False,To be announced,"An evolving sandbox made with Unreal Engine, built as a personal learning journey. Discover levels showing every step of my progress — from raw beginnings to advanced creations — and follow the story of a dev growing with each new idea and challenge.",French,4,44,,2025-08-02
game,Delive R us,3908120,Cyanimations LLC,Cyanimations LLC,,Single-player;Family Sharing,Casual;Simulation,https://store.steampowered.com/app/3908120,public_unreleased,full_details,False,2025,"You’ve just been laid off and the bills are piling up. Desperate to work on your own terms, you stumble upon Delive-R’ Us—a mysterious gig delivery app that hires you instantly. No interviews. No bosses. Just hustle. In Delive-R’ Us, you take on the chaotic world of freelance delivery driving...",English,1,14,,2025-08-02
game,My New Paranormal Life,3869730,Impassi Productions,Impassi Productions,,Single-player;Family Sharing,Adventure;Casual,https://store.steampowered.com/app/3869730,public_unreleased,full_details,False,2026,"My New Paranormal Life is a story-rich, erotic visual novel focused on its dating-sim and sandbox aspects.",English;Spanish - Latin America,2,24,,2025-08-02
game,A Trip to the Mall at Night,3910160,PulseTower,PulseTower,,Single-player;Custom Volume Controls;Keyboard Only Option;Playable without Timed Input;Partial Controller Support;Family Sharing,Adventure;Indie;RPG,https://store.steampowered.com/app/3910160,public_unreleased,full_details,False,Q4 2025,"Explore and (hopefully) escape a derelict MegaMall in this surreal neon-chalkpunk horror RPG. Try your best to cast light in this world of endless darkness, but remember, the only way out is through...",English,1,12,,2025-08-02
game,The Crawling Dead,3900450,Quinton Van Lom;Jacob Spitler;Yamil Casarreal;Benjamin Kuftic;Roman Caragiulo;Obinsonne Servius,Quinton Van Lom;Dr. Barbara Sharanowski,,Single-player;Steam Achievements;Camera Comfort;Color Alternatives;Custom Volume Controls;Adjustable Difficulty;Steam Cloud;Stats,Simulation;Strategy;Free To Play,https://store.steampowered.com/app/3900450,public_unreleased,full_details,False,"Sep 9, 2025","Design, deploy, and manage the release of parasitic wasps to save a national park from invasive insect pests. Harness the power of nature’s most efficient killers to strike back at the invaders and turn them into The Crawling Dead!",English,1,10,,2025-08-02
game,Little Asteroid Miner,3848230,TCS Developer,TCS Developer,,Single-player;Steam Achievements;Custom Volume Controls;Mouse Only Option;Playable without Timed Input;Save Anytime;Steam Cloud;Family Sharing,Casual;Indie;RPG;Simulation;Strategy,https://store.steampowered.com/app/3848230,public_unreleased,full_details,False,"Sep 25, 2025","An idle incremental adventure in space! Mine asteroids while fighting off enemy AI drones. Build your own AI drones, mining lasers, helper drones and more. Collect hundreds of rewards and unlock a variety of features that will help your ultimate goal: making numbers go up (or sometimes down).",*;*,1,14,,2025-08-02
game,MaskuLand Survival,3595810,DR_Godot_Dev,DR_Godot_Dev,,Single-player;Family Sharing,Action;Adventure;RPG,https://store.steampowered.com/app/3595810,public_unreleased,full_details,False,2026,"You are Masku, an explorer who crash-landed in an unknown world carrying a rare cure for your son! To breathe you need special Masks, each one grants you a unique ability! Repair your balloon and get supplies, fight you way back home! His life depends on you! You need to SURVIVE!",English,2,22,,2025-08-02
game,Drone Wars,3613730,HideU,HideU,,Single-player;Multi-player;PvP;Online PvP;Co-op;Online Co-op;Partial Controller Support;Family Sharing,Action;Massively Multiplayer;Simulation;Sports;Strategy,https://store.steampowered.com/app/3613730,public_unreleased,full_details,False,Coming soon,"Pilot armed drones in immersive FPV, coordinate tactical assaults, and conquer dynamic vertical arenas in this fast‑paced eSports FPS.",English;French,2,22,,2025-08-02
game,100 Cats Lost in Funfair Frenzy,3911720,Two Cats Games,Two Cats Games,https://twocatsgames.com/,Single-player;Multi-player;Co-op;Online Co-op;Steam Achievements;Full controller support;Family Sharing,Casual;Indie,https://store.steampowered.com/app/3911720,public_unreleased,full_details,False,Coming soon,"Find 500 cats lost in the bustling funfair, color by numbers, and brighten this lively frenzy with a friend!",English;French;Italian;German;Spanish - Spain;Arabic;Simplified Chinese;Portuguese - Brazil;Bulgarian;Danish;Indonesian;Dutch;Finnish;Traditional Chinese;Japanese;Korean;Spanish - Latin America;Polish;Hungarian;Norwegian;Portuguese - Portugal;Romanian;Russian;Thai;Turkish;Ukrainian;Vietnamese;Greek;Czech;Swedish;Afrikaans;Amharic;Albanian;Assamese;Azerbaijani;Bangla;Basque;Belarusian;Bosnian;Dari;Armenian;Estonian;Persian;Filipino;Welsh;Galician;Gujarati;Georgian;Hausa;Hindi;Croatian;Kannada;Catalan;Kazakh;Quechua;K'iche';Khmer;Konkani;Kyrgyz;Latvian;Lithuanian;Luxembourgish;Macedonian;Malayalam;Malay;Maltese;Maori;Marathi;Mongolian;Nepali;Odia;Punjabi (Gurmukhi);Punjabi (Shahmukhi);Kinyarwanda;Sinhala;Sindhi;Slovak;Slovenian;Sorani;Sotho;Swahili;Serbian;Tajik;Tamil;Tatar;Telugu;Tigrinya;Tswana;Turkmen;Urdu;Uyghur;Valencian;Wolof;Xhosa;Yoruba;Zulu;Cherokee;Uzbek;Hebrew;Igbo;Irish;Scots;Icelandic,1,14,,2025-08-02
game,Rule Seeker,3444780,WP,WP,,Single-player;Family Sharing,Action;Indie;Strategy,https://store.steampowered.com/app/3444780,public_unreleased,full_details,False,Coming soon,"This is a bullet hell shooter where you combine skills to enhance weapons, armor, and runes—creating your own combat style. Plan carefully and manage limited resources to survive relentless enemies and enjoy the power of your custom build.",English;Simplified Chinese,1,11,,2025-08-02
game,HIDDEN CATS 4: Aetherpunk,3919920,Very Very LITTLE Studio,Very Very LITTLE Studio,,Single-player;Steam Achievements;Custom Volume Controls;Playable without Timed Input;Save Anytime;Steam Cloud;Family Sharing,Adventure;Casual;Indie,https://store.steampowered.com/app/3919920,public_unreleased,full_details,False,August 2025,Explore of this amazing aetherpunk world finding cute cats and paint black - white locations with colored paints.,English;Russian;Czech;Japanese,2,24,,2025-08-02
demo,Gooner Demo,3898410,Jackofals Couch,Jackofals Couch,,Single-player;Game demo;Camera Comfort;Custom Volume Controls;Playable without Timed Input;Stereo Sound,Adventure;RPG,https://store.steampowered.com/app/3898410,public_unreleased,full_details,False,"Aug 8, 2025","The Gooner Demo is a MMO-style RPG and turn-based strategy game blended into a singular ""goon-pilled"" package. Embark on an epic gooning adventure! Experience exhilarating boss mechanics, and a seemingly endless array of naughty pixel art animations.",*;*,,,,2025-08-02
game,Key Your Debt,3921420,An Odd Cloud,An Odd Cloud,,Single-player;Family Sharing,Casual;Indie,https://store.steampowered.com/app/3921420,public_unreleased,full_details,False,2025,"You have two things, debt and a number key pad. Use the number keys on your keyboard to pay your debt in this capitalistic clicker debt paying simulator.",English,2,28,,2025-08-02
music,Oneirophobia Soundtrack,3721270,1FOREVERS,1FOREVERS,https://t.me/forevers5,Additional High-Quality Audio,,https://store.steampowered.com/app/3721270,public_unreleased,full_details,False,Coming soon,"This is the official soundtrack for the game Oneirophobia. Oneirophobia is a psychological horror game with survival elements. You will experience the role of a person suffering from a fear of dreams and visit various nightmares, the tension of which is conveyed through orchestral instruments.",,,,,2025-08-02
game,Protogen Inc.,3917880,Dirty Fox Games,Dirty Fox Games,,Single-player;Custom Volume Controls;Keyboard Only Option;Mouse Only Option;Playable without Timed Input;Save Anytime;Subtitle Options;Family Sharing,Adventure;Casual;Indie,https://store.steampowered.com/app/3917880,public_unreleased,full_details,False,To be announced,"Huh, you've never heard of Protogen Inc.? That's strange, because everyone knows it's the best space station in the entire universe, with everything you could ever need!",English,5,60,,2025-08-02
game,Radiotext,3418160,Alp Arslan,Alp Arslan,,Single-player;Steam Achievements;Captions available;Family Sharing,Adventure;Indie;RPG,https://store.steampowered.com/app/3418160,public_unreleased,full_details,False,Q2 2026,"Radiotext is an interactive story set in the near future, where communication without intrusion requires radio-waves. Dive into a long-forgotten net in this text-based rpg, where you need to think carefully before typing your answers.","*;, Turkish;*",5,60,,2025-08-02
music,Dice Gambit Soundtrack,3918910,Chromatic Ink,,,,,https://store.steampowered.com/app/3918910,public_unreleased,full_details,False,"Aug 14, 2025","The Dice Gambit original soundtrack consisting of 40 wholly unique songs, mixing authentic Portuguese Fado with contemporary genres such as Hip-Hop, Edm, Funk and Trap. Composed by Remagic KV aka Paulo Cunha",,,,,2025-08-02
game,Succum Brewery,3796500,Limejuicegames,Limejuicegames,,Single-player;Family Sharing,RPG;Simulation,https://store.steampowered.com/app/3796500,public_unreleased,full_details,False,To be announced,"Control Catherine as she runs a bar with her AI partner, IO. As IO learns more about human desire he will want Catherine to provide better and better customer service. Will Catherine submit to IO and her desire to serve, or will she escape the rooftop with her freedom?",*;*,45,495,,2025-08-02
game,Yoko no Hanashi,3906610,MerendaTeam,MerendaTeam,,Single-player;Camera Comfort;Custom Volume Controls;Adjustable Difficulty;Stereo Sound;Family Sharing,Action;Adventure;Indie,https://store.steampowered.com/app/3906610,public_unreleased,full_details,False,To be announced,Yoko no Hanashi is a first-person survival horror game where you need to survive in an abandoned college with one of your chosen yandere: Yoto (male version) and Yoko (female version),*;*,7,77,,2025-08-02
game,Bloody Bunny 3D,3892280,Buttfish Games,Buttfish Games,,Single-player;Full controller support;Family Sharing,Action;Casual;Indie;Strategy,https://store.steampowered.com/app/3892280,public_unreleased,full_details,False,Coming soon,"BLOODY BUNNY 3D Is a wave based survival zombie shooter! You can TRAP, SHOOT, SLICE, and THROW these bloody creatures till every last one is off the face of the earth!",*;*,3,33,,2025-08-02
game,一拼到底puzzle to the end,3894810,一斤鸭梨,一斤鸭梨,,Single-player;Steam Achievements;Family Sharing,Casual;Indie,https://store.steampowered.com/app/3894810,public_unreleased,full_details,False,Coming soon,"It's a puzzle game where you can piece together images using specially shaped pieces. Featuring an 8x8 standard grid, magnetic grids, flipable grids, and shape-shifting blocks, it offers over 30 levels of escalating challenges—each piece holds the key to victory.",Simplified Chinese,1,14,,2025-08-02
game,金砂梦咒Golden Sand Dream Curse,3868220,金砂梦咒制作组,HUANG YANGWEIYI,,Single-player,Adventure;Casual;Indie;RPG;Simulation;Free To Play,https://store.steampowered.com/app/3868220,public_unreleased,full_details,False,"Aug 12, 2025",The player plays the role of a treasure hunter who pursues wealth but unexpectedly encounters a gift from a mysterious antique dealer and travels to the world in the treasure map. The player will explore and collect clues to battle the boss and complete the shattered memories of their past life.,*;*,1,12,,2025-08-02
game,Ashforge: Whispers of the Deep,3898420,Grimfox Games Inc,Grimfox Games Inc,https://www.grimfox.com/ashforge,Single-player;Steam Achievements;Camera Comfort;Color Alternatives;Custom Volume Controls;Adjustable Difficulty;Save Anytime;Stereo Sound;Subtitle Options;Steam Cloud;Stats;Family Sharing;Steam Timeline,Action;Adventure;Indie;RPG,https://store.steampowered.com/app/3898420,public_unreleased,full_details,False,To be announced,"A gritty first-person fantasy survival adventure, you are trapped in an underground realm long forgotten and abandoned. Survive first— fighting, foraging and crafting. Next, repair the legendary subterranean steam train Ashforge and explore deeper. Finally, clear your name and return to the surface!",*;*,3,33,,2025-08-02
game,Nekurogahara: Psycho Ronins,3870780,ExoticaMachina,ExoticaMachina,,Single-player;Full controller support;Custom Volume Controls;Adjustable Difficulty;Playable without Timed Input;Stereo Sound;Family Sharing,Action,https://store.steampowered.com/app/3870780,public_unreleased,full_details,False,Coming soon,Become Kensei in this brutal 3D fighter sandbox. Prove her wrong.,English,3,33,,2025-08-02
game,100 Cats Lost in Toyland Trouble,3911740,Two Cats Games,Two Cats Games,https://twocatsgames.com/,Single-player;Multi-player;Co-op;Online Co-op;Steam Achievements;Full controller support;Family Sharing,Casual;Indie,https://store.steampowered.com/app/3911740,public_unreleased,full_details,False,Coming soon,"Find 500 cats lost in Toyland, color by numbers, and brighten this joyful world with a friend!",English;French;Italian;German;Spanish - Spain;Arabic;Simplified Chinese;Portuguese - Brazil;Bulgarian;Danish;Indonesian;Dutch;Finnish;Traditional Chinese;Japanese;Korean;Spanish - Latin America;Polish;Hungarian;Norwegian;Portuguese - Portugal;Romanian;Russian;Thai;Turkish;Ukrainian;Vietnamese;Greek;Czech;Swedish;Afrikaans;Amharic;Albanian;Assamese;Azerbaijani;Bangla;Basque;Belarusian;Bosnian;Dari;Armenian;Estonian;Persian;Filipino;Welsh;Galician;Gujarati;Georgian;Hausa;Hindi;Croatian;Kannada;Catalan;Kazakh;Quechua;K'iche';Khmer;Konkani;Kyrgyz;Latvian;Lithuanian;Luxembourgish;Macedonian;Malayalam;Malay;Maltese;Maori;Marathi;Mongolian;Nepali;Odia;Punjabi (Gurmukhi);Punjabi (Shahmukhi);Kinyarwanda;Sinhala;Sindhi;Slovak;Slovenian;Sorani;Sotho;Swahili;Serbian;Tajik;Tamil;Tatar;Telugu;Tigrinya;Tswana;Turkmen;Urdu;Uyghur;Valencian;Wolof;Xhosa;Yoruba;Zulu;Cherokee;Uzbek;Hebrew;Igbo;Irish;Scots;Icelandic,1,14,,2025-08-02
game,SPELLCAST,3821120,BEDiBUG Concepts,BEDiBUG Concepts,,Single-player;Steam Cloud;Family Sharing,Strategy;Early Access,https://store.steampowered.com/app/3821120,public_unreleased,full_details,False,Coming soon,"SPELLCAST combines the strategy and deckbuilding of a card battler with the dynamic gameplay of word games. Battle through 10 different scenarios or the roguelite campaign, earning ranks and high scores!",English,1,10,,2025-08-02
game,Fishing Worldwide Desktop,3904080,Aaron;Maan;Mingo,TeamMingo,,Single-player;Steam Achievements;Custom Volume Controls;Mouse Only Option;Playable without Timed Input;Save Anytime;Steam Cloud;Family Sharing,Casual,https://store.steampowered.com/app/3904080,public_unreleased,full_details,False,Coming soon,"A relaxing idle fishing game focused on companionship, featuring 26 fishing spots and over 200 fish species. Easy to enjoy without much effort. You can place the game anywhere on your screen while studying or working, without it intruding on your tasks.",English;Simplified Chinese,1,14,,2025-08-02
game,Steel Ark,3915840,4Tale Production,4Tale Production,,Single-player;Multi-player;Co-op;Full controller support;Family Sharing,Action;Adventure;Indie;RPG;Simulation,https://store.steampowered.com/app/3915840,public_unreleased,full_details,False,October 2026,"A first-person survival sandbox game where you explore a post-apocalyptic world, scavenge resources, craft production chains, and keep your train base running against all odds.","*;, French, Italian, German, Spanish - Spain, Portuguese - Brazil, Russian;*",5,55,,2025-08-02
game,100 Cats Lost in Birthday Bash,3911750,Two Cats Games,Two Cats Games,https://twocatsgames.com/,Single-player;Multi-player;Co-op;Online Co-op;Steam Achievements;Full controller support;Family Sharing,Casual;Indie,https://store.steampowered.com/app/3911750,public_unreleased,full_details,False,Coming soon,"Find 500 cats lost at the birthday bash, color by numbers, and brighten this joyful celebration with a friend!",English;French;Italian;German;Spanish - Spain;Arabic;Simplified Chinese;Portuguese - Brazil;Bulgarian;Danish;Indonesian;Dutch;Finnish;Traditional Chinese;Japanese;Korean;Spanish - Latin America;Polish;Hungarian;Norwegian;Portuguese - Portugal;Romanian;Russian;Thai;Turkish;Ukrainian;Vietnamese;Greek;Czech;Swedish;Afrikaans;Amharic;Albanian;Assamese;Azerbaijani;Bangla;Basque;Belarusian;Bosnian;Dari;Armenian;Estonian;Persian;Filipino;Welsh;Galician;Gujarati;Georgian;Hausa;Hindi;Croatian;Kannada;Catalan;Kazakh;Quechua;K'iche';Khmer;Konkani;Kyrgyz;Latvian;Lithuanian;Luxembourgish;Macedonian;Malayalam;Malay;Maltese;Maori;Marathi;Mongolian;Nepali;Odia;Punjabi (Gurmukhi);Punjabi (Shahmukhi);Kinyarwanda;Sinhala;Sindhi;Slovak;Slovenian;Sorani;Sotho;Swahili;Serbian;Tajik;Tamil;Tatar;Telugu;Tigrinya;Tswana;Turkmen;Urdu;Uyghur;Valencian;Wolof;Xhosa;Yoruba;Zulu;Cherokee;Uzbek;Hebrew;Igbo;Irish;Scots;Icelandic,1,14,,2025-08-02
game,100 Cats Lost in Circus Escape,3911760,Two Cats Games,Two Cats Games,https://twocatsgames.com/,Single-player;Multi-player;Co-op;Online Co-op;Steam Achievements;Full controller support;Family Sharing,Casual;Indie,https://store.steampowered.com/app/3911760,public_unreleased,full_details,False,Coming soon,"100 adorable cats are lost in a circus! Find them, color by numbers, and enjoy this colorful escape with a friend!",English;French;Italian;German;Spanish - Spain;Arabic;Simplified Chinese;Portuguese - Brazil;Bulgarian;Danish;Indonesian;Dutch;Finnish;Traditional Chinese;Japanese;Korean;Spanish - Latin America;Polish;Hungarian;Norwegian;Portuguese - Portugal;Romanian;Russian;Thai;Turkish;Ukrainian;Vietnamese;Greek;Czech;Swedish;Afrikaans;Amharic;Albanian;Assamese;Azerbaijani;Bangla;Basque;Belarusian;Bosnian;Dari;Armenian;Estonian;Persian;Filipino;Welsh;Galician;Gujarati;Georgian;Hausa;Hindi;Croatian;Kannada;Catalan;Kazakh;Quechua;K'iche';Khmer;Konkani;Kyrgyz;Latvian;Lithuanian;Luxembourgish;Macedonian;Malayalam;Malay;Maltese;Maori;Marathi;Mongolian;Nepali;Odia;Punjabi (Gurmukhi);Punjabi (Shahmukhi);Kinyarwanda;Sinhala;Sindhi;Slovak;Slovenian;Sorani;Sotho;Swahili;Serbian;Tajik;Tamil;Tatar;Telugu;Tigrinya;Tswana;Turkmen;Urdu;Uyghur;Valencian;Wolof;Xhosa;Yoruba;Zulu;Cherokee;Uzbek;Hebrew;Igbo;Irish;Scots;Icelandic,1,14,,2025-08-02
game,Realms of Reverie,3920460,Yichen Xiong;Maggie Lin,Ringling College of Art and Design,https://www.ringling.edu/academics/majors/game-art/,Single-player;Partial Controller Support,Adventure;Casual;Indie;Free To Play,https://store.steampowered.com/app/3920460,public_unreleased,full_details,False,August 2025,"Realm of Reverie is a short VR exploration adventure game where you navigate the ruins of a sacred village and restore its lost energy after a disaster, inspired by artifacts from Mexico’s National Museum of Anthropology.",*;*,1,12,,2025-08-02
game,Androfoco,3771980,megaeggz,megaeggz,,Single-player;Multi-player;PvP;Online PvP;Steam Achievements;Full controller support;Steam Cloud;Family Sharing,Action;Indie,https://store.steampowered.com/app/3771980,public_unreleased,full_details,False,2026,Win robot battles to decide share prices and the fate of your community in this unique FPS experience,*;*,1,11,,2025-08-02
game,100 Cats Lost in Halloween Havoc,3911780,Two Cats Games,Two Cats Games,https://twocatsgames.com/,Single-player;Multi-player;Co-op;Online Co-op;Steam Achievements;Full controller support;Family Sharing,Casual;Indie,https://store.steampowered.com/app/3911780,public_unreleased,full_details,False,Coming soon,"Find 500 cats lost on Halloween night, color by numbers, and brighten this spooky night with a friend!",English;French;Italian;German;Spanish - Spain;Arabic;Simplified Chinese;Portuguese - Brazil;Bulgarian;Danish;Indonesian;Dutch;Finnish;Traditional Chinese;Japanese;Korean;Spanish - Latin America;Polish;Hungarian;Norwegian;Portuguese - Portugal;Romanian;Russian;Thai;Turkish;Ukrainian;Vietnamese;Greek;Czech;Swedish;Afrikaans;Amharic;Albanian;Assamese;Azerbaijani;Bangla;Basque;Belarusian;Bosnian;Dari;Armenian;Estonian;Persian;Filipino;Welsh;Galician;Gujarati;Georgian;Hausa;Hindi;Croatian;Kannada;Catalan;Kazakh;Quechua;K'iche';Khmer;Konkani;Kyrgyz;Latvian;Lithuanian;Luxembourgish;Macedonian;Malayalam;Malay;Maltese;Maori;Marathi;Mongolian;Nepali;Odia;Punjabi (Gurmukhi);Punjabi (Shahmukhi);Kinyarwanda;Sinhala;Sindhi;Slovak;Slovenian;Sorani;Sotho;Swahili;Serbian;Tajik;Tamil;Tatar;Telugu;Tigrinya;Tswana;Turkmen;Urdu;Uyghur;Valencian;Wolof;Xhosa;Yoruba;Zulu;Cherokee;Uzbek;Hebrew;Igbo;Irish;Scots;Icelandic,1,14,,2025-08-02
game,Smith's Chronicles,2627700,Arsanesia,Arsanesia,,Single-player;Partial Controller Support;Family Sharing,Casual;Indie;Simulation,https://store.steampowered.com/app/2627700,public_unreleased,full_details,False,To be announced,"Forge your legacy as a blacksmith, transforming a humble village into a sanctuary where humans and fantastical races find home and harmony.",English,2,28,,2025-08-02
dlc,Elroy and the Aliens Artbook,3786870,Motiviti,Motiviti,https://elroythegame.com/,Single-player;Downloadable Content;Family Sharing,Adventure,https://store.steampowered.com/app/3786870,public_unreleased,full_details,False,"Aug 7, 2025","A 200 pages digital artbook with early pencil sketches, digital paintings, character design, frame-by-frame animations, and more. It's accompanied by stories and anecdotes behind the game's production. Comes in the form of a 100+ page PDF.",English,,,,2025-08-02
game,The Night Gym,3921530,Fireplay Studio,Fireplay Studio,,Single-player;Camera Comfort;Family Sharing,Indie,https://store.steampowered.com/app/3921530,public_unreleased,full_details,False,"Aug 14, 2025",The Night Gym is a small retro-style indie horror experience with a VHS aesthetic where a late-night workout turns into a nightmare. You arrive at the gym after hours — just you and the machines. But something feels off. The lights flicker. The silence is heavy. You’re not alone...,English,1,12,,2025-08-02
