type,name,steam_appid,developers,publishers,website,categories,genres,steam_url,detection_stage,api_response_type,potential_duplicate,release_date,description,supported_languages,followers,wishlists_est,wishlist_rank,discovery_date
game,The Cleanup Crew,1300480,Duel Studios,Duel Studios,,Multi-player;Co-op;Online Co-op;Steam Achievements;Camera Comfort;Custom Volume Controls;Adjustable Difficulty;Stereo Sound;Surround Sound;Steam Cloud;Stats;Family Sharing,Action;Indie;Early Access,https://store.steampowered.com/app/1300480,public_unreleased,full_details,False,Coming soon,"As part of the Cleanup Crew for The Company, you are designated to go in after we have detected an entrant dying to an Anomaly and retrieve vital components for us. Pair up to 4 players to form a Crew and get to cleaning.",*;*,2,22,,2025-07-22
game,The Mirage Project,3729930,Joseph Weller,Evero Studios,,Single-player;Camera Comfort;Adjustable Difficulty;Save Anytime;Family Sharing,Action;Adventure;Early Access,https://store.steampowered.com/app/3729930,public_unreleased,full_details,False,Coming soon,"A first-person sci-fi horror game where you explore an abandoned research facility, travel through different timelines using a broken time machine, and uncover shifting, liminal spaces created by the Mirage. Survive evolving shadow-like entities and uncover the facility’s dark secrets.",*;*,1,11,,2025-07-22
game,6days,3853830,TechAzy,TechAzy,,Single-player;Steam Achievements;Playable without Timed Input;Stereo Sound;Subtitle Options;Surround Sound;Family Sharing,Action;Adventure;Indie,https://store.steampowered.com/app/3853830,public_unreleased,full_details,False,"Aug 4, 2025","In 1979, a man named Masao Satomi was involved in an accident. He was taken to the hospital and woke up safe and sound, but had amnesia. When he wonders if there is any memory he can recall, he recalls an intense childhood memory from 16 years ago.",English;Simplified Chinese;Japanese,1,11,,2025-07-22
game,This Game Exists Now,3890190,Matthew Shane Williams,Meeeeee,,Single-player;Steam Achievements;Full controller support;Custom Volume Controls;Save Anytime;Subtitle Options;Family Sharing,Action;Adventure;Indie;RPG,https://store.steampowered.com/app/3890190,public_unreleased,full_details,False,Coming soon,"You play as a cube battling heaps of enemies and bosses in order to get your game back from and evil organization called the P.I.A(Pineapple Intelligence Agency) You will be assisted by a wonderfully charming narrator, a strange shop keeper, and MORE! Do you have what it takes to Exist Now? OR NOT!?",*;*,2,22,,2025-07-22
game,MowIt : Grass Cuting Simulator,3856400,ZUGOB Indie,ZUGOB Indie,,Single-player;Multi-player;Co-op;Online Co-op;Family Sharing,Casual;Indie;Simulation,https://store.steampowered.com/app/3856400,public_unreleased,full_details,False,Coming soon,"Mowing lawns has never been this much fun! Relax with your friends in online co-op, upgrade your equipment, shape beautiful gardens, and enjoy the experience. Join the fun with 1-4 player co-op!",English,3,42,,2025-07-22
game,Urban Yuri: A Lady's Romance Manifesto,3761680,Stellar Artificer Games,Stellar Artificer Games,,Single-player;Full controller support;Family Sharing,Casual;Indie;RPG,https://store.steampowered.com/app/3761680,public_unreleased,full_details,False,To be announced,"Welcome to the Yuri story full of women! Play as an urban lady, would you choose your haunting-crush, assertive ex-girlfriend, cute best friend, mystery online friend, or...?",Simplified Chinese;English;Japanese;Traditional Chinese,4,56,,2025-07-22
game,Red Tears,3389460,Arun Haines,Arun Haines,,Single-player;Partial Controller Support;Family Sharing,Action;Adventure;Indie;Early Access,https://store.steampowered.com/app/3389460,public_unreleased,full_details,False,To be announced,"In this gritty Stealth-Action FPS, you are a guerrilla fighter stranded behind enemy lines in 1970s Angola. Strike from the bushes or endure violent gunfights, and explore the hostile semi-open world to survive against outnumbering odds.",English,2,22,,2025-07-22
game,ULTRA VERTIGO,3892250,TEAGHER STUDIO,TEAGHER STUDIO,,Single-player;Steam Achievements;Camera Comfort;Custom Volume Controls;Adjustable Difficulty;Mouse Only Option;Playable without Timed Input;Save Anytime;Stereo Sound;Partial Controller Support;Steam Cloud;Stats;Steam Leaderboards;HDR available;Family Sharing,Action;Indie,https://store.steampowered.com/app/3892250,public_unreleased,full_details,False,Q4 2025,"Run, Climb, Fall and Retry - A fair platformer about running and jumping through a huge minimalistic tower made from the tears of our playtesters. Nothing is unfair, keep trying and you will succeed.",*;*,4,44,,2025-07-22
game,Castaway Trails,3883020,Edudelm,Edudelm,,Single-player;Full controller support;Family Sharing,Indie;RPG;Simulation,https://store.steampowered.com/app/3883020,public_unreleased,full_details,False,Coming soon,"Explore, fight, and survive in a turn-based RPG with resource management and emotionally evolving characters throughout the journey.",English;French;German;Spanish - Spain;Simplified Chinese;Spanish - Latin America,3,36,,2025-07-22
game,As expected of the Demon Lord,3056660,RelezonGames,RelezonGames,https://www.relezongames.com/,Single-player;Partial Controller Support,Casual;Indie;Simulation;Free To Play,https://store.steampowered.com/app/3056660,public_unreleased,full_details,False,Q4 2025,"A Sort the Court like, where you play as a Demon Lord in a Dungeon. Fun and simple sound and art design. Make decisions by giving Yes or No answers to every creature that comes to you. Grow your Dungeon, keep your minions happy, earn Gold and be Good or Bad.",English,2,28,,2025-07-22
game,Bow Hunter,3718170,Chadams Studios,Chadams Studios,,Single-player;Partial Controller Support;Family Sharing,Action;Indie,https://store.steampowered.com/app/3718170,public_unreleased,full_details,False,November 2025,"A prehistoric pixel art top-down survival-hunting roguelike with a first person shooting mechanic, where you attempt to survive in a chain of islands, to gather resources for yourself and your family, and hunt for rare trophies.",*;*,1,11,,2025-07-22
game,Smilers Den Deluxxx,3689530,MikiY,Shady Corner Games,https://shadycorner.com/,Single-player;Steam Achievements;Family Sharing,Action;Strategy,https://store.steampowered.com/app/3689530,public_unreleased,full_details,False,Coming soon,"You have been sent to the backrooms to observe and take photo evidence of a creature known as a smiler, nicknamed ""Karelia"". Can you complete the tasks and end your shift alive, or will you submit to her lustful advances?",*;*,34,374,,2025-07-22
demo,Brain Washer Demo,3891770,NULL Studio,NULL Studio,,Single-player;Game demo;Full controller support;Custom Volume Controls;Adjustable Difficulty,,https://store.steampowered.com/app/3891770,public_unreleased,full_details,False,July 2025,"Battle through a futuristic world as Arina, a cyber-enhanced agent in a fast-paced 2D Beat'em up/Platformer Hybrid. Take down sentient cyborgs with various combos, aerial attacks, and parries. Outsmart deadly traps, uncover hidden rooms, and infiltrate the lair of an evil scientist uprising.",English,,,,2025-07-22
game,Metamancer,3886130,Colter Grant Robinson,Colter Grant Robinson,,Single-player;Full controller support;Family Sharing,Action;RPG;Early Access,https://store.steampowered.com/app/3886130,public_unreleased,full_details,False,"Aug 4, 2025","Metamancer is a Roguelike video game that uses procedural generation for every sprite, item, map and faction making for a unique playing experience each time!",English,4,44,,2025-07-22
game,Master of the House DX,3824170,Qui3tdog,Shady Corner Games,https://shadycorner.com/,Single-player;Family Sharing,Casual;Strategy,https://store.steampowered.com/app/3824170,public_unreleased,full_details,False,Coming soon,"Master of the House DX flips the script on tower defense, as you control the monsters!",English,22,308,,2025-07-22
music,"God, Save the Queens! Official Soundtrack",3162180,QWGames,QWGames,,,,https://store.steampowered.com/app/3162180,public_unreleased,full_details,False,Coming soon,"The complete official soundtrack of the 2.5D rogue-like game God, Save the Queens! The soundtrack takes you on a powerful journey with epic, dark, and emotional music. From intense battles to quiet moments, each track brings the world of the game to life.",,,,,2025-07-22
game,Urban Undergrounds,3801650,Brandon,Brandon,,Single-player;Narrated Game Menus;Stereo Sound;Surround Sound;Family Sharing,Adventure;Indie,https://store.steampowered.com/app/3801650,public_unreleased,full_details,False,Coming soon,"A first-person horror game where you explore an abandoned bunker, avoid deadly threats, and search for your missing friend in a chilling story.",*;*,2,24,,2025-07-22
game,The Confusing Fishing Card Game,3885630,JianBingGaming,JianBingGaming,,Single-player;Steam Achievements;Custom Volume Controls;Keyboard Only Option;Mouse Only Option;Steam Cloud;Stats;Family Sharing,Casual;Indie;Strategy;Early Access,https://store.steampowered.com/app/3885630,public_unreleased,full_details,False,Coming soon,"A pixel-art roguelike fusing fishing and deck-building. Build a powerful pond and earn gold through a 'buy, catch, sell' cycle. You must balance card strategy and economics to pay rising rent and survive this unique adventure.",English;French;German;Spanish - Spain;Simplified Chinese;Russian;Japanese;Korean,2,28,,2025-07-22
game,Midnight Train,3734560,EndLine Studio,EndLine Studio,,Single-player;Full controller support;Custom Volume Controls;Playable without Timed Input;Stereo Sound;Subtitle Options;Surround Sound;Family Sharing,Action;Adventure;Indie,https://store.steampowered.com/app/3734560,public_unreleased,full_details,False,To be announced,"You wake up alone on a mysterious subway train. Each car has its own rule. Every step could be your last. Solve puzzles, follow the instructions, and escape… before the thing in the shadows finds you.",English;Portuguese - Brazil;Simplified Chinese;Traditional Chinese;Korean;Spanish - Latin America;Japanese;Russian,3,33,,2025-07-22
game,interstellar flight,3892750,程进,程进,,Single-player;Steam Leaderboards;Family Sharing,Adventure;Casual;Racing,https://store.steampowered.com/app/3892750,public_unreleased,full_details,False,Coming soon,스타크래프트는 빠른 리듬의 도전적인 비행사격게임으로서 게이머들은 전투기를 조종하여 적의 방어선을 통과하고 BOSS에 도전하게 된다.,English;French;German;Russian;Japanese;Simplified Chinese;Spanish - Latin America;Vietnamese;Korean,2,24,,2025-07-22
game,Bandits vs Lords: Epic Clash,3890210,Salomo Interiors SL,Salomo Interiors SL,https://salomointeriors.com/,Single-player;Multi-player;MMO;PvP;Online PvP;Co-op;Online Co-op;In-App Purchases;Color Alternatives;Mouse Only Option;Save Anytime;Touch Only Option,Casual;Massively Multiplayer;RPG;Strategy;Free To Play,https://store.steampowered.com/app/3890210,public_unreleased,full_details,False,"Oct 31, 2025","Prepare for a thrilling adventure where every decision counts. Construct your base, gather resources, and train unique troops to outsmart your opponents in tactical combat. Raid enemy villages for loot, forge alliances with other players, and expand your territory in a quest for ultimate dominance.",English;French;Italian;German;Spanish - Spain;Arabic;Dutch;Finnish;Portuguese - Brazil;Portuguese - Portugal;Russian;Spanish - Latin America;Thai;Turkish;Vietnamese,2,28,,2025-07-22
game,Hello Anxiety,3876920,Aleph Echo,GameEon Studios,,Single-player;Steam Achievements;Family Sharing,Indie,https://store.steampowered.com/app/3876920,public_unreleased,full_details,False,Q4 2025,"Hello Anxiety is a pixel art narrative puzzle RPG set in a surreal world shaped by mental health struggles. Navigate eerie bookstores, silent streets, and haunting memories as you explore the layers of anxiety and self-doubt in this emotional, story-driven experience.",*;*,1,12,,2025-07-22
game,Children's Sandbox,3839060,Fomalhaut Games,Fomalhaut Games,https://fomalhautgames.com/games?id=2,Single-player;Camera Comfort;Custom Volume Controls;Adjustable Difficulty;Mouse Only Option;Touch Only Option;Family Sharing,Casual;Indie,https://store.steampowered.com/app/3839060,public_unreleased,full_details,False,"Aug 29, 2025","A simple interactive, touch-screen supported, game targeted to younger children to help build up early motor and logic skills",English,1,14,,2025-07-22
game,Space Memory: Mushrooms,3893850,Quantum Quiver Games,Quantum Quiver Games,,Single-player;Steam Achievements;Camera Comfort;Custom Volume Controls;Mouse Only Option;Playable without Timed Input;Steam Cloud;Family Sharing,Casual;Indie,https://store.steampowered.com/app/3893850,public_unreleased,full_details,False,"Aug 5, 2025","Cute, relaxing memory game where you match pairs of cool mushrooms in space",English,1,14,,2025-07-22
game,Schedule AI,3836500,Z-Tech Studio,Z-Tech Studio,https://ztechstudio.eu/,Single-player;Multi-player;Co-op;Online Co-op;Steam Achievements;Custom Volume Controls;Playable without Timed Input;Save Anytime;Stereo Sound;Subtitle Options;Surround Sound;Steam Cloud;Stats;Family Sharing,Indie;Early Access,https://store.steampowered.com/app/3836500,public_unreleased,full_details,False,To be announced,"Stranded on a desert planet by an AI mothership, you and other cloned humans must gather resources, survive monster attacks, craft ridiculous weapons, and send shipments to the AI to avoid its wrath. Build wealth, own vehicles and apartments — or rise up and destroy your AI overlord.",English;French;Italian;German;Spanish - Spain;Arabic;Portuguese - Brazil;Bulgarian;Traditional Chinese;Simplified Chinese;Danish;Finnish;Greek;Indonesian;Japanese;Korean;Dutch;Norwegian;Polish;Portuguese - Portugal;Romanian;Russian;Swedish;Spanish - Latin America;Thai;Czech;Turkish;Ukrainian;Hungarian;Vietnamese;Afrikaans;Amharic;Azerbaijani;Basque;Bangla;Cherokee;Estonian;Galician;Gujarati;Hebrew;Igbo;Icelandic;Kazakh;Quechua;Kinyarwanda;Konkani;K'iche';Lithuanian;Malayalam;Maltese;Marathi;Mongolian;Odia;Punjabi (Shahmukhi);Scots;Sindhi;Slovak;Sorani;Swahili;Tamil;Telugu;Tswana;Uyghur;Uzbek;Welsh;Yoruba;Xhosa,2,24,,2025-07-22
game,Blanky,3870300,Winter Cabin,Winter Cabin,,Single-player;Steam Achievements;Full controller support;Custom Volume Controls;Keyboard Only Option;Playable without Timed Input;Family Sharing,Action;Adventure,https://store.steampowered.com/app/3870300,public_unreleased,full_details,False,September 2025,"Blanky tells the story of a young boy named Jacob, who is thrown into a nightmarish world, filled with his biggest fears. With the help of his Blanket, nicknamed ""Blanky"" Jacob unlocks new abilities in search of the courage needed to defeat the evils within his own mind.","*;, French;*;, German;*;, Japanese;*;, Portuguese - Brazil;*;*",3,33,,2025-07-22
dlc,Death Relives Artbook,3881560,Nyctophile Studios,Nyctophile Studios,https://nyctophilestudios.com,Single-player;Downloadable Content;Adjustable Text Size;Color Alternatives;Custom Volume Controls;Adjustable Difficulty;Playable without Timed Input;Stereo Sound;Surround Sound,Action;Adventure;Indie,https://store.steampowered.com/app/3881560,public_unreleased,full_details,False,"Jul 25, 2025","Explore the dark artistry of Death Relives with the official digital artbook. Featuring illustrations, concept sketches, and environment studies, it unveils the game’s Aztec‑inspired vision.",*;*,,,,2025-07-22
game,BrainRot Battle,3891810,Tykanoid Games,Tykanoid Games,,Single-player;Family Sharing,Action;Casual;Indie;Strategy,https://store.steampowered.com/app/3891810,public_unreleased,full_details,False,August 2025,Goofy animals decided to start a battle! Defend your towers with brilliant gold management for sending animal units fight for you. Then collect more units to fill your deck and beat every level on the map!,English;Russian,1,11,,2025-07-22
game,this game will end in 205 clicks.,3585630,insertdisc5,insertdisc5,,Single-player;Steam Achievements;Partial Controller Support;Family Sharing,Indie,https://store.steampowered.com/app/3585630,public_unreleased,full_details,False,"Aug 5, 2025","What does a SUPERVILLAIN do, when he is forbidden from doing anything evil for the day? WARNING: This is not the type of game where you can make meaningful choices.",English,1,12,,2025-07-22
game,Leaflup's Candy Hunt,3884600,Wonderpond,Wonderpond,,Single-player;Steam Achievements;Full controller support;Custom Volume Controls;Keyboard Only Option;Playable without Timed Input;Family Sharing,Action;Adventure;Casual,https://store.steampowered.com/app/3884600,public_unreleased,full_details,False,Q3 2025,"Help Leaflup save his friends in the most unconventional way possible... CANDY! Unlock abilities, uncover the mysteries of the forest, collect 380+ pieces of candy, befriend unhinged characters, play pinball, wear a shoe as a hat & more in this lovingly crafted short platformer game.",*;*,1,11,,2025-07-22
game,ContentBuddy,3829330,Shawn David,Automate To Win,https://automatetowin.com/contentbuddy,,Animation & Modeling;Audio Production;Design & Illustration;Photo Editing;Utilities;Video Production;Web Publishing;Game Development;Early Access,https://store.steampowered.com/app/3829330,public_unreleased,full_details,False,August 2025,"Offline AI content creation suite. Generate text, images, audio, voiceovers, and more—locally, with no subscriptions or cloud. ContentBuddy is your all-in-one creative toolkit powered by local models. Your machine. Your media. Your rules.",*;*,1,12,,2025-07-22
game,Panic Sell,3887220,Serhii Khramov,General Script Studio,,Single-player;Steam Achievements;Steam Cloud;Stats;Steam Leaderboards;Includes level editor,Casual;Indie;RPG;Simulation;Strategy;Free To Play,https://store.steampowered.com/app/3887220,public_unreleased,full_details,False,"Aug 12, 2025",Would you like to feel like a trader? Try to earn crazy capital in this game or lose everything! Buy cheaper and sell more expensive. That's all you need on your way to wealth. Good luck!,English;French;Italian;German;Spanish - Spain;Arabic;Bulgarian;Vietnamese;Greek;Danish;Simplified Chinese;Traditional Chinese;Korean;Norwegian;Dutch;Polish;Portuguese - Brazil;Portuguese - Portugal;Romanian;Thai;Turkish;Hungarian;Ukrainian;Finnish;Czech;Swedish;Japanese;Indonesian;Spanish - Latin America,1,14,,2025-07-22
game,Cut The Grass: Farm Defense Survival,3864710,Baked Games,PlayWay S.A.,https://bakedgames.pl/,Single-player;Multi-player;Co-op;Online Co-op;Family Sharing,Action;Adventure;Simulation,https://store.steampowered.com/app/3864710,public_unreleased,full_details,False,Coming soon,"Cutting grass is just the beginning. Explore, gather loot, upgrade your farm and survive night attacks. Fight monsters, defend your base, and last as long as you can in this day-night survival loop!","*;, French, Italian, German, Spanish - Spain, Traditional Chinese, Simplified Chinese, Czech, Spanish - Latin America, Dutch, Indonesian, Japanese, Korean, Polish, Portuguese - Portugal, Portuguese - Brazil, Russian, Turkish, Ukrainian, Vietnamese;*",8,88,,2025-07-22
music,Thrive Soundtrack,3885650,Revolutionary Games Studio,Revolutionary Games Studio,,Additional High-Quality Audio,,https://store.steampowered.com/app/3885650,public_unreleased,full_details,False,"Aug 15, 2025",Soundtrack for the game Thrive,,,,,2025-07-22
game,ささゆめしき,3821190,うにゃネコシアター,うにゃネコシアター,https://unya-theater.net/,Single-player;Mouse Only Option;Playable without Timed Input;Family Sharing,Action;Indie,https://store.steampowered.com/app/3821190,public_unreleased,full_details,False,"Jul 30, 2025",It's an action game in which the jellyfish in the aquarium comfort her as she sorrows and eases her heart. -> Carefully designed graphics and gentle sound. -> New voice cast added! -> Easy to use with just a mouse. Enjoy this miniature antique story!,*;*,1,11,,2025-07-22
game,Machine TakeOver,3863120,Burak S.,Burak S.,,Single-player;Family Sharing,Action;Adventure;RPG;Early Access,https://store.steampowered.com/app/3863120,public_unreleased,full_details,False,December 2025,"Survive alone in a sandbox world overrun by AI-driven Machines. Loot, craft, build, and evade. Every hit hurts. Every mistake matters. Machines value no memories, no culture, only biochemical efficiency. Will you survive, or become fuel?","*;, Spanish - Spain, Simplified Chinese, Polish, Portuguese - Portugal, Russian, Turkish;*",3,33,,2025-07-22
game,Curse of Woney,3817980,JustAWoney,JustAWoney,,Single-player;Full controller support;Adjustable Text Size;Camera Comfort;Color Alternatives;Custom Volume Controls;Adjustable Difficulty;Keyboard Only Option;Mouse Only Option;Playable without Timed Input;Save Anytime;Stereo Sound;Subtitle Options;Touch Only Option,Action;Adventure;Indie;RPG;Strategy;Free To Play,https://store.steampowered.com/app/3817980,public_unreleased,full_details,False,Coming soon,"A Turn-Based RPG + Roguelike following a Familiar trying to free himself from a witch. Optimize your build, and sling spells until you're free.",English,1,11,,2025-07-22
game,Vampire Awakening: Elven Sword Chronicles Survival (吸血鬼的起床: 精灵幻剑录幸存者),3846800,Queen Vampire,Queen Vampire,,Single-player;Multi-player;Co-op;Online Co-op;LAN Co-op;Custom Volume Controls;Keyboard Only Option;Playable without Timed Input;Stereo Sound;Surround Sound;Touch Only Option;Steam Cloud;Family Sharing,Action;Casual;Indie,https://store.steampowered.com/app/3846800,public_unreleased,full_details,False,Q4 2025,"Juggernaut Lyra disappeared to investigate the forest's mutation; You also went into the forest in search of Lyra; You will experience a small story in the face of chapter after chapter; In each chapter, the face of defeating the vast number of enemies!",English;French;Italian;German;Spanish - Spain;Danish;Ukrainian;Russian;Bulgarian;Hungarian;Indonesian;Turkish;Greek;Norwegian;Czech;Japanese;Polish;Thai;Swedish;Simplified Chinese;Traditional Chinese;Romanian;Finnish;Dutch;Portuguese - Brazil;Portuguese - Portugal;Spanish - Latin America;Vietnamese;Arabic;Korean,1,11,,2025-07-22
game,Spirit Whisperer Conversation With Akari,3885180,Feeling Potion,Feeling Potion,,Single-player;Family Sharing,Adventure;Casual,https://store.steampowered.com/app/3885180,public_unreleased,full_details,False,Coming soon,"Akari was a beloved streamer—until she died live on camera. Now, as a spirit, she’s still performing. You’ve been hired to speak with her, and uncover the truth behind the smile she never took off.",English,1,12,,2025-07-22
game,My Lovable Demon,3854420,Pink Tea,Pink Tea,,Single-player;Family Sharing,Adventure;Casual;Early Access,https://store.steampowered.com/app/3854420,public_unreleased,full_details,False,To be announced,"You summoned a hot demon. Build your relationship, go on dates, pat her head, battle evil and f**k a lot! (Visual novel with point-and-click elements. Multiple endings.)",English,16,192,,2025-07-22
music,Container Terminal Simulator Soundtrack,3888280,Tikam Studio,Tikam Studio,,,,https://store.steampowered.com/app/3888280,public_unreleased,full_details,False,Coming soon,Official Soundtrack for the Game Container Terminal Simulator,,,,,2025-07-22
game,Sunfinity,3870850,Varakers,Varakers,,Single-player;Custom Volume Controls;Mouse Only Option;Playable without Timed Input;Family Sharing,Indie;Simulation,https://store.steampowered.com/app/3870850,public_unreleased,full_details,False,To be announced,"Sunfinity is a 2D idle farming game where you grow sunflowers, sell your harvest, upgrade your stats, and build a fully automated farm... all while Grandpa George gently grumbles at every click.",English;French,,,,2025-07-22
game,BunnyBarTalk,3891360,maruhani,maruhani,,Single-player;Custom Volume Controls;Family Sharing,Casual,https://store.steampowered.com/app/3891360,public_unreleased,full_details,False,"Aug 4, 2025",Bunny Bar Talk is a quick and fun command-input mini-game. Get to know the girls at Bunny Bar!,English;Traditional Chinese;Japanese;Korean,2,28,,2025-07-22
game,Not a Dream Job,3841160,Eternity Games Studio,TARS,,Single-player;Family Sharing,Indie;RPG;Strategy,https://store.steampowered.com/app/3841160,public_unreleased,full_details,False,Q3 2025,"Have you ever found yourself in a situation where you have no other choice and have to act according to circumstances, trying to survive? When your words and actions literally depend on your life? This game is about that. Read below for more information about the game.","*;, English;*",,,,2025-07-22
game,Clicker Astro Planet,3889270,LunaSmith,LunaSmith,,Single-player;Steam Achievements;Family Sharing,Casual;Indie;Simulation,https://store.steampowered.com/app/3889270,public_unreleased,full_details,False,September 2025,"Clicker Astro Planet is a cosmic clicker with upgrades, auto-clickers, and full automation. Earn Cosmo Credits, mine Cosmo Gold, boost your progress with power-ups and mini-games. Build your galactic empire — even while idle!",English,1,14,,2025-07-22
game,Rival Soldier Front,3848370,Rival Games,Rival Games,https://rivalsf.com/,Multi-player;Family Sharing,Action,https://store.steampowered.com/app/3848370,public_unreleased,full_details,False,Coming soon,"Rival Soldier Front is a tactical online first-person shooter where players engage in fast-paced team battles using real-world weapons, specialized soldier classes, and skill-based mechanics across competitive game modes.",*;*,,,,2025-07-22
