type,name,steam_appid,developers,publishers,website,categories,genres,steam_url,detection_stage,api_response_type,potential_duplicate,release_date,description,supported_languages,followers,wishlists_est,wishlist_rank,discovery_date
game,Sweetie Candy Maze: Red Cherry,3922210,Cute Hannah's Games,Cute Hannah's Games,,Single-player;Steam Achievements;Camera Comfort;Custom Volume Controls;Mouse Only Option;Playable without Timed Input;Stereo Sound;Steam Cloud;Family Sharing,Casual;Indie,https://store.steampowered.com/app/3922210,public_unreleased,full_details,False,"Aug 15, 2025",Dive into a vibrant candy world! Collect delicious sweets and find your way through playful red cherry mazes in this sweet and colorful adventure.,"*;, French;*;, Italian;*;, German;*;, Spanish - Spain;*;, Arabic;*;, Bulgarian;*;, Vietnamese;*;, Greek;*;, Danish;*;, Simplified Chinese;*;, Traditional Chinese;*;, Korean;*;, Norwegian;*;, Dutch;*;, Polish;*;, Portuguese - Brazil;*;, Portuguese - Portugal;*;, Russian;*;, Romanian;*;, Thai;*;, Turkish;*;, Hungarian;*;, Ukrainian;*;, Finnish;*;, Czech;*;, Swedish;*;, Japanese;*;, Indonesian;*;, Spanish - Latin America;*;, Azerbaijani;*;, Albanian;*;, Amharic;*;, Assamese;*;, Afrikaans;*;, Basque;*;, Bangla;*;, Bosnian;*;, Belarusian;*;, Valencian;*;, Welsh;*;, Wolof;*;, Armenian;*;, Galician;*;, Georgian;*;, Gujarati;*;, Hindi;*;, Dari;*;, Estonian;*;, Zulu;*;, Yoruba;*;, Kazakh;*;, Kannada;*;, Catalan;*;, Quechua;*;, Kyrgyz;*;, Konkani;*;, Khmer;*;, Xhosa;*;, K'iche';*;, Latvian;*;, Lithuanian;*;, Luxembourgish;*;, Macedonian;*;, Malay;*;, Malayalam;*;, Maltese;*;, Maori;*;, Marathi;*;, Mongolian;*;, Nepali;*;, Odia;*;, Punjabi (Shahmukhi);*;, Punjabi (Gurmukhi);*;, Persian;*;, Kinyarwanda;*;, Serbian;*;, Sotho;*;, Sinhala;*;, Sindhi;*;, Scots;*;, Slovak;*;, Slovenian;*;, Sorani;*;, Swahili;*;, Tajik;*;, Tamil;*;, Tatar;*;, Telugu;*;, Tigrinya;*;, Tswana;*;, Turkmen;*;, Uzbek;*;, Uyghur;*;, Urdu;*;, Filipino;*;, Hausa;*;, Croatian;*;, Cherokee;*;, Hebrew;*;, Irish;*;, Icelandic;*;, Igbo;*;*",,,,2025-08-02
game,LED Bringer,3915590,SensGames,SensGames,,Single-player;Full controller support;Family Sharing,Action;Indie;RPG;Strategy,https://store.steampowered.com/app/3915590,public_unreleased,full_details,False,2026,"The sun has gone out, and darkness has consumed the planet. You ended up here by accident, but now you must become a glimmer of hope. Even if it's just… an LED. Take control of a combat drone, expand your base, navigate the darkness, and uncover the secrets of a dying world.",,,,,2025-08-02
game,Claws of the Forest,3922760,Storytale Studios,Storytale Studios,,Single-player;Steam Achievements;Custom Volume Controls;Mouse Only Option;Playable without Timed Input;Save Anytime;Family Sharing,Indie;Simulation,https://store.steampowered.com/app/3922760,public_unreleased,full_details,False,"Aug 15, 2025","A mysterious and sinister presence stalks you back to your cabin, where you and your brother are all alone.",English;French;Italian;German;Spanish - Spain;Bulgarian;Czech;Danish;Dutch;Finnish;Greek;Hungarian;Indonesian;Japanese;Korean;Norwegian;Polish;Portuguese - Brazil;Romanian;Russian;Simplified Chinese;Swedish;Thai;Traditional Chinese;Turkish;Ukrainian;Vietnamese,,,,2025-08-02
game,ClassBoom,3883870,Alkibit LLC,Alkibit LLC,,Single-player;Camera Comfort;Keyboard Only Option;Mouse Only Option;Playable without Timed Input;Save Anytime;Stereo Sound;Includes level editor;HDR available;Family Sharing,Adventure;Casual;Indie,https://store.steampowered.com/app/3883870,public_unreleased,full_details,False,To be announced,"This is a physics-based casual sandbox game, where there are no limits to your creativity. Mess around with liquids, explore the space, build machines, or just explode everything you can see.","*;, Afrikaans, Albanian, Amharic, Armenian, Assamese, Azerbaijani, Bangla, Basque, Belarusian, Bosnian, Catalan, Cherokee, Croatian, Dari, Estonian, Filipino, Galician, Georgian, Gujarati, Hausa, Hebrew, Hindi, Icelandic, Igbo, Irish, K'iche', Kannada, Kazakh, Khmer, Kinyarwanda, Konkani, Kyrgyz, Latvian, Lithuanian, Luxembourgish, Macedonian, Malay, Malayalam, Maltese, Maori, Marathi, Mongolian, Nepali, Odia, Persian, Punjabi (Gurmukhi), Punjabi (Shahmukhi), Quechua, Scots, Serbian, Sindhi, Sinhala, Slovak, Slovenian, Sorani, Sotho, Swahili, Tajik, Tamil, Tatar, Telugu, Tigrinya, Tswana, Turkmen, Urdu, Uyghur, Uzbek, Valencian, Welsh, Wolof, Xhosa, Yoruba, Zulu;*",,,,2025-08-02
music,Icoptic Journey Soundtrack,3915600,Wyatt Warren,,,Additional High-Quality Audio,,https://store.steampowered.com/app/3915600,public_unreleased,full_details,False,Coming soon,"The soundtrack from the game Icoptic Journey, composed by Wyatt Warren. Contains 20 tracks available as MP3s.",,,,,2025-08-02
music,Gundroid Soundtrack,3912020,Kitogoru Games,,,,,https://store.steampowered.com/app/3912020,public_unreleased,full_details,False,Coming soon,"The Gundroid soundtrack is a direct homage to the metal of the '80s and '90s, and at the same time, a tribute to the brilliant, legendary video game soundtracks of that era.",,,,,2025-08-02
game,Bone Souls,3901780,几几不小心,几几不小心,,Single-player;Full controller support;Family Sharing,Action;RPG,https://store.steampowered.com/app/3901780,public_unreleased,full_details,False,September 2025,"Bone Souls is an action RPG game set in a dark fantasy world. Enter a vast scene, challenge difficult and dangerous situations, and enjoy the sense of accomplishment when overcoming difficulties. The characters you meet on the journey and the stories that happen to the players are not to be missed.",*;*,,,,2025-08-02
game,Something is wrong,3895130,Protocol Games,Protocol Games,,Single-player;Family Sharing,Adventure;Indie,https://store.steampowered.com/app/3895130,public_unreleased,full_details,False,To be announced,"At AllRisk Solutions, your mission is to keep our most valued clients happy while boosting company success. Use our powerful software to make smart decisions, settle claims, and climb the ranks. Play it right then enjoy free time at home. Strategy, balance, and rewards, it’s all in your hands!",English;French,,,,2025-08-02
game,Jelly Monsters,3659090,BINGOBELL,BINGOBELL,,Single-player;Multi-player;PvP;Online PvP;LAN PvP;Co-op;Online Co-op;LAN Co-op;Full controller support;Family Sharing,Action;Casual;Indie;RPG,https://store.steampowered.com/app/3659090,public_unreleased,full_details,False,Coming soon,Become a Jelly Monster and use your magnetic powers to pull in or knock away your rivals. Master your polarity and magnetic tricks to survive the mayhem — and be the last one standing!,English;Simplified Chinese;Traditional Chinese,,,,2025-08-02
game,Dreamcraft: Lumberjack,3584350,Duck Gang,Duck Gang,,Single-player;Camera Comfort;Custom Volume Controls;Playable without Timed Input;Save Anytime;Family Sharing,Adventure;Casual;Indie;Simulation,https://store.steampowered.com/app/3584350,public_unreleased,full_details,False,To be announced,"Game about cutting trees to save the forests. Cut trees, gather lumber, upgrade axes and boost stats. Explore the forests, rescue animals and unravel secrets of the trees! 🌳 Will you help to restore the nature? 🌳",English,,,,2025-08-02
game,Fantasy Brothel Manager,3555680,Eki-Eki-Eki,Eki-Eki-Eki,,Single-player;Steam Achievements;Camera Comfort;Custom Volume Controls;Mouse Only Option;Playable without Timed Input;Save Anytime;Steam Cloud;Stats;Family Sharing,Simulation;Strategy,https://store.steampowered.com/app/3555680,public_unreleased,full_details,False,To be announced,Turn an empty old building into a thriving pleasure enterprise for all sorts of magical creatures.,*;*,,,,2025-08-02
game,Dynasty Game 2,3811670,Yocone,Yocone,,Single-player;Adjustable Difficulty;Playable without Timed Input;Save Anytime;Family Sharing,Simulation;Strategy,https://store.steampowered.com/app/3811670,public_unreleased,full_details,False,August 2025,"Core gameplay of the game: operate on a large map, farm, recruit talents, govern, create, trade, build armies, conquer cities and territories, and defend strategic passes to ensure the safety of one side. Suitable for players who enjoy governing the country, farming, and opening up new territories ﻿","*;, Traditional Chinese;*;*",,,,2025-08-02
game,100 Cats Lost in Argentina Find & Color,3809650,Two Cats Games,Two Cats Games,,Single-player;Multi-player;Co-op;Online Co-op,Casual;Indie;Free To Play,https://store.steampowered.com/app/3809650,public_unreleased,full_details,False,Coming soon,"Grab your crayons and hunt for 200 hidden cats across 2 beautifully hand-drawn maps. Play solo or team up with a friend in local co-op, then bring each scene to life with guided color-by-numbers or your own palette—all in a relaxing, soothing atmosphere.",English,,,,2025-08-02
game,Click Me Harder,3918190,Tegridy Made Games,Tegridy Made Games,https://www.youtube.com/@TegridyMadeGames,Single-player;Full controller support,Casual;Indie;Simulation;Free To Play,https://store.steampowered.com/app/3918190,public_unreleased,full_details,False,Coming soon,"Click anime girls, get money, spend it to get more anime girls.",English;Italian;Spanish - Spain;Portuguese - Brazil;Portuguese - Portugal;French,,,,2025-08-02
game,Pexet Inc.,3905840,PurpleRainDr,PurpleRainDr,,Single-player;Adjustable Text Size;Camera Comfort;Custom Volume Controls;Adjustable Difficulty;Playable without Timed Input;Save Anytime;Stereo Sound;Subtitle Options;Surround Sound;HDR available;Family Sharing,Action;Adventure;Casual;Indie,https://store.steampowered.com/app/3905840,public_unreleased,full_details,False,To be announced,"A top-down 2D survival horror game where you shift between timelines, solve time-based puzzles, manage limited resources, and survive deadly encounters in a collapsing research facility.","*;, Arabic;*;*",,,,2025-08-02
game,Enchanted Valley: Fantasy Slide Puzzle,3869030,Spectral Elixir Software,Spectral Elixir Software,,Single-player;Family Sharing,Casual,https://store.steampowered.com/app/3869030,public_unreleased,full_details,False,Coming soon,"Enchanted Valley: Fantasy Slide Puzzle is a cozy, story-driven puzzle game set in a magical pixel art world. Solve 30 handcrafted sliding puzzles, unlock 3 extra game modes, and follow the journey of Valkyria, a young druid chosen to save her home.",*;*,,,,2025-08-02
game,The Corn Maze: Rebirth,3906400,Wild Wizard Studios,Wild Wizard Studios,,Single-player;Steam Achievements;Family Sharing,Action;Adventure;Casual;Indie;RPG;Strategy,https://store.steampowered.com/app/3906400,public_unreleased,full_details,False,October 2025,"Trapped in a massive corn maze, you must survive monstrous threats, uncover hidden truths, and follow cryptic notes from a mysterious figure. Shoot, scavenge, and explore twisted portals as you unravel a dark conspiracy blending science, cults, and control.",English,,,,2025-08-02
game,Roxanne The Forgotten Path,3893080,Steven Meza;MarosGraphic 7,TST PRODUCTION STUDIO,https://steamcommunity.com,Single-player;Full controller support;Stereo Sound;Surround Sound;Family Sharing,Action;Adventure;Indie,https://store.steampowered.com/app/3893080,public_unreleased,full_details,False,Coming soon,"A 2D platform adventure game with a Metroidvania feel, where you explore an underground world, unlock abilities, battle enemies, and discover secrets as you advance through biomes filled with magic and darkness.",English;Spanish - Latin America;German;Japanese,,,,2025-08-02
game,Hopward,3910510,GoodGhostGames,GoodGhostGames,,Single-player;Steam Achievements;Steam Cloud;Family Sharing,Adventure;Casual;Indie,https://store.steampowered.com/app/3910510,public_unreleased,full_details,False,Coming soon,"Play as a determined frog with one goal: reach the top. Hop, fall, learn and soar through mystical lands in a vertical journey where every fall is a lesson.",English,,,,2025-08-02
game,Anime Art Generator,3911020,Jasper Labs,Jasper Labs,,,Animation & Modeling;Design & Illustration;Photo Editing,https://store.steampowered.com/app/3911020,public_unreleased,full_details,False,"Aug 22, 2025","Type a prompt, get high‑resolution anime art, fast and 100% offline. Anime Art Generator runs locally with no accounts or cloud, giving artists, otakus, VN devs, and creators fast, private, gorgeous anime artworks.",English,,,,2025-08-02
game,Vaginator 3000,3900290,NSFW Works,NSFW Works,,Single-player;Custom Volume Controls;Mouse Only Option;Save Anytime;Family Sharing,Casual,https://store.steampowered.com/app/3900290,public_unreleased,full_details,False,August 2025,Vaginas are under attack. Click to eliminate mutant bacteria with your busted Vaginator 3000.,English,,,,2025-08-02
game,CyCall,3234170,PzGames,PzGames,,Multi-player;PvP;Online PvP;Co-op;Online Co-op;Custom Volume Controls;Keyboard Only Option;Mouse Only Option;Playable without Timed Input;Partial Controller Support;Steam Cloud;Family Sharing,Indie;Strategy;Early Access,https://store.steampowered.com/app/3234170,public_unreleased,full_details,False,2025,"CyCall is a turn-based TCG and dice board game mash-up that offers strategic card and board game experience with its unique game mechanic. Collect cards, build a new deck, and play against your friends!",English;Japanese,,,,2025-08-02
game,Algatraz,3882380,"Copium Games, LLC","Copium Games, LLC",https://copium.games,Single-player;Steam Achievements;Steam Leaderboards,Casual;Indie;Simulation;Free To Play,https://store.steampowered.com/app/3882380,public_unreleased,full_details,False,Q3 2025,"Play as an alligator in ALGATRAZ, a unique prison setting where you decide your path: explore the sprawling grounds, assist guards, uncover hidden secrets, or wreak havoc on detainees and staff. With no rules or mandatory missions, the choice is yours in this dynamic, player-driven experience.",English;French;Italian;German;Spanish - Spain;Bulgarian;Czech;Danish;Dutch;Finnish;Greek;Hungarian;Indonesian;Japanese;Korean;Norwegian;Polish;Portuguese - Brazil;Portuguese - Portugal;Romanian;Russian;Simplified Chinese;Spanish - Latin America;Swedish;Thai;Traditional Chinese;Turkish;Ukrainian;Vietnamese,,,,2025-08-02
game,王风九歌：春秋战国,3909490,流风Game,流风Game,,Single-player;Adjustable Text Size;Camera Comfort;Custom Volume Controls;Adjustable Difficulty;Playable without Timed Input;Save Anytime;Family Sharing,RPG;Simulation;Strategy,https://store.steampowered.com/app/3909490,public_unreleased,full_details,False,Coming soon,"This is a grand strategy game set in the Spring and Autumn period and the Warring States Period. Become an empire ruler or an ambitious noble, shaping your dynasty through politics and war. Face family conspiracies and minister betrayals, and write an immortal legend with your brilliant strategies.","*;, Traditional Chinese;*;*",,,,2025-08-02
demo,Beyond the Grove Demo,3923870,Not a Duck,Not a Duck,,Game demo,,https://store.steampowered.com/app/3923870,public_unreleased,full_details,False,November 2025,,,,,,2025-08-02
game,Apocalypse Survivor,3915670,li jun tao,li jun tao,,Single-player;Family Sharing,Action;Adventure;Indie;RPG;Early Access,https://store.steampowered.com/app/3915670,public_unreleased,full_details,False,Coming soon,Days of Ruin is a third-person post-apocalyptic zombie shooter featuring procedurally generated equipment stats and infinitely replayable maps. Players can repeatedly farm maps to acquire better gear and prepare for greater challenges!,English;Simplified Chinese,,,,2025-08-02
game,同桌！我喜欢你,3918230,海伦幻想制作组,海伦幻想制作组,,Single-player;Family Sharing,Casual;RPG,https://store.steampowered.com/app/3918230,public_unreleased,full_details,False,"Aug 14, 2025",《同桌!我喜欢你》是一款短篇galgame。高二的某天，“问题同学”林远丞由于一次争执，阴差阳错地成了班长许茜儿的同桌。从斗嘴拌嘴到心动不已，点击游戏推进剧情——轻快日常校园恋爱喜剧，就此开始！,Simplified Chinese,,,,2025-08-02
game,Mini Dash,3850650,Moregames,Moregames,,Single-player;Steam Achievements;Full controller support;Camera Comfort;Custom Volume Controls;Keyboard Only Option;Playable without Timed Input;Subtitle Options;Steam Cloud;Family Sharing,Action,https://store.steampowered.com/app/3850650,public_unreleased,full_details,False,To be announced,"Get ready for Mini Dash, a hardcore platformer with tons of twists and turns. Can you help our speedy hero escape tricky levels and dash to victory?",*;*,,,,2025-08-02
game,Neffy -Moonlight Labyrinth X-,3801500,TOM CREATE,TOM CREATE,https://www.tomcreate.co.jp/neffy/,Single-player;Steam Achievements;Full controller support;Steam Cloud;Family Sharing,Action;Indie,https://store.steampowered.com/app/3801500,public_unreleased,full_details,False,2025,"Neffy -Moonlight Labyrinth X- is an action puzzle game where you team up with the young shrine maiden Neffy to solve riddles and overcome traps in a fantasy maze.Originally developed for VR, the game has been carefully optimized for consoles—now more accessible than ever!","*;, Simplified Chinese, Traditional Chinese, Japanese;*;*",,,,2025-08-02
game,Blue Hawaii Aniki's Soft Ore Demand DEBUT,3893140,Kirishima Shoichi,Kirishima Shoichi,,Single-player;Family Sharing,Adventure,https://store.steampowered.com/app/3893140,public_unreleased,full_details,False,Coming soon,The Blue Hawaii Aniki’s legend begins. The debut of the late-night variety show-style novel game is here! Experience the puzzling and hilarious developments of the cast and their eccentric characters. The next installment is scheduled for release in November 2025!,Japanese;English,,,,2025-08-02
game,MuTris,3914150,Martin Edmaier,Martin Edmaier,,Single-player;Color Alternatives;Custom Volume Controls;Adjustable Difficulty;Playable without Timed Input;Stereo Sound;Surround Sound;Family Sharing,Action;Casual;Indie;Strategy,https://store.steampowered.com/app/3914150,public_unreleased,full_details,False,Coming soon,"A fast-paced falling block puzzle game where you rotate, stack, and clear blocks to score points and outlast the speed. Featuring classic mechanics with modern twists, solo challenges",*;*,,,,2025-08-02
game,Blyte,3861920,Pixel Studio,Pixel studio,,Single-player;Full controller support;Adjustable Difficulty;Playable without Timed Input;Save Anytime;Stereo Sound;Family Sharing,Adventure;Indie,https://store.steampowered.com/app/3861920,public_unreleased,full_details,False,Coming soon,"A wacky and hilarious walking simulator that throws you into a surreal universe alongside EVA (who cares about her name, anyway?), filled with improbable misadventures and traps worthy of a master troll. A breath of mocking fresh air in an industry that's far too tame!","*;, French;*;, Italian;*;, German;*;, Simplified Chinese;*;*",,,,2025-08-02
dlc,Academy Love Saga: Tennis Angels EX Artbook,3841440,Tora Creatives,,,Single-player;Downloadable Content;Steam Achievements;Full controller support;Camera Comfort;Color Alternatives;Custom Volume Controls;Adjustable Difficulty;Playable without Timed Input;Steam Cloud;Family Sharing,Casual;Indie;RPG;Simulation;Sports,https://store.steampowered.com/app/3841440,public_unreleased,full_details,False,August 2025,"The Academy Love Saga: Tennis Angels EX digital artbook presents a dazzling array of character illustrations, intricate sketches, and evocative scene artwork from the game, complemented by exclusive early concepts that never reached the final release","*;, Korean, Russian, Simplified Chinese, Traditional Chinese;*",,,,2025-08-02
game,Idle Tycoon Manufacturing,3913140,Eragone,Eragone Games,,Single-player;Steam Achievements;Adjustable Text Size;Camera Comfort;Custom Volume Controls;Playable without Timed Input;Save Anytime;Stereo Sound;Surround Sound;Steam Cloud;Family Sharing,Casual;Indie;Simulation;Strategy;Early Access,https://store.steampowered.com/app/3913140,public_unreleased,full_details,False,Coming soon,"Lead a monster-run industry ! Recruit, upgrade machines, transform ores, and unlock tech. Get rich by mastering strategy and expanding your industrial empire. Ready to conquer the market ?","*;, French;*;*",,,,2025-08-02
game,Carhem,3349910,Bouka Studios,Bouka Studios,,Multi-player;PvP;Online PvP;Full controller support;Family Sharing,Action;Casual;Racing;Early Access,https://store.steampowered.com/app/3349910,public_unreleased,full_details,False,Coming soon,Ready for some Carhem? Carhem is a party PVP game where you and up to 7 friends play a capture the flag type racing game. You'll need to knock your enemy team off the platform or keep them out of the circle to win!,*;*,,,,2025-08-02
game,Thrust 8,3891140,Momentum Games,Momentum Games,,Single-player;Family Sharing,Indie,https://store.steampowered.com/app/3891140,public_unreleased,full_details,False,October 2025,"One day, the protagonist wakes up in a strange place. Bright, stimulating lights dazzle the protagonist's eyes, and beautiful women tempt him. In front of them, firm buttocks of various colors swayed. “If you find the buttocks you want, you can insert it!”",English,,,,2025-08-02
game,36 Zodiac Cycles,3911080,雪中观狐,雪中观狐,,Single-player;Family Sharing,Casual;Indie,https://store.steampowered.com/app/3911080,public_unreleased,full_details,False,Coming soon,"36 Zodiacs Cycles is an unceasing journey of challenges. Trials across Human-Earth-Heaven 3 Tiers, 12 types of Zodiac Games, nearly 30 utterly distinct game challenges. Only by unraveling the Cycle's secrets can shatter this Cycle. Do you choose escape or confront the challenge?",English;Simplified Chinese,,,,2025-08-02
game,I Beat My Meat to My Yandere Goth Friend's Mom,3901890,Bully Revenge Studios,Bully Revenge Studios,,Single-player;Steam Achievements;Custom Volume Controls;Mouse Only Option;Playable without Timed Input;Save Anytime;Family Sharing,Indie;Simulation,https://store.steampowered.com/app/3901890,public_unreleased,full_details,False,"Aug 15, 2025","Experience what it's like to have a giant, violent, sadistic, yandere goth childhood friend who uses you as an outlet for her sadistic and sexual urges.",English;French;Italian;German;Spanish - Spain;Bulgarian;Czech;Danish;Dutch;Finnish;Greek;Hungarian;Indonesian;Japanese;Korean;Norwegian;Polish;Portuguese - Brazil;Romanian;Russian;Simplified Chinese;Swedish;Thai;Traditional Chinese;Turkish;Ukrainian;Vietnamese,,,,2025-08-02
game,暗いトコロ - dark place -,3878340,黒子ラボ,黒子ラボ,https://kuroko-labo.com/,Single-player;Family Sharing,Adventure;Indie,https://store.steampowered.com/app/3878340,public_unreleased,full_details,False,Coming soon,"In the darkness, they are approaching. The protagonist is a detective who has come to the location to search for a person who has disappeared at a haunted spot. A horror game played from a first-person perspective. Can you safely escape from the terrifying abandoned house?",English;Japanese,,,,2025-08-02
game,Digital Eclipse: Cyberpunk Survivor,3734470,Hibernyx,Hibernyx,,Single-player;Multi-player;Co-op;Online Co-op;LAN Co-op;Steam Achievements;Custom Volume Controls;Adjustable Difficulty;Playable without Timed Input;Stereo Sound;Steam Cloud;Stats;Steam Leaderboards;Family Sharing,Action;Casual;Indie;RPG,https://store.steampowered.com/app/3734470,public_unreleased,full_details,False,August 2025,"A rogue-lite co-op bullet hell looter shooter set in a cyberpunk apocalypse. Fight through dozens of missions with dynamic layouts, optional challenges, and persistent upgrades. Unlock weapons, skill trees, and stop the rogue AI Synthex Prime from consuming reality.",English;French;Italian;German;Spanish - Spain;Japanese;Korean;Polish;Portuguese - Brazil;Portuguese - Portugal;Russian;Simplified Chinese;Turkish,,,,2025-08-02
game,Sex Game - Naughty Girls - Episode 3,3907530,EroticGamesClub,EroticGamesClub,http://www.eroticgamesclub.com,Single-player;Steam Achievements;Steam Leaderboards;Family Sharing,Adventure;Casual;Simulation,https://store.steampowered.com/app/3907530,public_unreleased,full_details,False,"Aug 5, 2025","Enjoy an erotic visual novel featuring two hot women and an engaging sex simulator. Juliette and Natalie head to the beach for some summer fun. Being alone with nobody around, they decide to do more than just lounge in the sun, and engage in sex on the sandy beach.",English,,,,2025-08-02
game,Eco-Sentinel: The Bottle Mission,3575750,Ezgi AKIN,Mergen Forest - Ezgi AKIN,https://mergenforest.com/,Single-player;Custom Volume Controls;Keyboard Only Option;Mouse Only Option;Playable without Timed Input;Save Anytime;Family Sharing,Action;Adventure;Casual;RPG;Simulation;Sports;Strategy;Early Access,https://store.steampowered.com/app/3575750,public_unreleased,full_details,False,To be announced,"Collect bottles, avoid the police, and earn money by recycling in a tough city. Sneak, run, and survive as you unlock new areas and chase a better life.",*;*,,,,2025-08-02
game,El 39,3900380,Bohemian Productions;Ramiro Argente;Lucas Gomila,Bohemian Productions,https://linktr.ee/bohemianprods,Single-player;Custom Volume Controls;Playable without Timed Input;Stereo Sound;Family Sharing,Adventure;Casual;Indie,https://store.steampowered.com/app/3900380,public_unreleased,full_details,False,"Nov 10, 2025","Constitución, CABA. 3 AM. You leave a party, feeling defeated because the girl you liked didn't even look at you. You go to wait for the last ""39"" bus of that night. You try to stop it, but it goes straight away. Tomorrow you have the exam that defines whether you graduate or not. Good luck.","*;, Spanish - Latin America;*;*",,,,2025-08-02
