type,name,steam_appid,developers,publishers,website,categories,genres,steam_url,detection_stage,api_response_type,potential_duplicate,release_date,description,supported_languages,followers,wishlists_est,wishlist_rank,discovery_date
game,I Am Your Music,3920210,Leva Studios,Leva Studios,https://www.levagames.com/i-am-your-music,Single-player;Custom Volume Controls;Keyboard Only Option;Playable without Timed Input;Save Anytime;Stereo Sound;Subtitle Options;Family Sharing,Indie;RPG,https://store.steampowered.com/app/3920210,public_unreleased,full_details,False,2026,"At the school fair, Lisa’s music captivates Luna. Inspired, she learns bass and joins the band. Through rehearsals and glances, a special bond forms as their story begins.",*;*,,,,2025-08-08
game,Rite of the Dealer,3931980,Go Face Games,Go Face Games,https://goface.games,Single-player;Full controller support;Playable without Timed Input;Save Anytime;Family Sharing,Indie;Strategy,https://store.steampowered.com/app/3931980,public_unreleased,full_details,False,2026,"Rite of the Dealer is a charmingly eccentric roguelike featuring a unique ""multi-deckbuilding"" system and evolvable creature companions.",English,,,,2025-08-08
game,Fries Drive,3897690,Polgi Games,Polgi Games,https://polgigames.com/,Single-player;Steam Cloud;Family Sharing,Casual;Indie;Simulation,https://store.steampowered.com/app/3897690,public_unreleased,full_details,False,Coming soon,"Take your fries truck on the road and serve freshly cooked potatoes with a variety of sauces! Drive to different locations, take orders, fry, and deliver fast. Upgrade your tools, manage your ingredients, and keep the customers coming back for more.",English;French;Italian;German;Spanish - Spain;Czech;Danish;Finnish;Hungarian;Polish;Portuguese - Portugal;Romanian;Russian;Simplified Chinese;Turkish;Lithuanian,,,,2025-08-08
game,Pharaoh's Leap,3919730,Gamesforgames,Gamesforgames,,Single-player;Steam Achievements;Family Sharing,Action;Adventure;Casual;Simulation;Sports;Strategy,https://store.steampowered.com/app/3919730,public_unreleased,full_details,False,Coming soon,"Jump on platforms, dodge dangers, find hidden secrets and use your skills to get to the final portal and reveal the mystery of the ancient curse!",English,,,,2025-08-08
game,The Matter Gun,3834210,Karumbe Games,Karumbe Games,,Single-player;Full controller support;Family Sharing,Adventure;Indie,https://store.steampowered.com/app/3834210,public_unreleased,full_details,False,To be announced,"DO NOT SHOOT TO KILL? use The Matter Gun to traverse this one of a kind 2d PUZZLE-platformer (metroidvania/brania). Drop into the lab, explore the caves, discover new types of matter, uncover secrets, and try not to cause the end of the world...or something.",English,,,,2025-08-08
game,Born Without Rights,3837280,Mikhail Shaidulin,S.M Game Interactive,,Single-player;Full controller support;Family Sharing,Action;Adventure;Indie;RPG,https://store.steampowered.com/app/3837280,public_unreleased,full_details,False,Q1 2027,"Born Without Rights is a third-person, story-driven action-adventure with stealth, gunfights, and exploration. Inspired by The Last of Us and Max Payne, experience a tense linear story of survival and resistance in a world without freedom.","*;, Italian, Spanish - Spain, Czech, Dutch, Greek, Korean, Polish, Portuguese - Portugal, Russian;*;, Simplified Chinese;*;, Spanish - Latin America, Ukrainian;*",,,,2025-08-08
game,Leyla In Veil,3904870,cloud_li,cloud_li,,Single-player;Steam Achievements;Full controller support;Custom Volume Controls;Adjustable Difficulty;Stereo Sound;Steam Cloud;Family Sharing,Action;Adventure;Indie;RPG,https://store.steampowered.com/app/3904870,public_unreleased,full_details,False,Coming soon,"This is an HD2D side-scrolling action game with roguelike elements, survival horror. In the game, a strange incident occurs at an exhibition hall, Leila, a high-ranking agent of a mysterious organization, who ventures into the eerie gallery with her partner Flora to investigate.",English;Japanese;Simplified Chinese,,,,2025-08-08
game,White Forest,3915110,Half Awake,Half Awake,,Single-player;Family Sharing,Action;Adventure;Indie,https://store.steampowered.com/app/3915110,public_unreleased,full_details,False,To be announced,An unnatural forest has even more unnatural secrets hiding within it. Discover what lies beneath the surface while you investigate trails of blood and carnage which will lead you to untold horrors in this atmospheric First-Person Shooter.,English,,,,2025-08-08
game,Cardygon,3926390,Batpolygon,MadeByBatpolygon,https://batpolygon.github.io/games/cardygon.html,Single-player,Casual;Indie;Strategy;Free To Play,https://store.steampowered.com/app/3926390,public_unreleased,full_details,False,"Aug 22, 2025","Cardygon is a 100% single-player strategic deckbuilder. Collect 80+ cards from the Batpolygon universe crossover. Devise powerful strategies, customize your profile, and build the ultimate deck!",French,,,,2025-08-08
game,Dig For Riches,3934080,OxygenStudio,OxygenStudio,,Single-player;Family Sharing,Action;Adventure;Casual;Indie;RPG;Simulation;Strategy;Early Access,https://store.steampowered.com/app/3934080,public_unreleased,full_details,False,Q3 2025,"Dig For Riches is a realistic mining simulation. Dig the earth, extract valuable minerals, haul them to the surface by cart and sell them. Use your earnings to upgrade your equipment, dig deeper, and face increasing dangers.",English;French;Italian;German;Spanish - Spain;Arabic;Simplified Chinese;Portuguese - Brazil;Dutch;Traditional Chinese;Japanese;Korean;Spanish - Latin America;Norwegian;Portuguese - Portugal;Russian;Turkish;Swedish,,,,2025-08-08
music,恋爱绮谭 不存在的回忆 Soundtrack,3873160,Never Knows Best,,,,,https://store.steampowered.com/app/3873160,public_unreleased,full_details,False,August 2025,《恋爱绮谭 不存在的回忆》原声集,,,,,2025-08-08
game,Pocket Spouse,3891580,Seth Fasnacht,ENTERBRAIN,,Single-player;Steam Achievements;Playable without Timed Input;Save Anytime;Family Sharing,RPG;Simulation,https://store.steampowered.com/app/3891580,public_unreleased,full_details,False,Coming soon,Choose From Eight Unique Spouses. Explore Your New Luxury Homestead And Farmland. Explore Your New Island Home. Complete With Guilds And A Castle. Explore The Deep Woods And Open Beaches. Seek The Hunters Guild And Their Fabled Bestiary. You Never Know What You might Find!,English,,,,2025-08-08
dlc,X-Mode - Unlock All Paid Cosmetics,3763090,xzippyzachx,,,Multi-player;PvP;Online PvP;LAN PvP;Downloadable Content;Steam Achievements;In-App Purchases;Camera Comfort;Color Alternatives;Custom Volume Controls;Playable without Timed Input;Stereo Sound;Partial Controller Support,Action;Casual;Indie;Free To Play,https://store.steampowered.com/app/3763090,public_unreleased,full_details,False,2025,This DLC is a one time purchase that will unlock all paid cosmetics available within X-Mode.,"*;, French, Spanish - Spain, Simplified Chinese, German, Japanese, Polish, Portuguese - Brazil, Russian;*",,,,2025-08-08
game,Head Tracker,3929490,Yusuf Kurt,Yusuf Kurt,,Single-player;Family Sharing,Indie;Simulation;Utilities,https://store.steampowered.com/app/3929490,public_unreleased,full_details,False,Coming soon,"Control games using only your head movements. This innovative virtual joystick application tracks your head using a webcam or external camera, allowing you to control in-game cameras with ease.",English;Turkish,,,,2025-08-08
game,Puzzle Nature,3936120,UwU,UwU,,Single-player;Steam Achievements;Full controller support;Family Sharing,Casual;Indie,https://store.steampowered.com/app/3936120,public_unreleased,full_details,False,Coming soon,"Puzzle Nature - Beautiful nature, wonderful views, everything you need for relaxation.",English;French;Italian;German;Spanish - Spain;Arabic;Bulgarian;Czech;Danish;Dutch;Finnish;Greek;Hungarian;Indonesian;Japanese;Korean;Norwegian;Polish;Portuguese - Brazil;Portuguese - Portugal;Romanian;Russian;Simplified Chinese;Spanish - Latin America;Swedish;Thai;Traditional Chinese;Turkish;Ukrainian;Vietnamese;Afrikaans;Albanian;Amharic;Armenian;Assamese;Azerbaijani;Bangla;Basque;Belarusian;Bosnian;Catalan;Cherokee;Croatian;Dari;Estonian;Filipino;Galician;Georgian;Gujarati;Hausa;Hebrew;Hindi;Icelandic;Igbo;Irish;K'iche';Kannada;Kazakh;Khmer;Kinyarwanda;Konkani;Kyrgyz;Latvian;Lithuanian;Luxembourgish;Macedonian;Malay;Malayalam;Maltese;Maori;Marathi;Mongolian;Nepali;Odia;Persian;Punjabi (Gurmukhi);Punjabi (Shahmukhi);Quechua;Scots;Serbian;Sindhi;Sinhala;Slovak;Slovenian;Sorani;Sotho;Swahili;Tajik;Tamil;Tatar;Telugu;Tigrinya;Tswana;Turkmen;Urdu;Uyghur;Uzbek;Valencian;Welsh;Wolof;Xhosa;Yoruba;Zulu,,,,2025-08-08
demo,Leyla In Veil Demo,3920800,cloud_li,cloud_li,,Single-player;Game demo;Full controller support;Custom Volume Controls;Adjustable Difficulty;Stereo Sound,Action;Adventure;Indie;RPG,https://store.steampowered.com/app/3920800,public_unreleased,full_details,False,Coming soon,"HD2D survival horror roguelike. As agent Leila, explore a shapeshifting haunted gallery with Flora. Fight monsters with limited ammo, manage resources, and upgrade skills. Each run brings new layouts and horrors - adapt your strategy to survive this 2.5D pixel nightmare",English;Japanese;Simplified Chinese,,,,2025-08-08
game,I Pulled a Goth Baddie by Being Autistic,3921810,Bully Revenge Studios,Bully Revenge Studios,,Single-player;Steam Achievements;Custom Volume Controls;Mouse Only Option;Playable without Timed Input;Save Anytime;Family Sharing,Indie;Simulation,https://store.steampowered.com/app/3921810,public_unreleased,full_details,False,"Aug 8, 2025","Experience what it's like to have a 277cm tall, giant, weird, autistic, freaky, sexy, big-breasted, goth baddie as your best friend.",English;French;Italian;German;Spanish - Spain;Bulgarian;Czech;Danish;Dutch;Finnish;Greek;Hungarian;Indonesian;Japanese;Korean;Norwegian;Polish;Portuguese - Brazil;Romanian;Russian;Simplified Chinese;Swedish;Thai;Traditional Chinese;Turkish;Ukrainian;Vietnamese,,,,2025-08-08
game,Save the Forest,3832200,Jens Arvidsson,Jens Arvidsson,,Single-player;Partial Controller Support;Family Sharing,Strategy,https://store.steampowered.com/app/3832200,public_unreleased,full_details,False,To be announced,"Save the Forest is a tactics roguelite where you recruit, upgrade and fight your way through focused, highly varied runs. Choose and combine from over 25 units and 100+ skills to defeat the evil spreading through the forest.",English,,,,2025-08-08
game,Idle Harem Dungeon,3318170,Cheedle,Cheedle,,Single-player;Family Sharing,Casual;Indie;RPG,https://store.steampowered.com/app/3318170,public_unreleased,full_details,False,To be announced,"Upon hearing your dreams of making her yours one day, the beautiful and sadistic goddess Era comes to you with a proposal: survive and seduce her seven chosen warriors, and she will consider making your dreams a reality. Will you succeed or die, over and over again, trying?",English,,,,2025-08-08
demo,The Spirit Engine DX Demo,3689900,Mark Pay;Aquellex,Aquellex,https://impress.games/app/kitty/press-kit/the-spirit-engine-dx,Single-player;Game demo;Camera Comfort;Custom Volume Controls;Adjustable Difficulty;Playable without Timed Input;Stereo Sound,Indie;RPG;Strategy,https://store.steampowered.com/app/3689900,public_unreleased,full_details,False,September 2025,"A complete remake of the original 2003 game! Choose a party of 3 (out of 9 based on 3 classes) and get involved in this realtime JRPG with time dilation controls, skill tables, (un)lockable difficulty settings, and dialogue that changes depending on party selection!",English,,,,2025-08-08
game,The Milk,3933560,Kavari Studio,Kavari Studio,,Single-player;Steam Achievements;Full controller support;Family Sharing,Casual;Indie,https://store.steampowered.com/app/3933560,public_unreleased,full_details,False,Coming soon,The Milk is a first-person challenge. No checkpoints. One goal: buy milk. One rule: survive the chaos… or start over.,English,,,,2025-08-08
dlc,恋爱绮谭 不存在的回忆 电子版设定集,3873170,Never Knows Best,,https://www.nkbgame.moe,Single-player;Downloadable Content,Adventure,https://store.steampowered.com/app/3873170,public_unreleased,full_details,False,August 2025,本DLC为《恋爱绮谭 不存在的回忆》电子版设定集。 电子设定集全64页，内容包含人物设定原案、CG原案等内容。,*;*,,,,2025-08-08
game,高考二周目 Second Round of the Gaokao,3915190,前路好长,前路好长,,Single-player;Custom Volume Controls;Keyboard Only Option;Mouse Only Option;Playable without Timed Input;Save Anytime;Subtitle Options;Family Sharing,Casual;Indie;RPG;Simulation,https://store.steampowered.com/app/3915190,public_unreleased,full_details,False,Q3 2025,"What's the point of going to a lousy university? The principal is telling you to repeat the year. Lay a solid foundation in the third year of high school, and get into a 985 university in the fourth. This is a story-driven visual novel centered on the life of a senior year returnee.",Simplified Chinese,,,,2025-08-08
game,Resort Manager,3917750,Nesalis Games,FreeMind S.A.,http://www.nesalisgames.com/,Single-player;Steam Achievements;Full controller support;Custom Volume Controls;Playable without Timed Input;Save Anytime;Stereo Sound;Family Sharing,Casual;Indie;Simulation;Strategy,https://store.steampowered.com/app/3917750,public_unreleased,full_details,False,2025,"Resort Manager – become the owner of a holiday resort and build the tourist empire of your dreams! Manage, invest, and grow your summer haven to attract more and more guests and transform a small getaway into a vibrant hotspot full of attractions.","*;, French, Italian, German, Spanish - Spain, Arabic, Traditional Chinese, Simplified Chinese, Japanese, Korean, Polish, Portuguese - Portugal, Portuguese - Brazil, Russian, Turkish, Ukrainian;*",,,,2025-08-08
game,Scarlet Backrooms,2859420,BlueFireDev,BlueFire Publishing,,Single-player;Family Sharing,Adventure;Indie,https://store.steampowered.com/app/2859420,public_unreleased,full_details,False,To be announced,"Worlds Merge, Multiple Backrooms Dimensions are discovered. The Scarlet Dimension is the first one.",English,,,,2025-08-08
game,Guardian of Altai,3896760,Surreal Overflow,Surreal Overflow,https://surrealoverflow.games,Single-player;Steam Achievements;Full controller support;Playable without Timed Input,Action;Casual;Indie;Free To Play,https://store.steampowered.com/app/3896760,public_unreleased,full_details,False,August 2025,"Feel like a true Altai shaman in this elemental 3D box magic shooter with a fully diegetic interface! Unleash the powers of fire, water, air, and stone. Battle Erlik's golems, free ancient spirits, and restore balance in a mystical world inspired by Altai mythology.",English;French;Italian;German;Spanish - Spain;Indonesian;Spanish - Latin America;Traditional Chinese;Simplified Chinese;Korean;Polish;Portuguese - Brazil;Portuguese - Portugal;Russian;Turkish;Japanese,,,,2025-08-08
game,CiniCross,3933120,Hydrobates,Hydrobates,,Single-player;Family Sharing,Casual;Indie;Strategy,https://store.steampowered.com/app/3933120,public_unreleased,full_details,False,Coming soon,"CiniCross is a roguelike puzzle game set in a dark fantasy universe. Solve increasingly difficult nonogram puzzles, choose your path through a tree-like dungeon, and adapt your strategy using artifacts and items with unique effects. Each room is a new puzzle, each boss a challenge to overcome.",English,,,,2025-08-08
game,Astra Moment:DIMENSION,3034050,Jeonghwa Arts College;Kim HyeonJoong;Jeong HanHee;Ha HyeonJun,Jeonghwa Arts College,,Single-player,Action;Casual;Free To Play;Early Access,https://store.steampowered.com/app/3034050,public_unreleased,full_details,False,Coming soon,"『Astra Moment:DIMENSION』 is a keyboard-type rhythm game with four lanes. Experience the new play experience of SF rhythm games with original music by students from Jeonghwa University of the Arts, a dimension note system with vibes processed in the air, and operators to help you play.",English;Japanese;Korean,,,,2025-08-08
game,Slime Changer,3930550,MoonJourney,MoonJourney,,Single-player;Full controller support;Custom Volume Controls;Adjustable Difficulty;Keyboard Only Option;Playable without Timed Input;Family Sharing,Action;Adventure;Indie,https://store.steampowered.com/app/3930550,public_unreleased,full_details,False,"Oct 19, 2025","A slime with no memory of who—or what—it is. Absorb others, wield their powers, and embark on a journey to save the world and discover your true identity. Experience fast-paced, stylish action in a brutal yet beautiful dystopia where magic and machines collide.",English;French;Italian;German;Spanish - Spain;Japanese;Korean;Simplified Chinese;Arabic;Bulgarian;Czech;Danish;Dutch;Finnish;Greek;Hungarian;Indonesian;Norwegian;Polish;Portuguese - Brazil;Portuguese - Portugal;Romanian;Russian;Spanish - Latin America;Swedish;Thai;Traditional Chinese;Turkish;Ukrainian;Vietnamese,,,,2025-08-08
game,SteamPanic: Last Shift,3922880,JDF GAMES,JDF GAMES,,Single-player;Steam Achievements;Custom Volume Controls;Playable without Timed Input;Save Anytime;Stereo Sound;Family Sharing,Action;Indie,https://store.steampowered.com/app/3922880,public_unreleased,full_details,False,2026,"In this game, you'll take on the role of an engineer repairing machinery in a steampunk factory. You must keep an eye on the latest ""marvels of technology""—they break down constantly, and the management isn't too happy about that.","*;, French;*;, Italian;*;, German;*;, Spanish - Spain;*;, Portuguese - Portugal;*;, Russian;*;*",,,,2025-08-08
demo,Seeing Red Demo,3482050,Lyterian Games,Lyterian Games,,Single-player;Game demo,Action,https://store.steampowered.com/app/3482050,public_unreleased,full_details,False,Coming soon,"SEEING RED is a first-person survival horror game where isolation and terror reign. As Benjamin, an ex-military detective, return to his haunted hometown to search for his missing sister. Uncover dark secrets and battle grotesque foes.",*;*,,,,2025-08-08
game,Shoot Up Basketball Pro,3872200,mindoverloadgames,mindoverloadgames,,Single-player;Steam Achievements;Partial Controller Support;Family Sharing,Action;Adventure;Indie,https://store.steampowered.com/app/3872200,public_unreleased,full_details,False,September 2025,"Climb to impossible heights using skill, precision, and a basketball. Prove you’re still the GOAT in this punishing platformer where one mistake can send you falling back to the bottom.","*;, French;*;, German;*;, Spanish - Spain;*;, Japanese;*;, Korean;*;, Simplified Chinese;*;*",,,,2025-08-08
game,Nightmare Pick,3928000,YW,YW,,Single-player;Steam Achievements;Full controller support;Custom Volume Controls;Keyboard Only Option;Steam Cloud;Family Sharing,Action;Adventure;Casual;Indie,https://store.steampowered.com/app/3928000,public_unreleased,full_details,False,Coming soon,Nightmare Pick is a simple mining combat game where you upgrade your equipment with ores to defeat monsters blocking your path and find a way to escape the nightmare.,"*;, Simplified Chinese;*;*",,,,2025-08-08
game,Mesmalie,3534790,Rain (orbitaldot),Rain (orbitaldot),https://orbitaldot.com/mesmalie,Single-player;Family Sharing,Adventure;Indie,https://store.steampowered.com/app/3534790,public_unreleased,full_details,False,Coming soon,"MESMALIE is an occult visual novel/point & click adventure where you attempt to tame your Magickal ability under the guidance of a small Witches' coven in the middle of nowhere. Heed Mesmer's aloof teachings, strengthen your Magick, or just go home,,,",English,,,,2025-08-08
game,Tardiness Girl,3929050,Kata,Kata,,Single-player;Steam Achievements;Adjustable Difficulty;Keyboard Only Option;Family Sharing,Action;Adventure;Casual;Indie,https://store.steampowered.com/app/3929050,public_unreleased,full_details,False,"Aug 25, 2025",A short game about high school student who's late for class and must overcome a series of ridiculous obstacles to get to school on time. Navigate a gauntlet of familiar anime tropes.,English;Japanese;Simplified Chinese,,,,2025-08-08
game,Stormlander,3376600,Toylogic Inc.,Toylogic Inc.,,Multi-player;PvP;Online PvP;Cross-Platform Multiplayer;Full controller support;Family Sharing,Action;Massively Multiplayer,https://store.steampowered.com/app/3376600,public_unreleased,full_details,False,Coming soon,"Stormlander is a new online action game that allows up to 100 players to enjoy thrilling siege battles. Customize characters with unique personalities to create your ideal hero that suits your play style, and aim for the top with your friends.","*;, Simplified Chinese, Japanese;*;*",,,,2025-08-08
game,Space Tail: Definitive Edition,3882980,Enjoy Studio,Bohemia Interactive,,Single-player;Partial Controller Support;Family Sharing,Adventure;Casual;Indie,https://store.steampowered.com/app/3882980,public_unreleased,full_details,False,Coming soon,"Space Tail is a 2.5D adventure platformer that follows an emotional, story-driven journey through the cosmos. Play as a brave space-traveling dog exploring mysterious planets, solving puzzles, and forming unique bonds with alien civilizations along the way.","*;, French, German, Spanish - Spain, Japanese, Polish;*;*",,,,2025-08-08
game,Suck Up!,2726370,Proxima,Proxima,https://www.playsuckup.com/,Single-player;Steam Achievements;Captions available;Steam Workshop;Steam Cloud;Includes level editor;Family Sharing,Casual;Indie;Simulation,https://store.steampowered.com/app/2726370,public_unreleased,full_details,False,"Sep 4, 2025","Ready for a vampire adventure in a quiet little town? Suck Up! is a comedic game where you survive as a bloodsucking vampire in the human world. Talk to real AI characters, fool them into trusting you, and find a way into their homes to feed without getting caught.","*;, French;*;, Italian;*;, German;*;, Spanish - Spain;*;, Portuguese - Brazil;*;, Portuguese - Portugal;*;, Spanish - Latin America;*;*",,,,2025-08-08
game,Hiraeth -銀月殘憶-,3894760,Art Lab Studio,Art Lab Studio,,Single-player;Captions available;Custom Volume Controls;Keyboard Only Option;Mouse Only Option;Playable without Timed Input;Save Anytime;Family Sharing,Indie;RPG,https://store.steampowered.com/app/3894760,public_unreleased,full_details,False,Coming soon,《Hiraeth～銀月殘憶》是一款日式西幻劇情文字遊戲，你將會扮演一個失去記憶的主角，你將會影響你的故事發展，遇見性格鮮明的可攻略角色們，透過選擇劇情中出現的不同選項，你將會影響你的故事發展，並逐步探索潛伏在平靜表面下的真相。 【性別可選主角×6個可攻略角色×40萬字以上劇本】,Simplified Chinese;Traditional Chinese,,,,2025-08-08
game,FilterMob – Screen Filter for Eye Protection & Ambience Customization (Gaming & Work),3895750,EMRE YARDIMCI,EMRE YARDIMCI,,Camera Comfort;Color Alternatives;Adjustable Difficulty;Keyboard Only Option;Mouse Only Option;Playable without Timed Input;Save Anytime;Touch Only Option,Design & Illustration;Utilities,https://store.steampowered.com/app/3895750,public_unreleased,full_details,False,Coming soon,"Transform Your Screen with FilterMob! The perfect tool for eye protection, changing your Gaming & Work Atmosphere, or enhancing visual accessibility. Easily apply Color and Image (JPG/PNG) filters. Customize with real-time RGB, saturation, brightness, and transparency adjustments.",English;French;Italian;German;Spanish - Spain;Arabic;Simplified Chinese;Portuguese - Brazil;Bulgarian;Danish;Indonesian;Dutch;Finnish;Traditional Chinese;Japanese;Korean;Spanish - Latin America;Polish;Hungarian;Norwegian;Portuguese - Portugal;Romanian;Russian;Thai;Turkish;Ukrainian;Vietnamese;Greek;Czech;Swedish,,,,2025-08-08
game,ONE BYE ONE,3893740,ULTRA YELLOW,ULTRA YELLOW,https://www.etsy.com/shop/YELLOWultra,Multi-player;PvP;Online PvP;Co-op;Online Co-op;Steam Achievements;Camera Comfort;Custom Volume Controls;Playable without Timed Input;Stereo Sound;Steam Cloud;Family Sharing,Indie,https://store.steampowered.com/app/3893740,public_unreleased,full_details,False,To be announced,"7 Survivors, 6 Doors, 1 Beast. Party horror royale where a survivor's death unlocks a door. YOU are the key. Use your flashlight wisely. And trust nobody. The odds are ALWAYS in your favor.",*;*,,,,2025-08-08
game,Ponchyo: A Platypus Adventure,3801590,Mr.Prinz,Mr.Prinz,,Single-player;Steam Achievements;Full controller support;Camera Comfort;Custom Volume Controls;Playable without Timed Input;Save Anytime;Steam Cloud;Family Sharing,Adventure,https://store.steampowered.com/app/3801590,public_unreleased,full_details,False,2026,Ponchyo: A Platypus Adventure is a charming 3D platformer collectathon full of adventure - and a hint of nostalgia! Play as Ponchyo the platypus and journey through a variety of vibrant worlds. Collect coins and discover new furniture to decorate your home.,English;German,,,,2025-08-08
game,Don't Fowl Down,3932650,Seblin Games,Seblin Games,,Single-player;Family Sharing,Adventure,https://store.steampowered.com/app/3932650,public_unreleased,full_details,False,Q4 2025,"A 3D platformer climbing game where you play as a seemingly struggling chicken. You will climb and fall repeatedly, until you finally reach the heavens you fell from.",English,,,,2025-08-08
game,BattleBalls,3920370,pingus,pingus,,Single-player;Family Sharing,Action;Simulation;Strategy,https://store.steampowered.com/app/3920370,public_unreleased,full_details,False,Coming soon,"Battle Balls is a physics-based arena brawler where you design your own spinning warriors and send it into chaotic fights. Choose your weapon, adjust spin speed, damage, and health, then watch as your creations bounc, slash, and smash their way through the arena.",*;*,,,,2025-08-08
