type,name,steam_appid,developers,publishers,website,categories,genres,steam_url,detection_stage,api_response_type,potential_duplicate,release_date,description,supported_languages,followers,wishlists_est,wishlist_rank,discovery_date
game,Sonak,3528860,Sublime Orange LLC,Sublime Orange LLC,http://www.sonak.org,Single-player;Steam Achievements;Custom Volume Controls;Playable without Timed Input;Save Anytime;Stereo Sound;Surround Sound;Partial Controller Support;Family Sharing,Action;Indie;RPG,https://store.steampowered.com/app/3528860,public_unreleased,full_details,False,Coming soon,"Sharpen your blade and unleash devastating elemental magic in Sonak, a third-person fantasy action RPG. Charge into adventure against relentless monsters, customize your build, craft the ultimate gear, and defeat continuously evolving bosses.",*;*,,,,2025-07-22
game,Splash Zone,3887750,Mr.Huhweewi,Mr.Huhweewi,,Single-player;Multi-player;PvP;Online PvP,Action;Free To Play,https://store.steampowered.com/app/3887750,public_unreleased,full_details,False,Coming soon,"Imagine an FPS game but without all the blood and bullets. Splash Zone is exactly that, a fun first-person shooter where playful ducks battle it out with water guns! Soak your opponents in different arenas across a variety of game modes, from capture the flag to hide and seek.",*;*,,,,2025-07-22
game,Monkey Jump,3876030,Echo Forge,Echo Forge,,Single-player;Family Sharing,Action;Adventure;Casual;Indie,https://store.steampowered.com/app/3876030,public_unreleased,full_details,False,Coming soon,"Play as a customizable monkey in this chaotic 1–8 player party game! Jump, dash, and laugh your way through fun mechanics, colorful gameplay, and endless multiplayer madness.",*;*,,,,2025-07-22
game,MAD TOYS,3345570,RustCrust,RustCrust,,Single-player;Full controller support;Family Sharing,Action,https://store.steampowered.com/app/3345570,public_unreleased,full_details,False,Coming soon,"MadToys is an FPS set in a world of toys. Defend, manage, and upgrade your weapons to fend off the invading enemy forces. Battle through waves of enemies and face challenging boss fights to save the world.",*;*,3,33,,2025-07-22
music,Rootin' Tootin' Lootin' & Shootin' Soundtrack,3420830,Raspberry Jam,,,,,https://store.steampowered.com/app/3420830,public_unreleased,full_details,False,"Aug 28, 2025",The original soundtrack to Rootin' Tootin' Lootin' & Shootin' composed by John Bloor,,,,,2025-07-22
game,Magnavis,3474070,Vorles Games,Vorles Games,https://www.vorles.com/,Multi-player;Co-op;Online Co-op;Family Sharing,Action;Adventure;Indie;Early Access,https://store.steampowered.com/app/3474070,public_unreleased,full_details,False,2025,"Magnavis is a first-person 3D horror game for 1–4 player co-op. Pilot your submarine through tight caves without crashing, complete assigned missions, repair damaged systems—and whatever you do, don’t die.",English;Turkish,,,,2025-07-22
game,Don't Stop In Red Wood,3847330,Diego Victor,Noxus Games Studio,,Single-player;Steam Achievements;Captions available;Custom Volume Controls;Stereo Sound;Surround Sound;Family Sharing,Action;Adventure;Indie,https://store.steampowered.com/app/3847330,public_unreleased,full_details,False,Coming soon,"A legend returns: the cold pines of Red Wood whisper of a hunter reborn… Is he alive, stalking us again?",English;French;Spanish - Spain;Portuguese - Brazil,,,,2025-07-22
game,Tiny Plushie Shop,3610270,Honeyplot Games,Honeyplot Games,,Single-player;Steam Achievements;Full controller support;Custom Volume Controls;Mouse Only Option;Playable without Timed Input;Steam Cloud;Family Sharing,Casual;Indie,https://store.steampowered.com/app/3610270,public_unreleased,full_details,False,Coming soon,"Tiny Plushie Shop is a cozy story-driven puzzle game that features relaxing puzzle mechanics, a heartfelt story and environment customization. Sort magical plushies, learn the history behind the mysterious Cresswell legacy and join Kaitlyn as she faces her past in Wickwood!",English,,,,2025-07-22
game,Cam Quest,3391140,PINKU!,Shady Corner Games,https://shadycorner.com/,Single-player;VR Only;Family Sharing,Casual;Simulation,https://store.steampowered.com/app/3391140,public_unreleased,full_details,False,2025,"As Lexie's most dedicated fan, board a private spaceship for a once-in-a-lifetime chance to get up close and personal with your favorite lewd streamer!",English,,,,2025-07-22
music,Captain Gazman Day Of The Rage Soundtrack - Naval Breeze Radio,3894470,Les Kalifas;Kazarma;VEB Videospielewerk 'Bewegungsdruiden',,,,,https://store.steampowered.com/app/3894470,public_unreleased,full_details,False,"Aug 12, 2025","Car radio station #11. Contains a lot of the late 80's Yugoslavian (and especially Croatian) rock masterpieces, kindly provided by the bands like Unija (Sarajevo), Boye (Novi Sad) and Todor Todor (Knin).",,,,,2025-07-22
game,Heroine Conquest,3823290,BadColor,Shady Corner Games,https://shadycorner.com/,Single-player;Family Sharing,Action;Casual;RPG;Strategy,https://store.steampowered.com/app/3823290,public_unreleased,full_details,False,Coming soon,The Demon Lord has been defeated by the Heroines. It is now up to you to command the evil troops to capture the Heroines and breed them. Conquer the Heroines and help the Demon Lord reign over the lands again.,English;Japanese,,,,2025-07-22
game,T.B.M ~The Blueppers Mayhem~,3879620,The Blueppers Bluepprint Team T.B.B.T.,The Blueppers Bluepprint Team T.B.B.T.,,Multi-player;PvP;Shared/Split Screen PvP;Shared/Split Screen;Steam Achievements;In-App Purchases;Partial Controller Support;Steam Cloud;Steam Leaderboards;Remote Play Together,Action;Casual;Indie;Free To Play,https://store.steampowered.com/app/3879620,public_unreleased,full_details,False,"Aug 7, 2025",The best f2p play there is! Play against a friend or in a public match in fast paced 1v1 battles. Win matches to get resorces for progresion and unlock as many clishers as you can so you can promote as many of them for great rewards. The more support this product gets the more updates it will get!!!,*;*,,,,2025-07-22
game,DeadShore,3805860,NotGass,NotGass,,Single-player;VR Only;Partial Controller Support;Family Sharing,Action;Casual,https://store.steampowered.com/app/3805860,public_unreleased,full_details,False,Coming soon,Deadshore is an VR wave based Island survival filled with the undead. The strategy you pick will be the deciding factor in how long you survive. Pick your weapon of chose and see how long you can survive.,English,,,,2025-07-22
game,Appointment Mentor VR,3724980,Nonpareil Institute,Nonpareil Institute,,Playable without Timed Input,Free To Play;Education,https://store.steampowered.com/app/3724980,public_unreleased,full_details,False,"Aug 29, 2025","Appointment Mentor VR is a free VR experience that helps individuals with autism prepare for doctor visits by simulating the appointment process in a calm, repeatable environment. Created with adults with autism at nonPareil Institute, it builds real-world confidence and skills.",*;*,,,,2025-07-22
game,Firefly Haven,3881680,JAsul,JAsul,,Single-player;Steam Achievements;Camera Comfort;Custom Volume Controls;Mouse Only Option;Playable without Timed Input;Stereo Sound;Steam Cloud;Family Sharing,Casual;Indie;Simulation;Strategy,https://store.steampowered.com/app/3881680,public_unreleased,full_details,False,"Aug 4, 2025","Firefly Haven is an incremental, short cozy game about catching bugs, collecting trophies, traveling to new locations and achieving greatness!",*;*,,,,2025-07-22
game,Castleward,3821270,Amanari Studio,Amanari Studio,,Single-player;Full controller support;Camera Comfort;Custom Volume Controls;Keyboard Only Option;Stereo Sound;Surround Sound;Family Sharing,Action,https://store.steampowered.com/app/3821270,public_unreleased,full_details,False,Coming soon,"Forge your destiny in Castleward! Play as Frida, a young witch and her living hat, facing cursed creatures in a dark castle. Explore striking areas in search of a way out and fight your own way in this challenging retro 2D action game!","*;, Portuguese - Brazil;*;*",,,,2025-07-22
game,Dungeon Hunting Grounds,3892940,Mad Pullz Games,Mad Pullz Games,https://madpullzgames.com,Single-player;Multi-player;Co-op;Shared/Split Screen Co-op;Shared/Split Screen;Full controller support;Remote Play Together;Family Sharing,Strategy,https://store.steampowered.com/app/3892940,public_unreleased,full_details,False,September 2026,A deck-building video game featuring single and two-player local co-op battles against monstrous foes in treacherous dungeons.,*;*,,,,2025-07-22
demo,Lost&Found: The Demo,3874010,MsMod,MsMod Studios,https://sites.google.com/view/msmodstudios/game-download/lostfounddemo?authuser=0,Single-player;Game demo;Steam Achievements,Simulation,https://store.steampowered.com/app/3874010,public_unreleased,full_details,False,Coming soon,"You play as Olivia Sasaki, a new student who moved to Japan all the way from America. Meet new friends and search for lost things, you might just end up finding yourself along the way!",*;*,,,,2025-07-22
demo,Spirit Whisperer Conversation With Akari Demo,3885260,Feeling Potion,Feeling Potion,,Single-player;Game demo,Adventure;Casual,https://store.steampowered.com/app/3885260,public_unreleased,full_details,False,Coming soon,"Akari was a beloved streamer—until she died live on camera. Now, as a spirit, she’s still performing. You’ve been hired to speak with her, and uncover the truth behind the smile she never took off.",English,,,,2025-07-22
game,F.R.A.G.G.,3290320,HalfDream Games,HalfDream Games,https://fragggame.com,Single-player;Multi-player;PvP;Online PvP;LAN PvP;Adjustable Text Size;Color Alternatives;Custom Volume Controls;Adjustable Difficulty;Playable without Timed Input;Stereo Sound;Subtitle Options;Surround Sound;Family Sharing,Action;Early Access,https://store.steampowered.com/app/3290320,public_unreleased,full_details,False,To be announced,"F.R.A.G.G. is an Arena FPS with next-generation graphics powered by Unreal Engine 5. Experience action packed, competitive matches with classic arena FPS mechanics blended together with modern FPS game modes, for the next step in Arena FPS gaming.",*;*,,,,2025-07-22
game,Project Manager (Initiation),3845820,PM Consulting & Services Jerzy Bielonko,PM Consulting & Services Jerzy Bielonko,,Single-player;Family Sharing,Simulation;Strategy,https://store.steampowered.com/app/3845820,public_unreleased,full_details,False,"Aug 4, 2025","A strategic game that simulates the work of a Project Manager within a large corporation. From a first-person perspective, you gain the skills and tools essential for PM work during the first stage of a project: Initiation.","*;, French;*;, German;*;, Spanish - Spain;*;, Polish;*;, Portuguese - Portugal;*;*",,,,2025-07-22
game,Agu,3869380,Wendley Felipe,Seriguela Cosmica,,Single-player;Family Sharing,Action;Adventure;Casual;Indie;Early Access,https://store.steampowered.com/app/3869380,public_unreleased,full_details,False,"Aug 4, 2025",Game with simple mechanics but very fun to play.,English,,,,2025-07-22
game,Brawlborn,3890420,ClassicMushroom LLC,ClassicMushroom LLC,,Single-player;Family Sharing,Action,https://store.steampowered.com/app/3890420,public_unreleased,full_details,False,Q4 2025,A fast paced bullethell boxing rougelike that combines fast paced movement with beat em' up mechanics. Discover a wide range of enemies and weapons inside a dungeon full of secrets. Master the art of boxing and become strong enough to reclaim your title as the greatest boxer in the world.,*;*,,,,2025-07-22
game,Day Trading Simulator,3882740,Hazelnut Lab,Hazelnut Lab,,Single-player;Custom Volume Controls;Adjustable Difficulty;Playable without Timed Input;Family Sharing,Indie;Simulation;Early Access,https://store.steampowered.com/app/3882740,public_unreleased,full_details,False,"Jul 30, 2025","Experience a realistic stock market simulator! Buy and sell virtual stocks, respond to dynamic market news, and manage your assets wisely to become a successful investor.",English;Korean,,,,2025-07-22
game,Five Nights at Dream's​,3874470,PurpleCrit,PurpleCrit,,Single-player;Custom Volume Controls;Mouse Only Option;Stereo Sound;Family Sharing,Casual;Indie;RPG;Simulation;Strategy,https://store.steampowered.com/app/3874470,public_unreleased,full_details,False,Coming soon,"Congratulations! You’re the new Night Assistant at Dream, haunted by seductive spirits. Survive 5 nights helping them fulfill their desires… and more. Adults only. No escape—just pleasure.",*;*,,,,2025-07-22
game,重生之再战高考 Reborn: Examine Again,3879180,Team General Pig,Team General Pig,,Single-player;Mouse Only Option;Playable without Timed Input;Save Anytime;Family Sharing,Casual;Indie;Strategy,https://store.steampowered.com/app/3879180,public_unreleased,full_details,False,Q1 2026,"""Reborn: Examine Again"" is a Roguelike game that mainly offers the experience of deck building. What you need to do is to select the appropriate cards to add to your deck and then wait for the wonderful chemical reactions they produce.",English;Simplified Chinese,,,,2025-07-22
game,When the night falls,3563090,Orange Cat Studios,Orange Cat Studios,,Single-player;Steam Achievements;Adjustable Text Size;Custom Volume Controls;Narrated Game Menus;Playable without Timed Input;Save Anytime;Family Sharing,Adventure;Indie,https://store.steampowered.com/app/3563090,public_unreleased,full_details,False,To be announced,"What starts as usual search for a criminal becomes a serial killer hunt. Following the trail of blood, Detective Josias finds himself entangled ethical dilemmas.",English;Portuguese - Brazil;Spanish - Latin America,,,,2025-07-22
game,H2My Park Game,3838710,Michael Szonn,Michael Szonn,https://www.szonngames.com/h2myparkgame,Single-player;Mouse Only Option;Playable without Timed Input;Stereo Sound;Family Sharing,Casual;Indie;Simulation;Strategy,https://store.steampowered.com/app/3838710,public_unreleased,full_details,False,August 2025,"H2My Park Game - A structure-, simulation- and strategy game with the production of solar energy and hydrogen.",English;French;German;Spanish - Spain;Portuguese - Brazil;Simplified Chinese,,,,2025-07-22
game,Service with a Shotgun,3777020,Nolyn Vansyckle,Silver Lining Interactive,,Single-player;Steam Achievements;Full controller support;Family Sharing,Action;Casual;Indie,https://store.steampowered.com/app/3777020,public_unreleased,full_details,False,Q4 2025,Service With a Shotgun [SWAS] is a mash up of visual novel storytelling and chaotic wave game shooting. You're the last poor soul manning a beat-up roadside shop in the middle of the zombie apocalypse. Shoot straight. Talk fast. Surely nothing can go wrong. Right?,English,,,,2025-07-22
game,Tour - Chess Puzzles,3885850,Alberithmic,Alberithmic,,Single-player;Custom Volume Controls;Mouse Only Option;Playable without Timed Input;Family Sharing,Casual;Indie,https://store.steampowered.com/app/3885850,public_unreleased,full_details,False,2025,"Elegant, varied and challenging chess-themed puzzles. No prior knowledge of chess is needed.",English,,,,2025-07-22
game,Sheltered from the Storm,3251940,Echo Loop Games,Echo Loop Games,,Single-player;Captions available;Camera Comfort;Playable without Timed Input;Stereo Sound;Family Sharing,Casual;Indie;RPG;Simulation;Early Access,https://store.steampowered.com/app/3251940,public_unreleased,full_details,False,Coming soon,"A calm, atmospheric experience where you rest in shelters—cars, camps, houses, and an underground banker—while rain falls and danger lingers outside. No combat, no survival meters—just immersive weather, ambient soundscapes, and quiet reflection.",*;*,,,,2025-07-22
game,Fractured Rift,3581670,Sword96,Sword96,,Single-player;Custom Volume Controls;Playable without Timed Input;Save Anytime;Family Sharing,Indie;Strategy;Early Access,https://store.steampowered.com/app/3581670,public_unreleased,full_details,False,Coming soon,A turn-based rogue lite where you build a team and fight through endless procedurally generated floors.,English,,,,2025-07-22
game,Overheat,3619610,Meboxen Studio,Meboxen Studio,,Single-player;Camera Comfort;Custom Volume Controls;Adjustable Difficulty;Mouse Only Option;Playable without Timed Input;Stereo Sound;Family Sharing,Indie;Strategy,https://store.steampowered.com/app/3619610,public_unreleased,full_details,False,Coming soon,"Overheat is a factory-rouge-like game. Build factory pipelines and defenses, with a variety of unique plugins, carefully deploy buildings to avoid overheating and face a series of enemy attacks!",Simplified Chinese;English,,,,2025-07-22
game,Velocity Racing: 1000,3878690,Rumen Kostov,Rumen Kostov,,Single-player;Multi-player;Co-op;Online Co-op;LAN Co-op;Camera Comfort;Adjustable Difficulty;Playable without Timed Input;Save Anytime;Stereo Sound;Partial Controller Support;Family Sharing,Indie;Racing;Simulation,https://store.steampowered.com/app/3878690,public_unreleased,full_details,False,Coming soon,"A sleek, customizable arcade-style racer built by a solo developer. Unlock 21+ cars, race across 5 detailed maps, tweak every setting, and compete solo or in co-op via Steam lobbies.",*;*,,,,2025-07-22
game,OVERSOULS,3891000,flimsed,flimsy games,,Single-player;Steam Achievements;Full controller support;Captions available,Casual;Indie;Strategy;Free To Play,https://store.steampowered.com/app/3891000,public_unreleased,full_details,False,Coming soon,OVERSOULS is a fast-paced puzzle-action game with a relatively deep lore to uncover throughout the game.,*;*,,,,2025-07-22
game,Tiny: The Last Wayfinder,3859770,Foldup Games,Foldup Games,http://foldupgames.com,Single-player;Partial Controller Support;Family Sharing,Adventure;Indie,https://store.steampowered.com/app/3859770,public_unreleased,full_details,False,Q2 2026,"A wholesome adventure through an oversized world. Explore freely, solve puzzles, and unlock new paths using magic, tools, and traversal abilities in this calm, atmospheric world filled with secrets, story, and gentle creatures.",English,,,,2025-07-22
game,Clive Barker's Hellraiser: Revival,1551980,Saber Interactive,Saber Interactive,https://hellraisergame.com,Single-player;Steam Achievements;Full controller support;Steam Cloud;Family Sharing,Action,https://store.steampowered.com/app/1551980,public_unreleased,full_details,False,Coming soon,Experience a new chapter in the legendary horror series like never before. Clive Barker's Hellraiser: Revival takes first-person action horror survival to the next level. Wield the powers of the Genesis Configuration puzzle box to survive your bargain with the infamous Pinhead.,"*;, French, Italian, German, Spanish - Spain, Russian, Simplified Chinese;*",1248,13728,,2025-07-22
game,The Devilry Reservation 2,3805950,GentFish,GentFish,,Single-player;Steam Achievements;Custom Volume Controls;Save Anytime;Stereo Sound;Family Sharing,Adventure;Casual;RPG,https://store.steampowered.com/app/3805950,public_unreleased,full_details,False,Coming soon,"Immerse yourself in the mystical atmosphere of Slavic folklore and post-Soviet aesthetics. Escape the system, seek the truth among half-forgotten myths and urban legends. In this madness, every clue is part of someone else’s game, and your past is the greatest mystery.",English;French;German;Spanish - Spain;Danish;Simplified Chinese;Norwegian;Russian;Finnish;Swedish;Japanese;Italian;Polish,,,,2025-07-22
demo,This Game Exists Now Demo,3890410,Matthew Shane Williams,MEEEEEE,,Single-player;Game demo;Full controller support;Narrated Game Menus;Playable without Timed Input;Save Anytime,,https://store.steampowered.com/app/3890410,public_unreleased,full_details,False,To be announced,This is a training ground made by the narrator to train you for the real This Game Exists Now.,,,,,2025-07-22
game,Hentai Summer Swap 2,3886930,Utsukushii Games,Utsukushii Games,,Single-player;Family Sharing,Casual,https://store.steampowered.com/app/3886930,public_unreleased,full_details,False,Coming soon,"Enjoy a sizzling summer in Hentai Summer Swap 2! Solve relaxing tile puzzles and unlock beautiful anime-style artwork of girls having fun in the sun. Light, casual, and perfect for summer days!",English,,,,2025-07-22
demo,Spreadsheets and Nothing More Demo,3889500,Rinanda Hidayat,Rinanda Hidayat,,Single-player;Game demo;Custom Volume Controls;Playable without Timed Input,Simulation,https://store.steampowered.com/app/3889500,public_unreleased,full_details,False,August 2025,An experimental work simulator where all you do is type simple data into spreadsheet,English,,,,2025-07-22
game,Drifted,3721550,ESC Games,ESC Games,https://linktr.ee/escgames,Single-player,Casual;Indie;Free To Play,https://store.steampowered.com/app/3721550,public_unreleased,full_details,False,Coming soon,"DRIFTED is a 3d horror mystery game, as you explore a mansion looking for your missing friend, you will find many secrets within as you uncover the mystery behind their disappearance. Between locked rooms and fighting monsters, who knows what you will uncover!","*;, Portuguese - Brazil;*;, Spanish - Latin America;*;*",,,,2025-07-22
game,Kero Kero Cowboy,3884910,MetagameMike,MetagameMike,,Single-player;Keyboard Only Option;Playable without Timed Input;Partial Controller Support;Family Sharing,Action;Indie,https://store.steampowered.com/app/3884910,public_unreleased,full_details,False,Coming soon,"Kero Kero Cowboy is a cartoony western themed platformer developed for the Game Boy Color! Use your extendable tongue, trusty six-shooter, and wits to conquer the wildest outlaws of the west. Yeehaw!",English,,,,2025-07-22
game,Thekku Island,3889480,Ales Devs,Ales Devs Games,https://youtube.com/@alesdevsgames?si=KLWywjq9FU6Osvos,Single-player;Steam Achievements;Camera Comfort;Custom Volume Controls;Playable without Timed Input;Stereo Sound;Surround Sound;Family Sharing,Adventure,https://store.steampowered.com/app/3889480,public_unreleased,full_details,False,Coming soon,"A chilling psychological horror set in 1980s Kerala. After weeks of silence, you arrive on a remote island to search for your missing wife. Explore an abandoned house, uncover local folklore, survive haunting encounters, and unravel the island’s buried secrets.","*;, Malayalam;*;*",,,,2025-07-22
game,I Need to Leave,3687770,Type-B,Type-B,,Single-player;Steam Achievements;Custom Volume Controls;Mouse Only Option;Playable without Timed Input;Save Anytime;Touch Only Option;Steam Cloud;Family Sharing,Casual;Indie,https://store.steampowered.com/app/3687770,public_unreleased,full_details,False,2025,"I Need To Leave is a point-and-click escape game. The door is never locked, yet you keep returning to where you started. Search for clues and find the right way to leave this shared apartment of anthropomorphic animals.",English;French;Italian;German;Spanish - Spain;Danish;Russian;Bulgarian;Hungarian;Indonesian;Turkish;Greek;Norwegian;Czech;Japanese;Polish;Thai;Ukrainian;Swedish;Simplified Chinese;Traditional Chinese;Romanian;Finnish;Dutch;Portuguese - Brazil;Portuguese - Portugal;Spanish - Latin America;Vietnamese;Arabic;Korean;Azerbaijani;Armenian;Igbo;Sindhi;Sinhala;Quechua;Croatian;Icelandic;Cherokee;Galician;Catalan;Afrikaans;Hindi;Gujarati;Swahili;Kyrgyz;Kazakh;Georgian;Turkmen;Tamil;K'iche';Tajik;Serbian;Sotho;Odia;Welsh;Konkani;Bangla;Amharic;Nepali;Basque;Hebrew;Kannada;Estonian;Irish;Latvian;Tigrinya;Slovak;Slovenian;Punjabi (Gurmukhi);Punjabi (Shahmukhi);Tswana;Maori;Wolof;Bosnian;Persian;Telugu;Urdu;Uzbek;Valencian;Belarusian;Kinyarwanda;Luxembourgish;Zulu;Xhosa;Lithuanian;Yoruba;Sorani;Uyghur;Filipino;Mongolian;Scots;Hausa;Dari;Albanian;Assamese;Tatar;Malay;Macedonian;Marathi;Malayalam;Maltese;Khmer,,,,2025-07-22
game,SCRYBE,3856090,Goblin Byte,Goblin Byte,,Single-player;Steam Achievements;Full controller support;Custom Volume Controls;Keyboard Only Option;Mouse Only Option;Playable without Timed Input;Save Anytime;Touch Only Option;Steam Cloud;Family Sharing,Indie,https://store.steampowered.com/app/3856090,public_unreleased,full_details,False,Coming soon,"SCRYBE is a incremental game that can be played however you want, with plenty of playstyles! fight cities for hidden resources. unlock secrets and equipables to help you on your quest, play however you want there is no right way to play",English,,,,2025-07-22
game,Pumuckl und die Krone des Piratenkönigs,3864960,Quantumfrog,Quantumfrog,https://pumuckl-game.de,Single-player;Multi-player;Full controller support;Family Sharing,Adventure;Casual;Indie;Strategy,https://store.steampowered.com/app/3864960,public_unreleased,full_details,False,Coming soon,"The famous German kobold Pumuckl is back with a 3D puzzle adventure game “Pumuckl und die Krone des Piratenkönigs”. The player controls Pumuckl through 3D puzzle levels, plays mini-games, solves tricky challenges and has to defeat ghostly enemies.",German,,,,2025-07-22
game,Egg Finder,3846020,Allison Disley,Allison Disley,,Single-player;Family Sharing,Adventure;Casual;Indie;RPG,https://store.steampowered.com/app/3846020,public_unreleased,full_details,False,"Aug 4, 2025",Find the eggs.,English,,,,2025-07-22
game,Second Coat,2854790,NZ Game Studio,NZ Game Studio,https://nzgamestudio.com,Multi-player;PvP;Online PvP;Family Sharing,Action;Strategy,https://store.steampowered.com/app/2854790,public_unreleased,full_details,False,Coming soon,"Second Coat is a fast-paced multiplayer paintball game where players compete against each other by using strategy and skill to outmaneuver opponents, rack up eliminations, and achieve victory.",*;*,,,,2025-07-22
