type,name,steam_appid,developers,publishers,website,categories,genres,steam_url,detection_stage,api_response_type,potential_duplicate,release_date,description,supported_languages,followers,wishlists_est,wishlist_rank,discovery_date
game,SCP: Project Pneuma,3872430,Zatun,Zatun,https://zatun.com/games/scp-project-pneuma/,Single-player;Custom Volume Controls;Playable without Timed Input;Stereo Sound;Surround Sound;Family Sharing,Action;Indie,https://store.steampowered.com/app/3872430,public_unreleased,full_details,False,Coming soon,"Project Pneuma is a cinematic first-person survival horror game set in the SCP universe. As Dr. Alexander, survive a betrayal, evade deadly anomalies like SCP-096, SCP-939, SCP-173, SCP-239 and uncover the secrets of a collapsing world. Fear is your only companion.",*;*,,,,2025-07-17
game,Fantasketch,3844280,Kiguteam;Skeleton Crew Studio,Skeleton Crew Studio,,Single-player;Multi-player;PvP;Shared/Split Screen PvP;Shared/Split Screen;Full controller support;Remote Play Together;Family Sharing,Action;Casual;Indie,https://store.steampowered.com/app/3844280,public_unreleased,full_details,False,Coming soon,"""Fantasketch"" is a new kind of puzzle action game where the characters you draw come to life and move! Control your character and aim for the goal!",English;French;Italian;German;Spanish - Spain;Japanese;Korean;Portuguese - Portugal;Simplified Chinese;Traditional Chinese,,,,2025-07-17
game,The Trade Dynasty,3866270,Dogfoot Games,Dogfoot Games,,Single-player;Multi-player;PvP;Online PvP;LAN PvP;Family Sharing,Indie;Simulation;Strategy,https://store.steampowered.com/app/3866270,public_unreleased,full_details,False,"Dec 15, 2025","Start as a small trader and build your trading dynasty. Manage carts and ships, master dynamic markets, trade across land and sea, and protect your fleets in this deep trading and strategy simulation.","*;, German;*;*",,,,2025-07-17
game,Katana,3880640,Shok Games,Shok Games,,Single-player;Steam Achievements;In-App Purchases;Mouse Only Option;Playable without Timed Input,Adventure;Casual;Simulation;Strategy;Free To Play,https://store.steampowered.com/app/3880640,public_unreleased,full_details,False,Coming soon,"Katana is a clicker game where you click... a katana! Click the katana to earn more katanas — simple, addictive, and ever-growing. Every 3 hours, you’ll receive a random katana drop to add to your collection.",English,,,,2025-07-17
game,Mama Idol Manor,2989760,Mikan Batake,Mango Party;Mango Party News,,Single-player;Steam Cloud;Family Sharing,Indie;RPG;Simulation,https://store.steampowered.com/app/2989760,public_unreleased,full_details,False,October 2025,"A busty brothel management sim featuring voluptuous heroines, animated H-scenes, and multiple endings driven by lewdness and desire.","*;, English, Simplified Chinese, Traditional Chinese, Korean;*",,,,2025-07-17
game,Ys X: Proud Nordics,3821790,Nihon Falcom,Clouded Leopard Entertainment,,Single-player;Steam Achievements;Full controller support;Steam Cloud;Family Sharing,Action;RPG,https://store.steampowered.com/app/3821790,public_unreleased,full_details,False,"Aug 20, 2025","Embark on a new adventure with pride in your heart! The action RPG Ys X:Nordics returns to Steam® with a massive upgrade—introducing new story content, new adventure areas, and a host of new features in Ys X: Proud Nordics!",Simplified Chinese;Traditional Chinese;Korean,,,,2025-07-17
game,YAPYAP,3834090,BAP HQ,BAP HQ,,Single-player;Multi-player;Co-op;Online Co-op;Family Sharing,Action,https://store.steampowered.com/app/3834090,public_unreleased,full_details,False,Coming soon,"Online co-op horror game where up to 4 wizard minions go into an archmage’s tower. Use an assortment of spells to vandalize, break and steal - but beware the horrifying magical creatures that roam the halls.",*;*,,,,2025-07-17
game,BPROOF,3838660,Dexsolutions,Dexsolutions,http://www.Dexsolutions.de,Single-player;Multi-player;Co-op;Online Co-op;LAN Co-op;Steam Achievements;Custom Volume Controls;Adjustable Difficulty;Playable without Timed Input;Steam Cloud;Family Sharing,Action;Casual;Indie;Simulation,https://store.steampowered.com/app/3838660,public_unreleased,full_details,False,Coming soon,"BPROOF is a Wave based Multiplayer Shooter up to 4 Players Coop. It has several Maps on many Settings like Western Citys, Strange Planets or Post Apocalyptic places. You can set your Match as you want with many Settings.",*;*,,,,2025-07-17
game,Home,3877090,Mr.Spoon,Mr.Spoon,,Single-player;Custom Volume Controls;Save Anytime;Stereo Sound;Family Sharing,Indie,https://store.steampowered.com/app/3877090,public_unreleased,full_details,False,"Nov 20, 2025","A solo-developed game created entirely by one person—from the script to the graphics and music. This visual novel, based on a true story, is woven together with musical elements. Experience a story that feels like a musical film.",English;Japanese;Korean,,,,2025-07-17
game,Lurker,3859140,ChockChock,ChockChock,,Multi-player;PvP;Online PvP;LAN PvP;Co-op;Online Co-op;LAN Co-op;Family Sharing,Action;Adventure;Casual;Indie;Strategy,https://store.steampowered.com/app/3859140,public_unreleased,full_details,False,Coming soon,Lurker is a game about finding spies who are moving to fail the mission. It combines traditional psychological warfare in the lineage of mafia games with roguelike and various puzzle elements. Uncomfortable cooperation with completely unreliable teammates and overcome random difficulties!,English;Korean,,,,2025-07-17
game,Stretcher Together,3883760,Goosix Games,Goosix Games,https://discord.gg/sbBQgRAZjq,Multi-player;Co-op;Online Co-op;LAN Co-op;Steam Achievements;Family Sharing,Action;Indie;Massively Multiplayer;Simulation,https://store.steampowered.com/app/3883760,public_unreleased,full_details,False,"Aug 7, 2025","Stretcher Together is a cooperative 3D platformer for two players. You play as medics rescuing a patient after a fall. Jump, balance, and climb your way up—but don’t drop the patient, or you’ll have to go back down to retrieve them!",English;French;Italian;German;Spanish - Spain;Simplified Chinese;Polish;Russian;Thai;Turkish;Ukrainian;Japanese,,,,2025-07-17
game,THAT PLACE,3517670,JEANA,JEANA,,Single-player;Family Sharing,Casual;Indie;RPG;Simulation,https://store.steampowered.com/app/3517670,public_unreleased,full_details,False,Coming soon,"This game is a short narrative visual novel. Years ago, the protagonist left his hometown due to a misunderstanding. Though he often thought of returning, he never did. One day, feeling lost, he meets a mysterious blue-haired girl who seems to know everything—and inspires him to finally go home.",English;Simplified Chinese;Traditional Chinese,,,,2025-07-17
game,Someone Creepy,3819200,SalmonD,Darks Zone,,Single-player;Steam Achievements;Family Sharing,Action;Indie,https://store.steampowered.com/app/3819200,public_unreleased,full_details,False,"Jul 31, 2025",Someone Creepy is a horror game about a women who is being stalked by someone and that stalker is going to take big steps to disrupt her life.,*;*,,,,2025-07-17
game,Cutting Edge,3639510,Wizbird Games LLC,Wizbird Games LLC,,Single-player;Steam Achievements;Custom Volume Controls;Steam Cloud;Family Sharing,Action;Simulation,https://store.steampowered.com/app/3639510,public_unreleased,full_details,False,2026,"Perform life-saving operations in this fast-paced surgery sim. As lizard surgeon Dr. Peri Maddock, you'll treat injuries, excise tumors, and hack corporate organs with speedy, surgical precision. The patient's life is in your claws!",English,,,,2025-07-17
game,Running Fable Petite Party,3866300,Seashell Studio,Seashell Studio,,Single-player;Multi-player;PvP;Shared/Split Screen PvP;Shared/Split Screen;Steam Achievements;Full controller support;Remote Play Together;Family Sharing,Action;Casual;Indie,https://store.steampowered.com/app/3866300,public_unreleased,full_details,False,2025,"Running Fable Petite Party throws you and your friends into 16 fast-paced, friendship-testing mini-games across 3 tabletop arenas. Outsmart, outplay, and out laugh each other in this ultimate party showdown for 1–4 players!",English;French;Italian;German;Spanish - Spain,,,,2025-07-17
game,Project Epsilon,1397440,TwistedRed,TwistedRed,https://www.exomecha.com/,Multi-player;PvP;Online PvP;Co-op;Online Co-op;Cross-Platform Multiplayer;Steam Achievements;Full controller support;In-App Purchases;Family Sharing,Action;Indie;Massively Multiplayer,https://store.steampowered.com/app/1397440,public_unreleased,full_details,False,Q1 2026,"EXOMECHA™ is a brand-new multiplayer shooter that takes place in OMECHA, an untouched planet with exotic environments. It offers you a breathtaking sci-fi gaming experience with its infantry, vehicular and mecha combat.","*;, French, Italian, German, Spanish - Spain, Arabic, Japanese, Korean, Polish, Portuguese - Brazil, Russian, Simplified Chinese, Turkish, Traditional Chinese, Spanish - Latin America;*",,,,2025-07-17
game,Hospital Hell,2489580,Sacrosanct Studios,Sacrosanct Studios,,Single-player;Steam Achievements;Full controller support;Family Sharing,Action;Indie,https://store.steampowered.com/app/2489580,public_unreleased,full_details,False,Coming soon,"Hospital Hell is a first-person survival horror game where you will fight zombies and other abominable nightmares. Explore the halls of St. Olga's Hospital and try to solve the mystery of why this place that was once considered a refuge, has now turned into Hell.",English,,,,2025-07-17
game,Twin Soul,3844290,CORE8,Skeleton Crew Studio,,Single-player;Full controller support;Family Sharing,Action;Adventure;Indie,https://store.steampowered.com/app/3844290,public_unreleased,full_details,False,To be announced,"Dive into Twin Soul, a music action game set in a world inspired by ancient myths. You'll journey through different areas, facing off against powerful gods to clear stages. You will experience the story from two perspectives as you uncover the contrasting paths of our two heroes.",English;Japanese,,,,2025-07-17
dlc,ION Shift - VR Missions,3878150,Electro Soul Games,,,Single-player;Downloadable Content;Full controller support;Family Sharing,Action;Indie,https://store.steampowered.com/app/3878150,public_unreleased,full_details,False,"Jul 31, 2025","This DLC adds 8 brand-new levels packed with fresh challenges, enemies, and new gameplay twists. Push your skills further as you explore intense new environments and uncover hidden secrets.",English;Russian;Portuguese - Portugal;French;Italian;German;Spanish - Spain;Turkish,,,,2025-07-17
game,War and Magic: Kingdom Reborn,3748610,GOAT Games,GOAT Games,,Multi-player;MMO;PvP;Online PvP;Co-op;Online Co-op;Cross-Platform Multiplayer;In-App Purchases;Color Alternatives;Mouse Only Option;Playable without Timed Input;Save Anytime,Massively Multiplayer;RPG;Strategy;Free To Play,https://store.steampowered.com/app/3748610,public_unreleased,full_details,False,Coming soon,"A free 4X wargame combining real-time and turn-based tactical gameplay. Quick strategy game that’s easy to pick up, but winning depends on your strategy!",English;French;German;Spanish - Spain;Russian;Turkish;Japanese;Simplified Chinese;Traditional Chinese;Portuguese - Brazil;Spanish - Latin America;Korean,,,,2025-07-17
game,Alien Fish World VR,3095300,Brooky Games,Brooky Games,https://www.brookygames.com,Single-player;VR Only;Family Sharing,Adventure;Indie;Simulation;Sports,https://store.steampowered.com/app/3095300,public_unreleased,full_details,False,Coming soon,"The galactic cruise ship you're on has been hijacked, the galactic princess has been kidnapped, and you've been shipwrecked on an alien planet. You must rescue the princess and get yourself back home! Learn to catch alien fish to survive, trade with the locals, and find your way back home!",*;*,,,,2025-07-17
game,Citadel Siege 2,3858620,VAVA INDUSTRIA,VAVA INDUSTRIA,,Single-player;Family Sharing,Adventure;Casual;Indie;Simulation;Sports,https://store.steampowered.com/app/3858620,public_unreleased,full_details,False,Q3 2025,"Citadel Siege 2 is a tactical tower defense game where strategy, timing, and adaptation are the keys to survival.",English,,,,2025-07-17
game,隐梦交织,3854080,Millennium Nocturnes,Millennium Nocturnes,,Single-player;Full controller support;Custom Volume Controls;Playable without Timed Input;Family Sharing,RPG,https://store.steampowered.com/app/3854080,public_unreleased,full_details,False,2026,"《Interwoven Dream》 is a Victorian-era visual novel with multiple POVs. In 1884 London, four friends reunite after a string of disappearances, each with their own motives. Together, they dive into the city's darkest secrets, where dreams and reality blur.",Simplified Chinese,,,,2025-07-17
game,Little Aquarium,3858150,ManicBuild,ManicBuild,,Single-player;Mouse Only Option;Playable without Timed Input;Family Sharing,Casual;Indie;Simulation;Strategy,https://store.steampowered.com/app/3858150,public_unreleased,full_details,False,Coming soon,"Little Aquarium is a relaxing idle game where you grow your own underwater world. Collect rare fish, discover vibrant color variants, and decorate your dream tank!",English,,,,2025-07-17
game,Frame Sense Trainer,3841260,Five Games,Five Games,,Single-player;Playable without Timed Input;Family Sharing,Simulation,https://store.steampowered.com/app/3841260,public_unreleased,full_details,False,Coming soon,"Frame Sense Trainer is a timing-focused training app that helps animators, developers, and Esports athletes build Temporal Frame Estimation—an internal sense of how long animations last in frames at 60 FPS through tutorials, exercises, and quizzes.",*;*,,,,2025-07-17
game,Rythm Animal Café,3859210,Salt Game Studio,XD,,Single-player;Full controller support;Custom Volume Controls;Playable without Timed Input;Stereo Sound;Includes level editor;Family Sharing,Casual;Indie,https://store.steampowered.com/app/3859210,public_unreleased,full_details,False,Q1 2026,"Welcome to ​Rhythm Animal Café​! Animals' daily chaos meets funky beats: boss hype, colleague woes, your slacking, unfair blame—all become hilarious one-tap rhythm games! Simple controls, joyful groove. Feel music fuse with daily life’s warmth!",English;Japanese;Simplified Chinese,,,,2025-07-17
game,The Last Joy 2,3860750,Napping Penguin,Napping Penguin,,Single-player;Steam Achievements;Family Sharing,Action;Adventure;Casual;Indie,https://store.steampowered.com/app/3860750,public_unreleased,full_details,False,Coming soon,"Dive into a new nightmare inside an abandoned toy factory where mascots come alive. Explore, survive, and uncover the dark secrets behind The PlayCenter.",*;*,,,,2025-07-17
game,Scrutator Tenebris,3778290,Empty Die Studio,Empty Die Studio,,Single-player;Full controller support;Custom Volume Controls;Keyboard Only Option;Playable without Timed Input;Family Sharing,Adventure;Indie;RPG;Simulation,https://store.steampowered.com/app/3778290,public_unreleased,full_details,False,Coming soon,Become a pathologist in a sinister mansion filled with unsolved mysteries. Examine bodies and make decisions that alter the course of the investigation.Your choices shape multiple story endings in this narrative-driven psychological horror — where every secret could cost your sanity.,English;French;Italian;German;Spanish - Spain;Portuguese - Brazil;Russian;Kazakh;Japanese;Korean;Polish;Simplified Chinese;Turkish;Ukrainian,,,,2025-07-17
game,Meowstoria,2715920,MOT,MOT,https://www.meowstoria.com,Single-player;Full controller support;Family Sharing,Action;Adventure;Casual;RPG,https://store.steampowered.com/app/2715920,public_unreleased,full_details,False,To be announced,"Adventure in a cat-filled world full of monsters… and the monsters here are edible! Meowstoria is an action RPG with hack-and-slash elements, crafting, fishing, cooking, puzzles, and epic boss battles. Relaxed gameplay, full of cat humor, and monsters aren't just for fighting… they're for cooking!",*;*,,,,2025-07-17
game,Cluck To The Top!,2520840,Forged By Ox,LeapForge Entertainment,https://www.forgedbyox.com,Single-player;Steam Achievements;Full controller support;Family Sharing,Adventure;Casual;Indie,https://store.steampowered.com/app/2520840,public_unreleased,full_details,False,Coming soon,You are a rooster and your girl's been birdnapped. Get up there and save her!,*;*,,,,2025-07-17
game,Pentavolt,3850010,Friendly,Friendly,,Single-player;Steam Achievements;Custom Volume Controls;Mouse Only Option;Playable without Timed Input;Save Anytime;Family Sharing,Casual;Indie,https://store.steampowered.com/app/3850010,public_unreleased,full_details,False,Coming soon,"Battle waves of geometric enemies in this incremental strategy game. Unlock powerful upgrades, build custom skill trees, and adapt your tactics to survive. Shape your path to victory in a world of evolving challenges and endless progression. A decent game to scratch the adhd itch",English;German;Spanish - Spain;Japanese;Portuguese - Portugal;Russian;Simplified Chinese;Hindi,,,,2025-07-17
game,MALYSA,3716890,monotone,monotone,,Single-player;Keyboard Only Option;Playable without Timed Input;Partial Controller Support;Family Sharing,Action;Adventure;Casual;Indie,https://store.steampowered.com/app/3716890,public_unreleased,full_details,False,Coming soon,"""Awakening in the sewers, control a protagonist with amnesia, escape from the lurking 'something' in the darkness, and aim to survive and escape in this 3D horror adventure.""",English;Japanese;Simplified Chinese,,,,2025-07-17
game,FALLSAGA,3814160,lyzerfiction,lyzerfiction,https://lyzerfiction.github.io/fallsaga/,Single-player;Full controller support;Stereo Sound;Family Sharing,Adventure;Indie;RPG;Early Access,https://store.steampowered.com/app/3814160,public_unreleased,full_details,False,"Aug 19, 2025",FALLSAGA! The journey of Marcel in search of a legendary waterfall!,English;Turkish,,,,2025-07-17
game,Rogue Diner,3712280,Luca Blazevic,Luca Blazevic,,Single-player;Multi-player;Co-op;Online Co-op;Custom Volume Controls;Playable without Timed Input;Stereo Sound;Family Sharing,Action;Simulation,https://store.steampowered.com/app/3712280,public_unreleased,full_details,False,Coming soon,"Rogue Diner is a chaotic roguelike cooking game for 1–4 players. Build and run your diner, choose your chef, cook dishes, and survive shifting modifiers and demanding guests. Every run is unique – fast-paced, strategic, and unpredictable.",*;*,,,,2025-07-17
game,Cloudside Lane,3842880,Peach Rain,Peach Rain;cdhy interactive,,Single-player;Steam Achievements;Custom Volume Controls;Playable without Timed Input;Save Anytime;Steam Cloud;Family Sharing,Casual;Indie;Simulation,https://store.steampowered.com/app/3842880,public_unreleased,full_details,False,2025,"Cloudside Lane is a small casual building game. Immerse yourself in a tranquil and comfortable environment, build houses and create your own cozy streetscape. There are no scores or rules here, just follow your heart to create and feel.",English;Simplified Chinese;Traditional Chinese;French;Italian;German;Spanish - Spain;Russian;Japanese;Polish;Korean,,,,2025-07-17
game,Neo - The Rainbow Sorcerer,3857180,Wonjae Oh,hydroxidestudios,,Single-player;Color Alternatives;Custom Volume Controls;Keyboard Only Option;Mouse Only Option;Playable without Timed Input;Family Sharing,Action;Casual;Indie,https://store.steampowered.com/app/3857180,public_unreleased,full_details,False,"Jul 28, 2025","A 2D bullet hell plane shooter game with a creative twist in gameplay—instead of shooting down enemies, pick a matching color and swipe them.",*;*,,,,2025-07-17
dlc,Bounty Drag Racing - Supercar Pack 2,3859760,KODgames,,,Multi-player;PvP;Online PvP;Downloadable Content;Family Sharing,Action;Massively Multiplayer;Racing;Simulation;Sports,https://store.steampowered.com/app/3859760,public_unreleased,full_details,False,July 2025,"Bounty Drag Racing now has Highway and Airport racing! This pack includes 6 unique Supercars designed to be used at the new half mile, or full mile race tracks. They are also usable on any other race track in the game. This DLC only includes vehicles, all maps were added to the base game for free.",*;*,,,,2025-07-17
game,Pipe Down,3875650,Emerald Knight Interactive LLC,Emerald Knight Interactive LLC,,Single-player;Custom Volume Controls;Adjustable Difficulty;Playable without Timed Input;Family Sharing,Indie,https://store.steampowered.com/app/3875650,public_unreleased,full_details,False,2025,A pixelated puzzle game about pipes. Enjoy puzzles at various difficulties in four unique modes!,English,,,,2025-07-17
demo,Don't Wake Up My Dream Demo,3742020,Naivus Luo,Naivus Luo,,Single-player;Game demo,,https://store.steampowered.com/app/3742020,public_unreleased,full_details,False,Coming soon,"Embark on a paws-itively cute adventure with a clever dog, solving puzzles and sneaking through quirky episodes","*;, Simplified Chinese;*;*",,,,2025-07-17
game,Bee Master,3854650,Hamza Soyturkoglu,Toggle Game,https://www.togglegame.com/games/beemaster,Single-player;Steam Achievements;Family Sharing,Action;Adventure;Casual;Indie,https://store.steampowered.com/app/3854650,public_unreleased,full_details,False,Coming soon,"A fearless bee sets out on a relentless journey to rescue his captured queen. Dodge vehicles across 4 perilous roads, collect 3 hidden keys, and uncover the island’s mystery!",English;Italian;Spanish - Spain;Arabic;Simplified Chinese;Portuguese - Brazil;Indonesian;Japanese;Korean;Spanish - Latin America;Portuguese - Portugal;Russian;Thai;Turkish;Vietnamese;Greek;Hindi;Telugu;French;German;Punjabi (Shahmukhi),,,,2025-07-17
game,Maze: Path of Light,3795750,"Infinity Games, Lda",QubicGames S.A.,,Single-player;Steam Achievements;Full controller support;Keyboard Only Option;Mouse Only Option;Playable without Timed Input;Steam Cloud;Family Sharing,Casual;Strategy,https://store.steampowered.com/app/3795750,public_unreleased,full_details,False,Coming soon,Discover a universe of mazes in one mesmerizing game.,English,,,,2025-07-17
game,Plant Plots,3857190,Padoru Games,Padoru Games,,Single-player;Steam Achievements;Custom Volume Controls;Mouse Only Option;Playable without Timed Input;Save Anytime;Family Sharing,Casual;Indie;Strategy,https://store.steampowered.com/app/3857190,public_unreleased,full_details,False,Coming soon,"Plant Plots is a relaxing puzzle board game in which you are given an isometric grid of tiles and a set of plants per level. In order to win you have to plant all the given plants, but all of them have different effects over the others! So it is no easy task.",English;French;Italian;German;Japanese;Korean;Polish;Portuguese - Brazil;Russian;Simplified Chinese;Spanish - Latin America;Turkish;Spanish - Spain;Portuguese - Portugal,,,,2025-07-17
demo,CastleOn Demo,3878210,Lord Castleon,Lord Castleon,,Single-player;Game demo;Captions available;Adjustable Text Size;Camera Comfort;Custom Volume Controls;Adjustable Difficulty;Mouse Only Option;Playable without Timed Input;Save Anytime;Stereo Sound;Subtitle Options,Simulation;Strategy,https://store.steampowered.com/app/3878210,public_unreleased,full_details,False,"Jul 31, 2025","Build a castle! Grow economy, recruit troops from Europe and the Holy Land, man the walls and towers! Place traps and defeat attackers with arrows, wood and stone, fire, disease and cold steel! Survive the Third Crusade and conquer enemy lands in this turn-based strategy!",*;*,,,,2025-07-17
game,Chess Commanders,3849010,Skorpion Studios LLC,Skorpion Studios LLC,https://skorpionstudios.com,Multi-player;PvP;Online PvP;Cross-Platform Multiplayer;Custom Volume Controls;Mouse Only Option;Stereo Sound;Touch Only Option;Family Sharing,Action;Casual;Strategy;Early Access,https://store.steampowered.com/app/3849010,public_unreleased,full_details,False,Q3 2025,"A fast-paced TRTS multiplayer chess game with simultaneous moves, real-time tactics, and dynamic FFA or Team battles for up to 8 players. Play on square or hex boards, join matchmaking or custom lobbies, and outmaneuver opponents in this evolving Early Access title.",*;*,,,,2025-07-17
game,Laser Harp VR,3789120,Through_Point.,Through_Point.,,Single-player;VR Only;Adjustable Difficulty;HDR available,Casual;Indie;Simulation;Free To Play;Early Access,https://store.steampowered.com/app/3789120,public_unreleased,full_details,False,"Jul 30, 2025",You too can be a stealth major You will be the organizer and make the live show a success! Please note that the instrument to be handled is the “Laser Harp”.,Japanese,,,,2025-07-17
music,Homebound Haerold Soundtrack,3790160,Smiles,Smiles,,,,https://store.steampowered.com/app/3790160,public_unreleased,full_details,False,Coming soon,The Homebound Haerold Soundtrack.,,,,,2025-07-17
game,RETRYS,3830610,Studio Garage Inc.,Studio Garage Inc.,,Single-player;Full controller support,Adventure;Casual;Indie;RPG;Free To Play,https://store.steampowered.com/app/3830610,public_unreleased,full_details,False,2026,"A forgotten, unfinished game from the 1980s. You, an AI, enter its broken world and fix the bugs one by one to complete it. But as the game is restored, a deeper mystery begins to unfold. A personal journey filled with nostalgia and quiet emotion.",English;Japanese,,,,2025-07-17
game,Rhea of the Remnant,3872550,MushroomShoes,MushroomShoes,,Single-player;Custom Volume Controls;Mouse Only Option;Playable without Timed Input;Family Sharing,RPG;Simulation;Strategy,https://store.steampowered.com/app/3872550,public_unreleased,full_details,False,To be announced,Rhea of the Remnant is a Tactical RPG where you command a small group of allies to take down a large number of enemies.,English;Japanese;Korean,,,,2025-07-17
