type,name,steam_appid,developers,publishers,website,categories,genres,steam_url,detection_stage,api_response_type,potential_duplicate,release_date,description,supported_languages,followers,wishlists_est,wishlist_rank,discovery_date
game,Idle Idle,3946820,Idle Idle,Idle Idle,https://www.instagram.com/idleidlegame/,Single-player;Steam Achievements;Color Alternatives;Custom Volume Controls;Mouse Only Option;Playable without Timed Input;Save Anytime;Family Sharing,Casual;Indie;Strategy,https://store.steampowered.com/app/3946820,public_unreleased,full_details,False,Coming soon,"Idle Idle is a soothing idle game focused on comfort, calm, and gentle progression. Earn zen, unlock unique items and relax in a peaceful digital space. No grinding, just presence, reflection, and low-pressure fun",English,,,,2025-08-13
game,Shadow Division: Spymaster,3930420,Asterism Games,Asterism Games,,Single-player;Steam Achievements;Camera Comfort;Custom Volume Controls;Adjustable Difficulty;Mouse Only Option;Playable without Timed Input;Save Anytime;Steam Cloud;Stats;Family Sharing,Simulation;Strategy,https://store.steampowered.com/app/3930420,public_unreleased,full_details,False,Coming soon,"A modern-day strategy game where you lead a covert intelligence agency, run sabotage and assassination missions, manipulate international politics, and adapt your strategy in a highly replayable campaign.",*;*,,,,2025-08-13
game,Live Fire Exercise,3917640,Decdot,Decdot,,Single-player;Steam Achievements;Steam Leaderboards;Family Sharing,Action,https://store.steampowered.com/app/3917640,public_unreleased,full_details,False,2025,"Inspired by classic training missions from your favourite FPS games, Live Fire Exercise is a time trial arcade shooter that challenges you to complete rounds as fast and accurately as possible.",*;*,,,,2025-08-13
game,Horny Blocks,3860800,MaxHS,One HandFun,,Single-player;Family Sharing,Action;Casual;Indie;Strategy,https://store.steampowered.com/app/3860800,public_unreleased,full_details,False,Coming soon,Horny Blocks is a classic block-breaking game with progressively challenging stages. Enjoy calm and relaxing moments as you break blocks and reveal beautiful girls.,*;*,,,,2025-08-13
game,Genji Reincarnation: The Seven Mysteries of Shirahata High,3837760,MOON USAGI,MOON USAGI,http://tukiusajou.blog.fc2.com/,Single-player;Adjustable Text Size;Keyboard Only Option;Playable without Timed Input;Save Anytime;Partial Controller Support;Family Sharing,Indie,https://store.steampowered.com/app/3837760,public_unreleased,full_details,False,Coming soon,"Friendship or fate—what will they choose? A karmic and occult visual novel where urban legends blur the line between life, death, and reincarnation.",English;Japanese,,,,2025-08-13
music,Fractured Core Soundtrack,3549470,Engram Interactive,indie.io,https://engraminteractive.com/,,,https://store.steampowered.com/app/3549470,public_unreleased,full_details,False,Coming soon,Original Soundtrack.,,,,,2025-08-13
game,XStoryPlayer,3924270,X-Moon Productions,X-Moon Productions,,Single-player;Stereo Sound;Family Sharing,Adventure;Simulation,https://store.steampowered.com/app/3924270,public_unreleased,full_details,False,Coming soon,First person single player 3D erotic story simulator,*;*,,,,2025-08-13
game,Souls of the Dead,3925320,Dramatic Medium,Dramatic Medium,,Single-player;Multi-player;Co-op;Online Co-op;Steam Achievements;Camera Comfort;Color Alternatives;Custom Volume Controls;Playable without Timed Input;Stereo Sound;Surround Sound;Partial Controller Support;Family Sharing,Action;Adventure;Indie;Massively Multiplayer,https://store.steampowered.com/app/3925320,public_unreleased,full_details,False,To be announced,"A bio-catastrophe has engulfed the world, transforming people into bloodthirsty creatures. The only way to stop this plague is to damage the infected's brain. Try to survive this hell – alone or with a partner – while trying to maintain the line between a human and what you're forced to destroy.","*;, French, Italian, German, Spanish - Spain, Traditional Chinese, Simplified Chinese;*;, Korean, Polish, Portuguese - Portugal, Russian;*;, Turkish, Japanese;*",,,,2025-08-13
game,A Ball id,3930900,jun,jun,,Single-player;Steam Achievements;Family Sharing,Casual;Indie,https://store.steampowered.com/app/3930900,public_unreleased,full_details,False,"Sep 1, 2025",A simple game where you just dodge balls and pet cats. (The balls are strong enough to kick you out of the game.),English,,,,2025-08-13
game,Sex Game - Threesome - Episode 2,3929930,EroticGamesClub,EroticGamesClub,http://www.eroticgamesclub.com,Single-player;Steam Achievements;Steam Leaderboards;Family Sharing,Adventure;Casual;Simulation,https://store.steampowered.com/app/3929930,public_unreleased,full_details,False,Coming soon,"Enjoy an erotic visual novel featuring a guys and his 2 hot girl friends, and an engaging sex simulator. A warm summer evening in a luxurious beach house, quickly turns into some hot threesome sex on the terrace, overlooking the sandy beach in the sunset.",English,,,,2025-08-13
game,Slither Link Plus,3935560,Vector Game,Vector Game,,Single-player;Steam Achievements;Family Sharing,Casual;Indie,https://store.steampowered.com/app/3935560,public_unreleased,full_details,False,Coming soon,"SlitherLink Plus is a logic puzzle game where you draw a single loop using number clues. Play on square, hexagonal, kite, and Cairo tiling grids—each with unique logic and challenge. Includes varied levels and infinite puzzles to test your reasoning.",English;French;Italian;German;Spanish - Spain;Danish;Ukrainian;Russian;Bulgarian;Hungarian;Indonesian;Turkish;Greek;Norwegian;Czech;Japanese;Polish;Thai;Swedish;Simplified Chinese;Traditional Chinese;Romanian;Finnish;Dutch;Portuguese - Brazil;Portuguese - Portugal;Spanish - Latin America;Vietnamese;Arabic;Korean,,,,2025-08-13
game,Dominated by: Yandere Goth MILF,3940680,Bully Revenge Studios,Bully Revenge Studios,,Single-player;Steam Achievements;Custom Volume Controls;Mouse Only Option;Playable without Timed Input;Save Anytime;Family Sharing,Indie;Simulation,https://store.steampowered.com/app/3940680,public_unreleased,full_details,False,"Aug 26, 2025","Your 280cm tall goth MILF girlfriend and landlord wants you to stay with her instead of transferring to a new college, and she loves you so much that she'll make you stay by any means necessary.",English;French;Italian;German;Spanish - Spain;Bulgarian;Czech;Danish;Dutch;Finnish;Greek;Hungarian;Indonesian;Japanese;Korean;Norwegian;Polish;Portuguese - Brazil;Romanian;Russian;Simplified Chinese;Swedish;Thai;Traditional Chinese;Turkish;Ukrainian;Vietnamese,,,,2025-08-13
demo,White Eternal (free),3926850,origamihero games,origamihero games,,Single-player;Game demo;Custom Volume Controls;Adjustable Difficulty;Playable without Timed Input;Save Anytime;Stereo Sound;Partial Controller Support;Steam Cloud,RPG,https://store.steampowered.com/app/3926850,public_unreleased,full_details,False,"Aug 31, 2025",There's something hiding in the cold of winter. What made your friend disappear? Snow's begun to fall. Let's just wait a little bit longer...,English;German,,,,2025-08-13
game,First Steps in Learning about Pregnancy,3779900,エムテラス,エムテラス,https://msserious.com/ninsin,Single-player,Adventure;Free To Play,https://store.steampowered.com/app/3779900,public_unreleased,full_details,False,Coming soon,"Play as a pregnant woman experiencing daily life from early pregnancy to childbirth prep. Learn about local medical and support systems through interactive choices. Features 1-hour playtime and save/load. Great for those interested in healthcare, education, or social welfare",*;*,,,,2025-08-13
music,Lost Twins 2 Soundtrack,3937070,Playdew,Playdew,,,,https://store.steampowered.com/app/3937070,public_unreleased,full_details,False,"Aug 21, 2025","This is the soundtrack for Lost Twins 2, but does not include the base game.",,,,,2025-08-13
dlc,Lost Twins 2 - Digital ArtBook,3937120,Playdew,,https://www.playdew.com/,Single-player;Downloadable Content;Steam Achievements;Full controller support;Custom Volume Controls;Keyboard Only Option;Save Anytime;Stats;Remote Play on TV,Action;Adventure;Casual;Indie;Strategy,https://store.steampowered.com/app/3937120,public_unreleased,full_details,False,"Aug 14, 2025",Lost Twins 2 Artbook,English;Arabic,,,,2025-08-13
game,Coin Pusher Reloaded,3807570,MicroRaptor Games LLC,MicroRaptor Games LLC,https://www.microraptorgames.com,Single-player;Steam Achievements;Full controller support;Steam Cloud,Casual;Indie;Free To Play,https://store.steampowered.com/app/3807570,public_unreleased,full_details,False,"Sep 4, 2025",Crown yourself king in this short and relaxing coin pusher game with collectibles and ATM hacking!,"*;, French;*;, Italian;*;, German;*;, Spanish - Spain;*;, Japanese;*;, Korean;*;, Polish;*;, Russian;*;, Simplified Chinese;*;, Spanish - Latin America;*;, Swedish;*;, Turkish;*;*",,,,2025-08-13
game,Blacklight Protocol,3856750,Bucket of Fish,Bucket of Fish,https://bucketoffish.games/,Multi-player;Co-op;Family Sharing,Action;Adventure,https://store.steampowered.com/app/3856750,public_unreleased,full_details,False,Coming soon,"Armed with nothing but a flashlight, your intuitions, and each other; you and your partner have set out to uncover the lost history of “Lab 257.” Only through teamwork will you succeed in navigating the labyrinths below. Will the encroaching darkness bring you together, or will it tear you apart?",English,,,,2025-08-13
game,Oasis Driver for Windows Mixed Reality,3824490,Matthieu Bucchianeri,Matthieu Bucchianeri,,,Free To Play;Utilities,https://store.steampowered.com/app/3824490,public_unreleased,full_details,False,Coming soon,A SteamVR driver for your Windows Mixed Reality VR headset.,English;French;Italian;German;Spanish - Spain;Arabic;Bulgarian;Czech;Danish;Dutch;Finnish;Greek;Hungarian;Indonesian;Japanese;Korean;Norwegian;Polish;Portuguese - Brazil;Portuguese - Portugal;Romanian;Russian;Simplified Chinese;Spanish - Latin America;Swedish;Thai;Traditional Chinese;Turkish;Ukrainian;Vietnamese;Afrikaans;Albanian;Amharic;Armenian;Assamese;Azerbaijani;Bangla;Basque;Belarusian;Bosnian;Catalan;Cherokee;Croatian;Dari;Estonian;Filipino;Galician;Georgian;Gujarati;Hausa;Hebrew;Hindi;Icelandic;Igbo;Irish;K'iche';Kannada;Kazakh;Khmer;Kinyarwanda;Konkani;Kyrgyz;Latvian;Lithuanian;Luxembourgish;Macedonian;Malay;Malayalam;Maltese;Maori;Marathi;Mongolian;Nepali;Odia;Persian;Punjabi (Gurmukhi);Punjabi (Shahmukhi);Quechua;Scots;Serbian;Sindhi;Sinhala;Slovak;Slovenian;Sorani;Sotho;Swahili;Tajik;Tamil;Tatar;Telugu;Tigrinya;Tswana;Turkmen;Urdu;Uyghur;Uzbek;Valencian;Welsh;Wolof;Xhosa;Yoruba;Zulu,,,,2025-08-13
game,No More Ground,3935570,Amadare Works,Amadare Works,,Single-player;Partial Controller Support;Family Sharing,Action;Indie,https://store.steampowered.com/app/3935570,public_unreleased,full_details,False,2026,"Ascend endlessly by jumping across city rooftops in this high-risk, intense action game. One fall sends you back to the start. Precise timing and tight controls are your only lifelines. Use vaults, wall kicks, wall runs, and other parkour moves to reach the goal high above.","*;, Japanese;*;*",,,,2025-08-13
game,Robinsons Simulations World,3928060,GameChangeKiller,GameChangeKiller,,Single-player;Steam Achievements;Family Sharing,Adventure;RPG;Simulation,https://store.steampowered.com/app/3928060,public_unreleased,full_details,False,October 2025,Slip into the role of Robinson. You're stranded on a deserted island. Build a boat to get back to the mainland. Can you survive in the city? Work your way up from lumberjack to landowner.,*;*,,,,2025-08-13
game,Vein-Weaver Knitting,3938050,Chris Allen,Chris Allen,,Single-player;Steam Achievements;Family Sharing,Action,https://store.steampowered.com/app/3938050,public_unreleased,full_details,False,To be announced,"Activate, Jump, Bomb, Out Run, Get Power Ups, Find Hidden Items, Speed Run, Pull Levers, Activate Switches, Out Smart Enemies, And Unravel The Story And Destroy The Dimension Crafted By An Ancient Craft Called Vein-Weaver Knitting.",*;*,,,,2025-08-13
game,Race Max Pro,3042650,Revani,Revani,,Single-player;Multi-player;PvP;Online PvP;Cross-Platform Multiplayer;Steam Achievements;In-App Purchases;Family Sharing,Action;Racing;Sports,https://store.steampowered.com/app/3042650,public_unreleased,full_details,False,To be announced,"Blaze through Street, Drift, and Drag modes with iconic licensed cars. Master every turn, upgrade your ride, and dominate both solo and online races in the ultimate customizable racing showdown!",English;French;German;Spanish - Spain;Indonesian;Japanese;Korean;Polish;Portuguese - Portugal;Russian;Turkish,,,,2025-08-13
demo,Bubble Gun Demo,3920750,Digital Emergence Ltd,Digital Emergence Ltd,http://www.digitalemergenceltd.com/bubble-gun,Multi-player;PvP;Shared/Split Screen PvP;Shared/Split Screen;Game demo;Full controller support;Remote Play Together,Action,https://store.steampowered.com/app/3920750,public_unreleased,full_details,False,"Aug 20, 2025","Bubble Gun is a frantic 2D party brawler where chaos rules the arena. You play as a bubble, armed with two hands slots and a wild arsenal. Every weapon and environment effect can be combined, manipulated, and exploited for over-the-top fun.",English;French;Italian;German;Spanish - Spain;Portuguese - Portugal,,,,2025-08-13
game,The Zappening!,3395400,Rhino Hydra LLC,Rhino Hydra LLC,,Single-player;Full controller support;Family Sharing,Action;Indie;RPG,https://store.steampowered.com/app/3395400,public_unreleased,full_details,False,Q1 2026,"THE ZAPPENING! has unleashed chaos on your small town! In this First-Person Action Roguelite you must Zap, Bash, and Butt Slam your way through hordes of gooey monsters. Pick your equipment, build your playstyle, and save the neighborhood!",*;*,,,,2025-08-13
demo,Pixel Troopers Demo - Friend Access,3928430,Liberator Studios,Liberator Studios,,Multi-player;PvP;Online PvP;LAN PvP;Co-op;Online Co-op;LAN Co-op;Game demo;Steam Achievements;Color Alternatives;Custom Volume Controls;Adjustable Difficulty;Keyboard Only Option;Stereo Sound;Subtitle Options;Partial Controller Support;Steam Cloud;Stats;Steam Leaderboards,,https://store.steampowered.com/app/3928430,public_unreleased,full_details,False,Coming soon,"Pixel Troopers es un shooter cooperativo frenético con estética Pixel Art 3D, donde tú y tus amigos tendrán que sobrevivir a oleadas implacables de insectos, criaturas grotescas y enemigos de todo tipo. Cada partida es una lluvia de balas, explosiones y cuerpos volando por los aires.",English;Spanish - Spain;Spanish - Latin America,,,,2025-08-13
game,Survindust,3946880,IS Games,IS Games,,Single-player;Custom Volume Controls;Adjustable Difficulty;Save Anytime;Stereo Sound;Family Sharing,Indie;Simulation;Strategy,https://store.steampowered.com/app/3946880,public_unreleased,full_details,False,To be announced,"Stranded on a small island, you must gather, build, and automate to survive and turn a humble camp into a thriving, self-sustaining base.",English;French;Italian;German;Spanish - Spain;Simplified Chinese;Portuguese - Brazil;Danish;Finnish;Traditional Chinese;Japanese;Korean;Spanish - Latin America;Polish;Hungarian;Norwegian;Portuguese - Portugal;Russian;Turkish;Swedish,,,,2025-08-13
game,Lazy Lord: War on the Desktop,3940220,Restart Studio,Restart Studio,,Single-player;Steam Achievements;Mouse Only Option;Playable without Timed Input;Save Anytime;Steam Cloud;Family Sharing,Casual,https://store.steampowered.com/app/3940220,public_unreleased,full_details,False,Coming soon,"You're the Laziest Evil Lord ever—too lazy to fight, yet destined to rule the world. Send minions (automatically), upgrade them with gold and treasures, and conquer 1,000 areas without leaving the throne. Evil has never been this effortless.",English;Japanese;Simplified Chinese;Traditional Chinese,,,,2025-08-13
game,Lost my Collection of 600 Stars,3932030,Vaggelis Arabatzoglou,Carterson Games,,Single-player;Steam Achievements;Custom Volume Controls;Mouse Only Option;Playable without Timed Input;Save Anytime;Family Sharing,Casual;Indie,https://store.steampowered.com/app/3932030,public_unreleased,full_details,False,October 2025,"Lost my Collection of 600 Stars is a casual 2D hidden object game with a cute, stylized and relaxing aesthetic.",English,,,,2025-08-13
game,Cubes Go,3927920,Olive,Olive,,Single-player;Family Sharing,Casual;Indie;Strategy,https://store.steampowered.com/app/3927920,public_unreleased,full_details,False,Coming soon,"Build, Eliminate, Evolve in 3D! Experience epic block-smashing thrills! Unlock powers like Nuclear Strikes, Infinite Lives & Score Multipliers via a deep Skill Tree. Strategically upgrade, build devastating combos, and shatter cubes!",English;Simplified Chinese,,,,2025-08-13
demo,The Cave Diver Demo,3928440,Ovsko,Ovsko,https://x.com/ovsko,Single-player;Game demo;Full controller support;Custom Volume Controls,Action;Adventure,https://store.steampowered.com/app/3928440,public_unreleased,full_details,False,Coming soon,Crawl down a suffocating cave system using only your arms in this punishing physics-horror adventure. What morbid force is calling you deeper into the heart of the caves?,English;French;Italian;German;Spanish - Spain;Japanese;Portuguese - Brazil;Portuguese - Portugal;Russian;Simplified Chinese;Spanish - Latin America,,,,2025-08-13
game,SHOTGUN DREAMS,3810190,Tarkensplat,Tarkensplat,,Single-player;Steam Leaderboards;Family Sharing,Action;Indie;Racing,https://store.steampowered.com/app/3810190,public_unreleased,full_details,False,To be announced,"SHOTGUNS DREAMS is a first-person 3D platformer with an emphasis on momentum and creativity. Utilize simple parkour abilities like sliding and wall-running to maintain top speed. Leverage shell pickups to gain velocity, teleport, and manipulate gravity. How you reach the goal is up to you.",English,,,,2025-08-13
game,Enigma,3931530,MetroCorex,MetroCorex,,Single-player;Custom Volume Controls;Family Sharing,Action;Adventure;Indie,https://store.steampowered.com/app/3931530,public_unreleased,full_details,False,Coming soon,"In 2070’s Novacore, humanoid robots go rogue—play operative Brian as he infiltrates floating island Enigma to disable control nodes and confront a rogue AI.",English,,,,2025-08-13
game,欢迎来到林葬屋,3946830,MYSTERY CROWN;火蜥蜴文化,MYSTERY CROWN,,Single-player;Family Sharing,Adventure;Casual;Indie;RPG;Simulation,https://store.steampowered.com/app/3946830,public_unreleased,full_details,False,Q3 2025,"Mourningwood Lodge is a full-motion video (FMV) live-action mystery horror game. As the first installment in the Funeral Houseseries, players will assume different roles across various game modes to participate in a suspenseful horror journey blending conspiracy and fantasy.",*;*,,,,2025-08-13
demo,Midnight Files Demo,3944340,Paper Lynx Games,Paper Lynx Games,,Single-player;Game demo,,https://store.steampowered.com/app/3944340,public_unreleased,full_details,False,Coming soon,,English;French;Italian;German;Spanish - Spain;Simplified Chinese;Polish;Portuguese - Portugal;Russian,,,,2025-08-13
game,Hide ! lil' foxes,3941750,The Lonesome Wolf,The Lonesome Wolf,,Single-player;Camera Comfort;Custom Volume Controls;Playable without Timed Input;Family Sharing,Casual;Indie,https://store.steampowered.com/app/3941750,public_unreleased,full_details,False,Q4 2025,"""Hide! lil’ foxes"" is a cozy 3D hidden-object game where you use camera perspective to find cute foxes. 9 levels, 3 camera styles, 2 game modes (regular and random) and 500+ foxes to find. Can you catch them all ?","*;, French;*",,,,2025-08-13
game,Evergrowing Video Store,3942270,Milkshake Games,Milkshake Games,https://milkshakegames.fr/,Single-player;Family Sharing,Casual;Indie;RPG;Simulation,https://store.steampowered.com/app/3942270,public_unreleased,full_details,False,2026,"Evergrowing Video Store is an idle game where you play as Jeff, the sole employee of a retro video store. One night, the video store is attacked by a horde of monsters. Make Jeff more powerful with the help of a gigantic and monstrous talent tree !",*;*,,,,2025-08-13
game,Strategic Stalemate,3940760,Lixdy,Lixdy,,Single-player;Family Sharing,Casual;Indie;Strategy,https://store.steampowered.com/app/3940760,public_unreleased,full_details,False,"Aug 25, 2025",A 2D turn based strategy and management game with a dynamic soundtrack and emergent gameplay starting in the 1960's. Balance different mechanics as you progress through the Cold War without being voted out or starting World War III.,*;*,,,,2025-08-13
demo,Reng Azure Requiem Demo,3934620,GB904 br,GB904 br,,Single-player;Game demo;Partial Controller Support,Action;Adventure;Indie;RPG;Strategy,https://store.steampowered.com/app/3934620,public_unreleased,full_details,False,Coming soon,"Reng Azure Requiem is a dark pixel-art action RPG where you explore Tartarius in search of the 7 keys. Use teleportation, a shield of souls, and the aid of your guardian crow to master combat skills and face the fearsome Tartariuno.",English,,,,2025-08-13
game,The Anubis Treasure,3934610,Ayelen indie game studio,Ayelen vgs,https://www.ayelengames.com/inicio/the-anubis-treasure,Single-player;Family Sharing,Action;Adventure;Casual;Indie;RPG;Strategy,https://store.steampowered.com/app/3934610,public_unreleased,full_details,False,"Dec 21, 2025","Embark on an epic adventure in The Treasure of Anubis, a minimalist 2D platformer.",English;Spanish - Spain,,,,2025-08-13
demo,This Isn't Just Tower Defense - Demo,3737300,Pri Games,Pri Games,,Single-player;Game demo;Camera Comfort;Custom Volume Controls;Mouse Only Option;Save Anytime,,https://store.steampowered.com/app/3737300,public_unreleased,full_details,False,Q3 2025,"Place Towers, Defeat Enemies, Stack UpgradesStrategically place your towers to fend off massive waves of thousands of enemies at once. Every defeated enemy grants resources you can use to endlessly upgrade your towers—more damage, faster shots, greater range. The pressure increases with every wave!","*;, French;*;, Italian;*;, German;*;, Spanish - Spain;*;, Japanese;*;, Russian;*;, Traditional Chinese;*;*",,,,2025-08-13
game,Statecraft,3944850,Statecraft,Statecraft,,Single-player;Family Sharing,Casual;Indie;Simulation;Strategy,https://store.steampowered.com/app/3944850,public_unreleased,full_details,False,Coming soon,"Lead your nation, balance the interests of factions, manage the economy and diplomacy, and guide your country through crises to stay in power.",English,,,,2025-08-13
dlc,The Bazaar - Mak - Ancient Alchemist,3884450,Tempo,,https://playthebazaar.com/,Single-player;Downloadable Content;In-App Purchases;Custom Volume Controls;Playable without Timed Input;Save Anytime;Stereo Sound,Strategy,https://store.steampowered.com/app/3884450,public_unreleased,full_details,False,Coming soon,"The Mak pack adds the playable hero Mak to The Bazaar alongside over 190 new items, skills, and unique encounters to help Mak on his journey.",*;*,,,,2025-08-13
game,Gran Theft Lure,3907500,Alexandre Mailliu,Alexandre Mailliu,https://siliver4.github.io/alexandre-rokh-mailliu-games/my-games,Single-player;Steam Achievements;Full controller support;Camera Comfort;Custom Volume Controls;Playable without Timed Input;Steam Cloud;Steam Leaderboards;Family Sharing,Action;Casual;Indie;RPG,https://store.steampowered.com/app/3907500,public_unreleased,full_details,False,"Nov 21, 2025","Gran Theft Lure is a top-down arena shooter roguelite in which you play as your lovely gran being attacked by hordes of burglars. They can only be killed by luring or pushing them into your garden’s traps. Choose one of the 4 weapon modes, and make them taste theft lure, or should we say failure!",English;French;Italian;German;Spanish - Spain;Bulgarian;Simplified Chinese;Traditional Chinese;Korean;Danish;Spanish - Latin America;Finnish;Greek;Hungarian;Indonesian;Japanese;Norwegian;Dutch;Polish;Portuguese - Brazil;Portuguese - Portugal;Romanian;Russian;Swedish;Czech;Thai;Turkish;Ukrainian;Vietnamese,,,,2025-08-13
game,Fish Collector: Aquarium Story,2386340,Seagle Games - Entertainment Dev Studio,Seagle Games - Entertainment Dev Studio,,Single-player;Multi-player;Co-op;Online Co-op;Steam Achievements;In-App Purchases,Casual;RPG;Simulation,https://store.steampowered.com/app/2386340,public_unreleased,full_details,False,September 2025,"Run your own aquarium and evolve fish into mermaids! Fish Collector is a relaxing aquarium tycoon game that blends fish farming, idle resource production, match-3, and merge gameplay to build your fantasy ocean world.",English;Simplified Chinese;Traditional Chinese;Korean;Japanese,,,,2025-08-13
game,It's Just A Jump!,3917720,Nicholas Scotti,Nicholas Scotti,,Single-player;Partial Controller Support;Family Sharing,Casual;Indie,https://store.steampowered.com/app/3917720,public_unreleased,full_details,False,To be announced,A reincarnation of the old school high difficult platform.,English,,,,2025-08-13
game,Eel Game,3924400,Paolo Orlandino;Erik_GameDev,Loyalty Interactive,,Multi-player;PvP;Online PvP;LAN PvP;Co-op;Online Co-op;LAN Co-op;Steam Achievements;Full controller support;Steam Leaderboards;Family Sharing,Action;Casual;Indie;Massively Multiplayer,https://store.steampowered.com/app/3924400,public_unreleased,full_details,False,Coming soon,Play dangerous games and try to survive. Only one player can win. Will it be you?,"*;, French, Italian, German, Spanish - Spain, Simplified Chinese, Traditional Chinese, Korean, Japanese, Portuguese - Brazil, Russian;*",,,,2025-08-13
