type,name,steam_appid,developers,publishers,website,categories,genres,steam_url,detection_stage,api_response_type,potential_duplicate,release_date,description,supported_languages,followers,wishlists_est,wishlist_rank,discovery_date
game,Divine Awakening,3922860,NSFW Works,NSFW Works,,Single-player;Custom Volume Controls;Save Anytime;Family Sharing,Adventure;Casual;Indie;RPG;Early Access,https://store.steampowered.com/app/3922860,public_unreleased,full_details,False,Coming soon,A divine power awakens through intimate connections in this adult fantasy visual novel where redemption meets desire,English,,,,2025-08-13
dlc,The Bazaar - Stelle - Ingenious Engineer,3884460,Tempo,,https://playthebazaar.com/,Single-player;Downloadable Content;In-App Purchases;Custom Volume Controls;Playable without Timed Input;Save Anytime;Stereo Sound,Strategy,https://store.steampowered.com/app/3884460,public_unreleased,full_details,False,Coming soon,"The Stelle pack adds the playable hero Stelle to The Bazaar alongside over 150 new items, skills, and unique encounters to help Stelle on her journey.",*;*,,,,2025-08-13
game,Zoo Life Simulator,3874220,Hiraru,Hiraru,https://www.hiraru.com/,Single-player;Multi-player;Co-op;Online Co-op;Steam Achievements;Camera Comfort;Custom Volume Controls;Playable without Timed Input;Family Sharing,Casual;Indie;Simulation,https://store.steampowered.com/app/3874220,public_unreleased,full_details,False,Q4 2025,"Build the zoo of your dreams! In Zoo Life Simulator, play solo or with friends as you care for animals, keep visitors happy, and expand your park in a relaxing and realistic simulation experience.",English;French;Italian;German;Spanish - Spain;Simplified Chinese;Portuguese - Brazil;Japanese;Korean;Spanish - Latin America;Portuguese - Portugal;Russian;Turkish,,,,2025-08-13
game,Fractured Library,3938720,Raguthra Studios;Hannah Moon,Raguthra Studios,https://raguthra.com/fractured-library,Single-player;Steam Achievements;Keyboard Only Option;Playable without Timed Input;Save Anytime;Partial Controller Support;Family Sharing,Adventure;Indie,https://store.steampowered.com/app/3938720,public_unreleased,full_details,False,July 2026,"A cozy 2D pixel art adventure where you explore magical worlds, solve whimsical puzzles, and collect crystal fragments to restore a misbehaving library: no combat, just curious discoveries and a dash of chaos.",English,,,,2025-08-13
game,Casino Tycoon: Sin & Win,3942290,Eternal Studio,Eternal Studio,,Single-player;Family Sharing,Adventure;Casual;Indie;Racing;RPG;Simulation;Strategy,https://store.steampowered.com/app/3942290,public_unreleased,full_details,False,Coming soon,"Rise from a broke gambler to a casino kingpin in this high-stakes sim blending management, gambling, and adult content. Win big, indulge in luxury, go bankrupt, or start a gang war—every choice writes your destiny. In this city, you either rule the tables… or end up in a ditch.",English;Simplified Chinese,,,,2025-08-13
game,Anime Dream Match: Rodents,3942840,Blender Games,Blender Games,,Single-player;Steam Achievements;Camera Comfort;Custom Volume Controls;Mouse Only Option;Playable without Timed Input;Stereo Sound;Steam Cloud;Family Sharing,Casual;Indie,https://store.steampowered.com/app/3942840,public_unreleased,full_details,False,"Aug 22, 2025",A charming and relaxing memory game where you match pairs of adorable anime rodents.,"*;, French;*;, Italian;*;, German;*;, Spanish - Spain;*;, Arabic;*;, Bulgarian;*;, Vietnamese;*;, Greek;*;, Danish;*;, Simplified Chinese;*;, Traditional Chinese;*;, Korean;*;, Norwegian;*;, Dutch;*;, Polish;*;, Portuguese - Brazil;*;, Portuguese - Portugal;*;, Russian;*;, Romanian;*;, Thai;*;, Turkish;*;, Hungarian;*;, Ukrainian;*;, Finnish;*;, Czech;*;, Swedish;*;, Japanese;*;, Indonesian;*;, Spanish - Latin America;*;, Azerbaijani;*;, Albanian;*;, Amharic;*;, Assamese;*;, Afrikaans;*;, Basque;*;, Bangla;*;, Bosnian;*;, Belarusian;*;, Valencian;*;, Welsh;*;, Wolof;*;, Armenian;*;, Galician;*;, Georgian;*;, Gujarati;*;, Hindi;*;, Dari;*;, Estonian;*;, Zulu;*;, Yoruba;*;, Kazakh;*;, Kannada;*;, Catalan;*;, Quechua;*;, Kyrgyz;*;, Konkani;*;, Khmer;*;, Xhosa;*;, K'iche';*;, Latvian;*;, Lithuanian;*;, Luxembourgish;*;, Macedonian;*;, Malay;*;, Malayalam;*;, Maltese;*;, Maori;*;, Marathi;*;, Mongolian;*;, Nepali;*;, Odia;*;, Punjabi (Shahmukhi);*;, Punjabi (Gurmukhi);*;, Persian;*;, Kinyarwanda;*;, Serbian;*;, Sotho;*;, Sinhala;*;, Sindhi;*;, Scots;*;, Slovak;*;, Slovenian;*;, Sorani;*;, Swahili;*;, Tajik;*;, Tamil;*;, Tatar;*;, Telugu;*;, Tigrinya;*;, Tswana;*;, Turkmen;*;, Uzbek;*;, Uyghur;*;, Urdu;*;, Filipino;*;, Hausa;*;, Croatian;*;, Cherokee;*;, Hebrew;*;, Irish;*;, Icelandic;*;, Igbo;*;*",,,,2025-08-13
game,Zetris,3890620,Hot Pizza Games,Hot Pizza Games,,Single-player;Steam Achievements;Family Sharing,Casual,https://store.steampowered.com/app/3890620,public_unreleased,full_details,False,Coming soon,"Zetris - the new puzzle game inspired by Tetris. More and more shapes based on triangles fall from the sky. Rotate them or move them left or right. Every couple of parts single White triangles will fall down, they will help you close the gaps formed between the shaped.",English,,,,2025-08-13
game,Astraphia,3869610,Archerforge Studios,Archerforge Studios,,Single-player;Family Sharing,Action;Casual;Indie;RPG,https://store.steampowered.com/app/3869610,public_unreleased,full_details,False,November 2025,"Astraphia is an action roguelike with fast-paced combat, class-based progression, and procedural generation. Build unique loadouts, unlock abilities, defeat challenging enemies, and earn divine blessings as you fight to survive intense, replayable runs.",*;*,,,,2025-08-13
game,Why Did You Leave Me Like This?,3929030,Leah,Leah,,Single-player;Camera Comfort;Playable without Timed Input;Stereo Sound;Surround Sound;Family Sharing,Adventure,https://store.steampowered.com/app/3929030,public_unreleased,full_details,False,September 2025,A grieving father resurrects his daughter in an android body and forces her to play the game she used to love. But she's not here to play.,English,,,,2025-08-13
game,ReUse,3937710,BakeONsoft,BakeONsoft,,Single-player;Family Sharing,Casual;Indie,https://store.steampowered.com/app/3937710,public_unreleased,full_details,False,Coming soon,Fancy a shoot’em all with a little bit of resource management. Join Theo on his perseverance to kill monsters by crafting deadly weapons using whatever he can scavenge from his surroundings.,*;*,,,,2025-08-13
game,My Hot Goth Roommate Became My Goonmate 2,3933630,Bully Revenge Studios,Bully Revenge Studios,,Single-player;Steam Achievements;Custom Volume Controls;Mouse Only Option;Playable without Timed Input;Save Anytime;Family Sharing,Indie;Simulation,https://store.steampowered.com/app/3933630,public_unreleased,full_details,False,"Aug 26, 2025",My Hot Goth Roommate Became My Roommate 2 continues the story of the mega-sadist and the mega-masochist and their equally pleasurable BDSM activities.,English;French;Italian;German;Spanish - Spain;Bulgarian;Czech;Danish;Dutch;Finnish;Greek;Hungarian;Indonesian;Japanese;Korean;Norwegian;Polish;Portuguese - Brazil;Romanian;Russian;Simplified Chinese;Swedish;Thai;Traditional Chinese;Turkish;Ukrainian;Vietnamese,,,,2025-08-13
game,FURRY DO PORN,3925920,RukoJob,FURRAI_XXX,https://x.com/FURRAI_XXX,Single-player;Steam Achievements;Family Sharing,Action;Casual,https://store.steampowered.com/app/3925920,public_unreleased,full_details,False,September 2025,"A fully deployed, block-breaking arcade game where each level reveals uncensored furry adult video scenes. Smash blocks, unlock pleasure, no fluff.",English,,,,2025-08-13
game,龍息：神寂,3795380,SGRA Studio,Ariel Co. Limited,https://dragonheir.sgrastudio.com/tw/,Multi-player;PvP;Online PvP;Co-op;Online Co-op;Cross-Platform Multiplayer;In-App Purchases,Adventure;Massively Multiplayer;RPG;Strategy;Free To Play,https://store.steampowered.com/app/3795380,public_unreleased,full_details,False,Coming soon,"The Reborn update brings massive improvements after months offline: log in now to claim 650 FREE summons, enjoy 70% discount on pulls, and participate in the ""Summon More, Get More"" event to build your ultimate team.",*;*,,,,2025-08-13
game,The Last Train | 最後の列車,3829200,Nolar Studio,Nolar Studio,,Single-player;Family Sharing,Indie,https://store.steampowered.com/app/3829200,public_unreleased,full_details,False,Q3 2025,"“The Last Train | 最後の列車” is an atmospheric Japanese psychological horror in first-person view. A night route, empty stations, thickening darkness. Underground, there is no salvation — only rails, concrete, guilt, and something behind your back.",English;Russian,,,,2025-08-13
game,Sex Game - Naughty Couple - Episode 4,3913170,EroticGamesClub,EroticGamesClub,http://www.eroticgamesclub.com,Single-player;Steam Achievements;Steam Leaderboards;Family Sharing,Adventure;Casual;Simulation,https://store.steampowered.com/app/3913170,public_unreleased,full_details,False,Coming soon,"A simple SEX SIMULATION game with VISUAL NOVEL elements, featuring HD GRAPHICS and juicy ANIMATIONS. After a long day, Damien and Lora decide to spend the evening by their pool. A hot summer night quickly turns into hot sex between the two of them.",English,,,,2025-08-13
game,Aileronia,3268560,Dogfight Club,Dogfight Club,,Single-player;Multi-player;PvP;Online PvP;Co-op;Online Co-op;Family Sharing,Action;Simulation,https://store.steampowered.com/app/3268560,public_unreleased,full_details,False,September 2026,"Aileronia: a combat flight game where aviation legends and fantasy heroes, known as Aileronauts, unite. Take on single-player, co-op, and multiplayer missions in a legendary skybound realm.","*;, Czech;*;, Slovak;*;*",,,,2025-08-13
game,Ecto Corporations,3920350,Storm Wizard Studios,Storm Wizard Studios,,Single-player;Multi-player;PvP;Online PvP;Co-op;Online Co-op;Full controller support;Custom Volume Controls;Save Anytime;Stereo Sound;Family Sharing,Adventure;RPG;Simulation,https://store.steampowered.com/app/3920350,public_unreleased,full_details,False,To be announced,"Build your ghost-hunting agency, hire specialists, face possessions, manage resources, defeat spirits and cultists, upgrade your base, and uncover the dark mystery haunting the city. Will you be a hero… or part of the problem?",*;*,,,,2025-08-13
game,Sex Game - Naughty Girls - Episode 4,3930070,EroticGamesClub,EroticGamesClub,http://www.eroticgamesclub.com,Single-player;Steam Achievements;Steam Leaderboards;Family Sharing,Adventure;Casual;Simulation,https://store.steampowered.com/app/3930070,public_unreleased,full_details,False,"Aug 15, 2025",Enjoy an erotic visual novel featuring two hot women and an engaging sex simulator. Juliette and Natalie sneak into an unused doctor's office to play out one of their wild fantasies. A naughty nurse and patient sex game in the right setting.,English,,,,2025-08-13
music,Captain Gazman Day Of The Rage Soundtrack - Music From The Trailers,3946450,Les Kalifas;Kazarma;VEB Videospielewerk 'Bewegungsdruiden',,,,,https://store.steampowered.com/app/3946450,public_unreleased,full_details,False,"Aug 20, 2025","Contains all the music used in this game's trailers. Also doubles as a donate button - by purchasing this exact OST, you are sponsoring the authors of the game personally (30%) and the creation of Captain Gazman 2: Dawn Of The Rage (70%).",,,,,2025-08-13
game,Shoplifter: No Escape,3934150,Lustful Universe,Lustful Universe,,Single-player;Steam Achievements;Camera Comfort;Keyboard Only Option;Mouse Only Option;Playable without Timed Input;Stereo Sound;Family Sharing,Indie;Simulation,https://store.steampowered.com/app/3934150,public_unreleased,full_details,False,August 2025,"Play as night guard Derrick Wolfe. Caught art-thief Vanessa Bloom red-handed - interrogate her, solve the photo-puzzle, and unlock an exclusive intimate session. No mercy, no second chance.",English;French;Italian;German;Spanish - Spain;Simplified Chinese;Korean;Polish;Russian;Turkish;Ukrainian;Japanese,,,,2025-08-13
game,pond thing,3780570,SpringBone,SpringBone,,Single-player;Steam Achievements;Full controller support;Steam Cloud;Family Sharing,Adventure;Indie,https://store.steampowered.com/app/3780570,public_unreleased,full_details,False,To be announced,"Pond Thing is a 2D horror narrative puzzle game. In a certain family, the sudden death of the head of the household sparks a deadly struggle among the seven heirs. Yet what truly drives them to turn on each other is not wealth, but the mysterious statue that holds an uncanny power…",English;French;Italian;German;Russian;Japanese;Thai;Simplified Chinese;Traditional Chinese;Korean,,,,2025-08-13
game,Trolley Time,3936740,Daysloth,Daysloth,,Single-player;Multi-player;PvP;Shared/Split Screen PvP;Co-op;Shared/Split Screen Co-op;Shared/Split Screen;Full controller support;Remote Play Together;Family Sharing,Casual;Indie,https://store.steampowered.com/app/3936740,public_unreleased,full_details,False,Coming soon,"Cute animals shopping for groceries - what chaos could possibly ensure? Play solo or with up to three friends, engage in frantic action as you try to deliver as many groceries as possible within the time limit!",*;*,,,,2025-08-13
game,NectorX,3917680,Gergenia Software,Gergenia Software,,Single-player;Steam Achievements;Full controller support;Custom Volume Controls;Adjustable Difficulty;Keyboard Only Option;Family Sharing,Action,https://store.steampowered.com/app/3917680,public_unreleased,full_details,False,"Aug 27, 2025",NectorX is an arcade rail shooter inspired by games from the 80s and 90s. Control a spaceship and fight against rogue machines.,English;Spanish - Latin America,,,,2025-08-13
game,The Grand Praetor,3936220,ColaCatGames,ColaCatGames,,Single-player;Steam Achievements;Mouse Only Option;Playable without Timed Input;Save Anytime;Steam Cloud;Family Sharing,Indie,https://store.steampowered.com/app/3936220,public_unreleased,full_details,False,2026,"As the seventh heir to the Empress, you have been appointed Grand Praetor to investigate a string of serial murders.Will you seek the truth and expose the conspiracy—or indulge in pleasure and power, doing as you please?",English;Simplified Chinese,,,,2025-08-13
game,Cosmolon,3927520,Se7enZ Studio,Se7enZ Studio,,Single-player;Custom Volume Controls;Playable without Timed Input;Family Sharing,Action;Indie,https://store.steampowered.com/app/3927520,public_unreleased,full_details,False,Coming soon,"Cosmolon is a sci-fi spaceship shooter inspired by classic arcade and MS-DOS games. You control a ship that can boost around, level up, and destroy wave upon wave of enemy ships with beautiful pixel art plasma bolts and explosions. Nab fancy power-ups and fend off unique enemies. Can you survive?",*;*,,,,2025-08-13
game,NOVA,3899890,Hekim Games,Hekim Games,https://hekimgames.com/,Single-player;Steam Achievements;Full controller support;Adjustable Text Size;Camera Comfort;Custom Volume Controls;Stereo Sound;Subtitle Options;Surround Sound;Steam Cloud;Family Sharing,Adventure;Indie,https://store.steampowered.com/app/3899890,public_unreleased,full_details,False,Q1 2026,"Nova is a game set in the future, about an assistant robot trying to escape from a quarantine environment.",English,,,,2025-08-13
game,Polyopolis,3785170,FireOwl Games,FireOwl Games,https://fireowlgames.com/,Single-player;Family Sharing,Casual;Indie;Strategy,https://store.steampowered.com/app/3785170,public_unreleased,full_details,False,Coming soon,"Stamp out a thriving city by fitting shapes into a ever-changing grid to attain the most resources. Chain buildings to boost energy, people and products, gain gold coins, and unlock rare stamps in this zen-meets-strategy city builder.",English,,,,2025-08-13
game,Night Turns to Day,3932120,HEC Gaming Studio,HEC Gaming Studio,,Single-player;Steam Achievements;Family Sharing,Indie;Strategy,https://store.steampowered.com/app/3932120,public_unreleased,full_details,False,To be announced,"Night Turns to Day is an indie point and click horror game where the player has to manage resources and complete various tasks to fend off enemies in order to survive. The game offers high intense action and thrilling gameplay, with many secrets waiting to be discovered.",*;*,,,,2025-08-13
