type,name,steam_appid,developers,publishers,website,categories,genres,steam_url,detection_stage,api_response_type,potential_duplicate,release_date,description,supported_languages,followers,wishlists_est,wishlist_rank,discovery_date
demo,Gravit Demo,3780090,OnyxPawGames,OnyxPawGames,,Single-player;Game demo,,https://store.steampowered.com/app/3780090,public_unreleased,full_details,False,Coming soon,,English,,,,2025-07-17
game,Droppy Ball,3868500,Mojo Games Studio,Mojo Games Studio,,Single-player;Full controller support;Family Sharing,Casual;Indie;Strategy,https://store.steampowered.com/app/3868500,public_unreleased,full_details,False,Coming soon,"Drop, combine, and explode your way to massive scores in Droppy Ball! Merge colorful spheres, unleash satisfying chain reactions, and chase the ultimate combo in this addictive physics puzzler.",*;*,,,,2025-07-17
game,Megamin Quest! Teach Rotten Goddesses Their Place In This Classic RPG,3713370,銀河系スタジオ,072 Project,https://072project.com/?source=steam_megaminquest&amp;utm_source=steam&amp;utm_medium=megaminquest&amp;utm_campaign=store_link,Single-player;Family Sharing,Casual;Indie;RPG,https://store.steampowered.com/app/3713370,public_unreleased,full_details,False,2025,"Reborn into another world, the protagonist was supposed to receive the blessing of a goddess—but instead, he runs into one with a rotten personality. It’s time to properly “discipline” this arrogant goddess♥""",Japanese;English;Simplified Chinese;Traditional Chinese,,,,2025-07-17
game,Divine's Howl,3794270,Sense13 Studio,Sense13 Studio,,Single-player;Family Sharing,Indie;Simulation;Strategy,https://store.steampowered.com/app/3794270,public_unreleased,full_details,False,Q4 2025,This is a tabletop card war game based on the worldview of Cthulhu Mythos. Players can choose to play one of the three gods and win the game through their own will.,Simplified Chinese,,,,2025-07-17
game,DeTails,3840340,Can You Eat It?,Can You Eat It?,,Single-player;Steam Achievements;Full controller support;Steam Cloud;Family Sharing,Adventure;Casual;Indie;Racing,https://store.steampowered.com/app/3840340,public_unreleased,full_details,False,Q2 2027,"DeTails is a narrative adventure starring Cami, a bass player and color slinging chameleon as she travels with her band The Hexes. Explore a vibrant world bursting with a colorful cast of characters. Master mini-games, fight the man, and learn what it means to grow up without losing your edge!",*;*,,,,2025-07-17
game,SCP: Project 90,3851110,ydanovvv,ydanovvv,,Multi-player;Co-op;Online Co-op;Steam Achievements;Custom Volume Controls;Playable without Timed Input,Indie;Massively Multiplayer;Free To Play,https://store.steampowered.com/app/3851110,public_unreleased,full_details,False,Coming soon,SCP Project 90 — is a game inspired by the SCP Foundation universe and inspired by SCP: Secret Laboratory.,"*;, Russian;*",,,,2025-07-17
game,Bael's Rock: A Text Adventure,3694940,GameClicks,GameClicks,,Single-player;Adjustable Text Size;Color Alternatives;Keyboard Only Option;Playable without Timed Input;Subtitle Options;Steam Cloud;Family Sharing,Adventure;Indie,https://store.steampowered.com/app/3694940,public_unreleased,full_details,False,August 2025,"Embark on a journey into the heart of an old-school text adventure game that beckons you into a world veiled in shadow and mystique. Here, your wits are your greatest weapon, and your keyboard, the tool to wield it.",*;*,,,,2025-07-17
game,I will be a star,3851100,JunSsangGaming,JunSsangGaming,,Single-player;Custom Volume Controls;Keyboard Only Option;Family Sharing,Casual,https://store.steampowered.com/app/3851100,public_unreleased,full_details,False,July 2025,"A story about a stone that wants to become a star..! Help the main character, the stone, climb up the world tree and become a star by jumping and moving only. It is the best game to test your patience and skills!",*;*,,,,2025-07-17
game,Arena II,3882360,30 Minute Games,30 Minute Games,,Single-player;Mouse Only Option;Playable without Timed Input;Family Sharing,Action;Adventure;Casual;RPG,https://store.steampowered.com/app/3882360,public_unreleased,full_details,False,"Aug 1, 2025","A fantasy arena battler. Level up, gear up, conquer increasingly brutal arenas, and take on increasingly powerful foes in a medieval world. Unlock secret relics and hidden arenas as you rise to become the ultimate champion in Arena II.",*;*,,,,2025-07-17
game,Frozen Feathers,3867520,New Game Order,New Game Order,,Multi-player;PvP;Online PvP;Steam Achievements;Full controller support;Custom Volume Controls;Playable without Timed Input;Stats;Steam Leaderboards;Family Sharing,Action;Casual,https://store.steampowered.com/app/3867520,public_unreleased,full_details,False,Q4 2025,"Frozen Feathers is a charming multiplayer 3D arcade game where cute penguins engage in fun snowball battles, scoring points in frosty PvP encounters.",English,,,,2025-07-17
demo,Poof! Cleaning Services Demo,3693950,Serious Sim,Serious Sim,,Single-player;Game demo;Mouse Only Option;Playable without Timed Input,,https://store.steampowered.com/app/3693950,public_unreleased,full_details,False,Coming soon,,English,,,,2025-07-17
game,AshCraft: Frontier,3705200,MINI STAR PTE. LTD.,MINI STAR PTE. LTD.,,Multi-player;MMO;PvP;Online PvP,Action;Adventure;Massively Multiplayer;Simulation;Strategy;Free To Play,https://store.steampowered.com/app/3705200,public_unreleased,full_details,False,To be announced,"[AshCraft: Frontier] is a multiplayer, open-world sandbox survival game that blends voxel-based building, hardcore combat, and strategic raiding.",English;Simplified Chinese;French;Italian;German;Spanish - Spain;Thai;Vietnamese;Malay,,,,2025-07-17
game,[Mulmiyac] for 3D Motion Sickness,3873150,Bursia,Bursia,,,Utilities,https://store.steampowered.com/app/3873150,public_unreleased,full_details,False,"Jul 28, 2025",The world’s FIRST and BEST overlay utility to prevent 3D motion sickness. Don’t be a fool and lose the love of your life over something as minor as motion sickness. This program might slightly cover your screen… But it just might show you what true happiness looks like.,English;French;German;Spanish - Spain;Russian;Japanese;Simplified Chinese;Portuguese - Brazil;Korean,,,,2025-07-17
game,末日砰砰砰-The final gunshot,3826030,SHEN LISONG,SHEN LISONG,,Single-player;Family Sharing,Action;Adventure;Casual;Indie,https://store.steampowered.com/app/3826030,public_unreleased,full_details,False,July 2025,"The final gunshot ""is a top-down action shooting survival game, where players take on the role of survivors in the apocalypse, pick up weapons, repel the constantly rushing zombies, and strive to survive for a longer time.",English;Simplified Chinese,,,,2025-07-17
game,UNIVERSE SLIME,3872640,Mash Potato,Mash Potato,,Single-player;Full controller support;Family Sharing,Action,https://store.steampowered.com/app/3872640,public_unreleased,full_details,False,Coming soon,"Control the Universe Slime, destroy towns and cities, swallow everything, and become a new star to replace the sun and save the solar system.",English;Japanese,,,,2025-07-17
game,Quartermaster,3657070,Cherrypick Games S.A.,Frozen District,,Single-player;Steam Achievements;Family Sharing,Casual;Indie;Simulation,https://store.steampowered.com/app/3657070,public_unreleased,full_details,False,Q1 2026,Quartermaster is a management strategy simulation in which you will build a top-secret agency to prepare elite spies for their missions! Research high-tech spy gadgets and run specialized training programs. Manage your staff and stay alert for double agents looking to sabotage your operation.,"*;, French, Italian, German, Spanish - Spain, Japanese, Polish, Russian, Simplified Chinese, Traditional Chinese, Turkish;*",,,,2025-07-17
demo,Elegant Sleuth: Mystic Family Demo,3855230,TAPROMANCE,TAPROMANCE,,Game demo,,https://store.steampowered.com/app/3855230,public_unreleased,full_details,False,Coming soon,,,,,,2025-07-17
dlc,For The King II: Tinkerers Of Fate Character Pack,3840390,IronOak Games,Curve Games,https://www.ironoakgames.com,Single-player;Multi-player;Co-op;Online Co-op;Shared/Split Screen Co-op;Shared/Split Screen;Cross-Platform Multiplayer;Downloadable Content;Steam Achievements;Full controller support;Steam Trading Cards;Adjustable Text Size;Camera Comfort;Custom Volume Controls;Adjustable Difficulty;Keyboard Only Option;Mouse Only Option;Save Anytime;Steam Cloud;Remote Play Together;Family Sharing,Adventure;Indie;RPG;Strategy,https://store.steampowered.com/app/3840390,public_unreleased,full_details,False,Coming soon,Bolster your adventures and renew the strength of The Resistance with the Tinkerers Of Fate Character Pack!,English;French;Italian;German;Spanish - Spain;Japanese;Korean;Polish;Portuguese - Brazil;Russian;Simplified Chinese;Traditional Chinese;Ukrainian,,,,2025-07-17
demo,Hermit Demo,3876210,Krabworks Game Studios Inc.,Krabworks Game Studios Inc.,https://www.krab.works,Single-player;Game demo;Playable without Timed Input;Save Anytime;Stereo Sound,Action;Adventure;RPG,https://store.steampowered.com/app/3876210,public_unreleased,full_details,False,To be announced,"Hermit is a Third-Person Open-World Fantasy RPG set in a rich and dynamic world. Explore with your Donkey at your side as you navigate dungeons, cast spells, brew potions, hunt monsters, and traverse a vast medieval landscape while uncovering the terrible secrets of the Order of Hermits.",*;*,,,,2025-07-17
game,BreadKnight Adventures,3756900,Evergreen Developer,Evergreen Developer,,Single-player;Steam Achievements;Captions available;Custom Volume Controls;Playable without Timed Input;Save Anytime;Family Sharing,Action;Adventure;Casual;Indie;RPG;Strategy,https://store.steampowered.com/app/3756900,public_unreleased,full_details,False,"Jul 31, 2025","Embark on an Adventure with BreadKnight and his crew to face the fearsome AntiBread! Many quests to complete with hilarious dialogue, and mysterious characters. Turn based combat, defeat your enemies by slapping them with baguettes or cheese! Beware: Dangerous to individuals with a lack of humour.",*;*,,,,2025-07-17
dlc,Crypt of the Sorcerer (Fighting Fantasy Classics),3855210,Tin Man Games,Tin Man Games,https://tinmangames.com.au/,Single-player;Downloadable Content;Steam Achievements;In-App Purchases;Steam Cloud,Adventure;Indie;RPG;Free To Play,https://store.steampowered.com/app/3855210,public_unreleased,full_details,False,Coming soon,"The dread sorcerer Razaak has risen from the grave, unleashing Chaos upon Allansia. Only YOU can stand against him. Gather ancient relics, defy death itself, and descend into the Crypt of the Sorcerer to face an evil that threatens the world!",English,,,,2025-07-17
game,I Am a Dorm Resident (but Cat),3870060,Project Bon,Project Bon,,Single-player;Custom Volume Controls;Playable without Timed Input;Save Anytime,Adventure;Indie;RPG;Simulation;Free To Play,https://store.steampowered.com/app/3870060,public_unreleased,full_details,False,Coming soon,"You wake up as Bon, the dorm’s beloved cat — memories gone, paws in place. Roam a century-old student dorm, chat with residents, nap under the kotatsu, enjoy a cat life while uncovering lost secrets and your past. ※This game is distributed with permission from the Yoshida Dormitory Student Council.",Japanese,,,,2025-07-17
game,Deepest Massage,3593580,Erogame Sensei,Erogame Sensei,,Single-player;Custom Volume Controls;Mouse Only Option;Playable without Timed Input;Family Sharing,Casual;Indie;Simulation,https://store.steampowered.com/app/3593580,public_unreleased,full_details,False,September 2025,Massage every part of a woman who responds dynamically to your touch! Point-and-click gameplay combined with smooth and realistic animations.,English,,,,2025-07-17
game,Cardboard Cowboy,3856780,Dead Dev Games,Dead Dev Games,,Single-player;Full controller support;Camera Comfort;Custom Volume Controls;Stereo Sound;Subtitle Options;Family Sharing,Action;Adventure;Indie;RPG,https://store.steampowered.com/app/3856780,public_unreleased,full_details,False,To be announced,Cardboard Cowboy is a first-person shooter set in a Wild West world made entirely out of cardboard. Shoot your way through the Flatlands as you explore three regions and gun down outlaws.,*;*,,,,2025-07-17
game,No Pain No Gain,3885420,Rike Games,Rike Games,,Single-player;Camera Comfort;Custom Volume Controls;Mouse Only Option;Playable without Timed Input;Save Anytime;Touch Only Option;Family Sharing,Casual;Indie;Simulation,https://store.steampowered.com/app/3885420,public_unreleased,full_details,False,Coming soon,"A ragdoll sandbox physics game where you place traps, cause pain, and earn coins for every hit. The more it hurts, the more you get.",English;French;Italian;German;Spanish - Spain;Arabic;Bulgarian;Czech;Danish;Dutch;Finnish;Greek;Hungarian;Indonesian;Japanese;Korean;Norwegian;Polish;Portuguese - Brazil;Portuguese - Portugal;Romanian;Russian;Simplified Chinese;Spanish - Latin America;Swedish;Thai;Traditional Chinese;Turkish;Ukrainian;Vietnamese;Afrikaans;Albanian;Amharic;Armenian;Assamese;Azerbaijani;Bangla;Basque;Belarusian;Bosnian;Catalan;Cherokee;Croatian;Dari;Estonian;Filipino;Galician;Georgian;Gujarati;Hausa;Hebrew;Hindi;Icelandic;Igbo;Irish;K'iche';Kannada;Kazakh;Khmer;Kinyarwanda;Konkani;Kyrgyz;Latvian;Lithuanian;Luxembourgish;Macedonian;Malay;Malayalam;Maltese;Maori;Marathi;Mongolian;Nepali;Odia;Persian;Punjabi (Gurmukhi);Punjabi (Shahmukhi);Quechua;Scots;Serbian;Sindhi;Sinhala;Slovak;Slovenian;Sorani;Sotho;Swahili;Tajik;Tamil;Tatar;Telugu;Tigrinya;Tswana;Turkmen;Urdu;Uyghur;Uzbek;Valencian;Welsh;Wolof;Xhosa;Yoruba;Zulu,,,,2025-07-17
demo,Farm Defence Demo,3855260,KEY CREATION INC.,KEY CREATION INC.,,Single-player;Game demo;Custom Volume Controls;Save Anytime;Steam Cloud,Casual;Simulation,https://store.steampowered.com/app/3855260,public_unreleased,full_details,False,Coming soon,"Idle-farming game with automation. The game will sit at the bottom of your screen allowing you to work on other tasks. Grow crops, produce fuel, activate turrets to defend your FARM.",English;Japanese,,,,2025-07-17
game,SuprSketch,3735970,SuprSketch,SuprSketch,https://www.suprsketch.com/,,Free To Play;Animation & Modeling;Design & Illustration;Photo Editing;Utilities,https://store.steampowered.com/app/3735970,public_unreleased,full_details,False,"Jul 29, 2025","An art based wallpaper app. Live-streamed art directly to your desktop wallpaper. SuprSketch lets real human artists paint on your wallpaper in real time, turning your wallpaper into a living art installation.",English,,,,2025-07-17
game,Mindaro,3879330,Burning Boats Studios,Burning Boats Studios,,Single-player;Multi-player;Co-op;Online Co-op;Family Sharing,Action,https://store.steampowered.com/app/3879330,public_unreleased,full_details,False,To be announced,"Descend the dangerous depths of Mindaro, a 1-6 player co-op action-horror game. Navigate caves, biomes, and industrial ruins while scavenging for survival and uncovering hidden secrets.","*;, Spanish - Spain;*;*",,,,2025-07-17
game,八つ灯 | Yatsuakari,3843500,"PULSMO,INC.","PULSMO,INC.",,Single-player;Steam Achievements;Full controller support;Family Sharing,Adventure;Simulation,https://store.steampowered.com/app/3843500,public_unreleased,full_details,False,August 2025,Light all eight candles. Ignite the candles hidden in a haunted midnight maze and escape the sealed space.,Japanese,,,,2025-07-17
game,救済の日,3882400,Nanoar,Nanoar,,Single-player;Steam Achievements;Custom Volume Controls;Adjustable Difficulty;Playable without Timed Input;Family Sharing,Adventure,https://store.steampowered.com/app/3882400,public_unreleased,full_details,False,Q1 2026,"""The Day of Salvation"" is a horror game in which players must escape from giant humanoid creatures by hiding in the fog and discovering their true identities.",*;*,,,,2025-07-17
game,Vault of Fallen,3867030,Hammer Forge Games,Hammer Forge Games,,Single-player;Custom Volume Controls;Adjustable Difficulty;Stereo Sound;Subtitle Options;Family Sharing,Action;Indie,https://store.steampowered.com/app/3867030,public_unreleased,full_details,False,Coming soon,"Vault of Fallen is a brutal first-person action game set on a cursed island. Blast enemies with a powerful shotgun or slash through undead hordes with sword and shield in a fast-paced, dark fantasy world where science and sorcery collide.",*;*,,,,2025-07-17
game,Shuffle Sword,3631010,Shattered Journal Games,Shattered Journal Games,,Single-player;Camera Comfort;Custom Volume Controls;Playable without Timed Input;Family Sharing,Action;Adventure;Indie,https://store.steampowered.com/app/3631010,public_unreleased,full_details,False,To be announced,"Shuffle Sword is a dark fantasy deck-builder roguelite. Fight your way through the blade cave, find different sword and magic cards to utilize, and prove yourself to the sword masters. They may have some strong swords, but nothing beats the Shuffle Sword Style!",*;*,,,,2025-07-17
game,Frost World,3734480,Estoty LLC,Estoty LLC,,Single-player;Multi-player;Co-op;Shared/Split Screen Co-op;Shared/Split Screen;Full controller support;In-App Purchases;Custom Volume Controls;Adjustable Difficulty;Keyboard Only Option;Playable without Timed Input;Save Anytime;Stereo Sound;Remote Play Together;Family Sharing,Action;Adventure;Casual;Indie,https://store.steampowered.com/app/3734480,public_unreleased,full_details,False,Coming soon,"The world has frozen over, and survival means more than just escaping the mysterious danger—it's about conquering the cold.","*;, French, Italian, German, Spanish - Spain, Turkish;*",,,,2025-07-17
game,Operation Purge,3863450,StellarGamesStudio,StellarGamesStudio,https://www.operationpurge.com/,Single-player;Keyboard Only Option;Mouse Only Option;Save Anytime;Subtitle Options;Family Sharing,Action;Adventure;Indie,https://store.steampowered.com/app/3863450,public_unreleased,full_details,False,Coming soon,"Operation Purge is a story-driven sci-fi survival game set on Titan, Saturn’s mysterious moon. Explore the terrain, manage limited resources, and uncover the secrets hidden beneath the surface. Will you survive long enough to find the truth?",*;*,,,,2025-07-17
game,アイアイ喫茶店,3847100,麺屋すぱいす 東京支店,麺屋すぱいす 東京支店,https://sites.google.com/view/menspicetokyo/%E3%82%A2%E3%82%A4%E3%82%A2%E3%82%A4%E5%96%AB%E8%8C%B6%E5%BA%97,Single-player;Steam Achievements;Color Alternatives;Custom Volume Controls;Keyboard Only Option;Mouse Only Option;Playable without Timed Input;Family Sharing,Adventure;Indie,https://store.steampowered.com/app/3847100,public_unreleased,full_details,False,Coming soon,「アイアイ喫茶店」は、1周5分のマルチエンドアドベンチャーゲームです。 何を注文しても奥の部屋に通される喫茶店で、注文や選択を通してプレイヤーは事件の真相を探ります。,Japanese,,,,2025-07-17
game,九頭龍奇譚 龍宮之使 THE GAME 印須磨町編,3830250,アオパブリッシング;夢人塔,アオパブリッシング,,Single-player;Full controller support;Playable without Timed Input;Save Anytime;Family Sharing,Adventure;RPG,https://store.steampowered.com/app/3830250,public_unreleased,full_details,False,Coming soon,"This is an RPG with a strong story element featuring a unique setting combining the 'Cthulhu Mythos' and Japan's 'Ryugu Legend.' Along with the mysterious three sisters, solve the strange incidents in the mysterious town of 'Insuma Town'!",Japanese,,,,2025-07-17
music,Submansion – Official Soundtrack,3861950,Hrybochky studio,Shreibikus,,,,https://store.steampowered.com/app/3861950,public_unreleased,full_details,False,August 2025,"This is additional content for Submansion, but does not include the base game.",,,,,2025-07-17
game,Luke Muscat's Ultimate Golf Challenge,3510740,Luke Muscat,Luke Muscat,,Single-player;Family Sharing,Simulation;Sports,https://store.steampowered.com/app/3510740,public_unreleased,full_details,False,To be announced,A challenging and surreal journey to master the perfect golf swing.,English,,,,2025-07-17
game,东方天海瀑 ~ Destroyer in Miraculous Storm.,3643310,幻缘制作组,幻缘制作组,,Single-player;Family Sharing,Indie,https://store.steampowered.com/app/3643310,public_unreleased,full_details,False,To be announced,Destroyer in Miraculous Storm is a Touhou Project bullet hell STG fan game. Embark on a fantastic journey with Hakurei Reimu and her friends to discover the secrets behind the sudden appearance of the heavy rain in Gensokyo.,Simplified Chinese,,,,2025-07-17
game,Sawmania,3876840,Bug Bounty Games,Bug Bounty Games,https://bugbountygames.com/,Single-player;Steam Achievements;Full controller support;Custom Volume Controls;Save Anytime;Stereo Sound;Surround Sound;Steam Cloud,Action;Indie;Strategy;Free To Play,https://store.steampowered.com/app/3876840,public_unreleased,full_details,False,Coming soon,Protect your base against an onslaught of monsters using your mighty saw!,English,,,,2025-07-17
