type,name,steam_appid,developers,publishers,website,categories,genres,steam_url,detection_stage,api_response_type,potential_duplicate,release_date,description,supported_languages,followers,wishlists_est,wishlist_rank,discovery_date
game,Such a guy,3687630,SUCH ONE STUDIO,SUCH ONE STUDIO,https://www.such-one.com,Single-player;Steam Achievements;Captions available;Playable without Timed Input;Save Anytime;Stereo Sound;Steam Cloud;Family Sharing,Adventure;Casual;RPG;Simulation,https://store.steampowered.com/app/3687630,public_unreleased,full_details,False,Coming soon,"Start a lakeside guesthouse with two close friends and tackle unexpected challenges. Every choice impacts the story and relationships. Interact with six unique girls. Featuring 4K visuals, nearly 1000 minutes of video, side quests, mini-games, and 20+ endings for an immersive experience.","*;, Traditional Chinese, Korean;*",,,,2025-07-19
game,Instruments of Peace,3829440,Outlaw Games,Pixel Games,https://pixelsgraphicdesign.com/games/,Single-player;Steam Achievements;Family Sharing,Action;Indie;Early Access,https://store.steampowered.com/app/3829440,public_unreleased,full_details,False,July 2025,"Set in the tense final days of World War II, I.O.P is a gritty, story-driven stealth game where players embark on a dangerous mission behind enemy lines. With the Nazi regime collapsing, high-ranking officers have gone into hiding—rumors swirl that Adolf Hitler himself may have escaped.",*;*,2,22,,2025-07-19
game,Desktop Pachinko Idle,1995980,MSUnity,MSUnity,,Single-player;Steam Achievements;Custom Volume Controls;Playable without Timed Input;Save Anytime;Family Sharing,Casual;Indie,https://store.steampowered.com/app/1995980,public_unreleased,full_details,False,Coming soon,"A Mini Auto Pachinko Machine on Your DesktopThis game is a quiet pachinko simulator that runs in a corner of your desktop.Whether you're working, gaming, or just browsing — the pachinko never stops.",English;Japanese;Korean;Simplified Chinese;Traditional Chinese,2,28,,2025-07-19
game,Aniverse,3756240,AniLab,AniLab,,Single-player;Multi-player;Co-op;Online Co-op;LAN Co-op;Steam Achievements;Full controller support;Steam Workshop;Camera Comfort;Adjustable Difficulty;Save Anytime;Stereo Sound;Surround Sound;Steam Cloud;Stats;Family Sharing,Action;Adventure;Indie;Early Access,https://store.steampowered.com/app/3756240,public_unreleased,full_details,False,Coming soon,"Chop trees, cook meals, build your home and play music to control the wild! Explore a procedurally generated world and survive your way through art.",English;French;German;Simplified Chinese;Turkish;Spanish - Spain;Russian,,,,2025-07-19
game,Glaucon Inc.,3866840,Adrien Lee,Adrien Lee,,Single-player;Playable without Timed Input;Family Sharing,Adventure;Indie,https://store.steampowered.com/app/3866840,public_unreleased,full_details,False,Coming soon,"Your job is your life. Work for Glaucon Inc. processing debtors and making as much money as you can, while you slowly recall your past, and the truth.",*;*,,,,2025-07-19
game,南亭湖 Dependent Origination,3805880,船Chuan Studio,船Chuan Studio,,Single-player;Steam Achievements;Full controller support;Family Sharing,Adventure;Indie;RPG,https://store.steampowered.com/app/3805880,public_unreleased,full_details,False,To be announced,"A state machinery plant is haunted by a dismemberment murder. A girl's vanishing and a fatal plunge fuel ghost rumors. Years later, cop Wang Nan uncovers the truth: fates interwoven over a decade reveal human guilt and redemption—not spectral revenge.","*;, Traditional Chinese;*",,,,2025-07-19
game,LE3CH,3874520,BOSS,BOSS,,Single-player;Steam Achievements;Custom Volume Controls;Family Sharing,Indie,https://store.steampowered.com/app/3874520,public_unreleased,full_details,False,To be announced,"LE3CH is a psychological horror game set in 1994. You take a shady office job and soon find your PC hijacked by a stalker’s RAT. As files corrupt and reality distorts, uncover a disturbing conspiracy through eerie desktop tasks before you lose control completely.",*;*,,,,2025-07-19
demo,Vision Twist Demo,3882720,Khima Chen,Otulatte,,Game demo,,https://store.steampowered.com/app/3882720,public_unreleased,full_details,False,July 2025,,English;Japanese;Traditional Chinese,,,,2025-07-19
game,"S.Y.N.C. - One Mecha, Two Pilots",3828950,Fanelia Games,Fanelia Games,,Multi-player;PvP;Online PvP;Co-op;Online Co-op;LAN Co-op;Shared/Split Screen Co-op;Shared/Split Screen;Steam Achievements;Full controller support;Steam Cloud;Family Sharing,Action;Casual;Indie,https://store.steampowered.com/app/3828950,public_unreleased,full_details,False,Coming soon,"Meet dual-brain co-op: Two Pilots. One Mecha. Sync up (or screw up) to crush absurd Kaiju or rival duos in chaotic, over-the-top 2v2 battles.","*;, French, Italian, German, Spanish - Spain, Arabic, Simplified Chinese, Traditional Chinese, Korean, Spanish - Latin America, Japanese, Dutch, Polish, Portuguese - Brazil, Portuguese - Portugal, Russian, Czech;*",,,,2025-07-19
game,Limitless Runner,3843330,Ddraigstone,Ddraigstone,,Single-player;Steam Achievements;Family Sharing,Casual;Racing;Simulation,https://store.steampowered.com/app/3843330,public_unreleased,full_details,False,Coming soon,"Run, jump, and slide your way to victory in this fast-paced mouse adventure! Click on buzzing bees and juicy berries to boost your score—but watch out for those sneaky birds! One wrong move and it’s game over. Think fast, move faster, and survive the chaos!",English,,,,2025-07-19
game,Red Tape Rampage,3878620,Blunder Studios,Blunder Studios,,Single-player;Custom Volume Controls;Mouse Only Option;Playable without Timed Input;Save Anytime;Subtitle Options;Family Sharing,Indie;Strategy,https://store.steampowered.com/app/3878620,public_unreleased,full_details,False,December 2025,"You're the boss of bureaucracy. Exploit interns, automate the red tape and climb the corporate ladder in this satirical idle empire builder.",*;*,,,,2025-07-19
game,Packet Loss,3168450,HaugPackets,HaugPackets,,Single-player;Partial Controller Support;Steam Leaderboards;Family Sharing,Casual;Racing;Simulation;Early Access,https://store.steampowered.com/app/3168450,public_unreleased,full_details,False,Coming soon,"Pilot cargo across an assigned sector. Master near-realistic flight, use ground effect for fuel, and perfectly balance your cargo or lose it to gravity. Precision is key in this aerial ballet of flight and cargo!",*;*,,,,2025-07-19
game,FlippUp,3854060,Try Again Entertainment,Try Again Entertainment,,Single-player;Steam Achievements;Full controller support;Stats;Steam Leaderboards;Family Sharing,Action;Adventure;Indie,https://store.steampowered.com/app/3854060,public_unreleased,full_details,False,2025,"You've activated an old Pinball machine—but with a twist. No points to score, just a mysterious mission to reach the top. We recommend you to try the demo before buying to avoid quick refunds- FlippTechINC.",English,,,,2025-07-19
game,Life in Jasskia: a Coffee Shop,3880150,Ak Ene Entertainment,Ak Ene Entertainment,,Single-player;Camera Comfort;Custom Volume Controls;Mouse Only Option;Playable without Timed Input;Stereo Sound;Family Sharing,Casual;Simulation;Strategy,https://store.steampowered.com/app/3880150,public_unreleased,full_details,False,Q1 2026,"A Shop Survivor Simulator. In the crisis-ridden country of Jasskia, building a café is easy. Keeping it alive? That’s another story.",English;French;German;Spanish - Spain;Simplified Chinese;Japanese;Polish;Russian;Turkish;Portuguese - Brazil,,,,2025-07-19
game,雷亚的花园世界大冒险,3880650,MegaDragonGirls Project,MegaDragonGirls Project,,Single-player;Family Sharing,Casual;Indie;Simulation,https://store.steampowered.com/app/3880650,public_unreleased,full_details,False,Coming soon,"Become the Dragon Girl of the Austerich Empire Assist neighboring nations in eliminating the pesky goblin menace! A lighthearted casual video game experience,Designed for Giantess Enthusiasts. Freely indulge in cathartic destruction across miniature worlds!",*;*,,,,2025-07-19
game,Strip Me Down: Office Worker,3683610,Kipukink,Kipukink,,Single-player;Steam Achievements;Family Sharing,Adventure;Casual;Indie,https://store.steampowered.com/app/3683610,public_unreleased,full_details,False,Coming soon,"Play a flirty game of Strip Rock Paper Scissors against Kyle, your office subordinate . If you can manage to beat him, he may just have a surprise in store for you...",English,,,,2025-07-19
demo,SOR.OP: Dark Shades Demo,3884320,SNRCStudios,SNRCStudios,,Single-player;Multi-player;PvP;Online PvP;LAN PvP;Game demo;Steam Achievements;HDR available,Action,https://store.steampowered.com/app/3884320,public_unreleased,full_details,False,"Jul 21, 2025","SOR.OP: Dark Shades is a realistic first-person shooter from SNRC Studios with beautiful graphics, precise controls, and over 40 maps. Play in 7 modes, including Team Deathmatch, Free For All, Domination, and Zombie Mode. Tactics, skill, and teamwork are the key to victory.",*;*,,,,2025-07-19
game,Strip Me Down: Jock,3683590,Kipukink,Kipukink,,Single-player;Steam Achievements;Family Sharing,Adventure;Casual;Indie;Sports,https://store.steampowered.com/app/3683590,public_unreleased,full_details,False,Coming soon,"Play a flirty game of Strip Rock Paper Scissors against Ashton the jock. If you can manage to beat him, he may just have a surprise in store for you...",English,,,,2025-07-19
game,Boxing Simulator,2548440,Rahu Studio,Rahu Studio,,Single-player;Multi-player;PvP;Online PvP;Playable without Timed Input;Stereo Sound;Surround Sound;Family Sharing,Action;Indie;Simulation;Sports;Early Access,https://store.steampowered.com/app/2548440,public_unreleased,full_details,False,Coming soon,"The core idea of this game is to simulate a boxer's arms and upper body movement with the movement of your mouse, precisely and intuitively. All you need is a keyboard and a mouse, then you can experience this immersive and hardcore simulation of a real boxing fight!",English,,,,2025-07-19
game,Omashu: Snail Racing,3850030,The Indie Accord,The Indie Accord,,Single-player;Multi-player;PvP;Online PvP;Partial Controller Support;Family Sharing,Action;Casual;Racing,https://store.steampowered.com/app/3850030,public_unreleased,full_details,False,"Jul 30, 2025",An insect sized time trial with online highscores!,*;*,,,,2025-07-19
game,Blood Money: Trial by Combat,3826390,D.C. Whitner,Nocturnal Studios,,Single-player;Full controller support;Family Sharing,Action;Adventure;Indie;Simulation,https://store.steampowered.com/app/3826390,public_unreleased,full_details,False,To be announced,"Blood Money is a stylized street-fighting RPG where you battle rival gangs, master brutal hand-to-hand combat, and fight for survival in a gritty urban underworld. Choose your fighter. Own the streets.",*;*,,,,2025-07-19
game,Touhou Rinrinki ~ Crafts of the Lucky Beast,3449630,Starcrow Dev,Starcrow Dev,,Single-player;Captions available;Custom Volume Controls;Mouse Only Option;Playable without Timed Input;Steam Cloud;Family Sharing,Indie;Strategy;Early Access,https://store.steampowered.com/app/3449630,public_unreleased,full_details,False,October 2025,"Touhou Rinrinki ~ Crafts of the Luck Beast is a Touhou Doujin Card-Strategy Game. Using cards across different seasons, join forces with duelists of unique abilities, face various opponents from all over Gensoukyo, and uncover the truth behind the Card Duel Incident!",English;Japanese;Simplified Chinese,,,,2025-07-19
game,"Bean There, Swung That",3321060,Backcannon Studios,Backcannon Studios,,Single-player;Multi-player;PvP;Online PvP;Steam Achievements;Camera Comfort;Color Alternatives;Custom Volume Controls;Adjustable Difficulty;Playable without Timed Input;Stereo Sound;Steam Cloud;Family Sharing,Action;Indie;Racing,https://store.steampowered.com/app/3321060,public_unreleased,full_details,False,Coming soon,"Swing, race, and grapple your way to glory. Bean There Swung That is a high-speed grappling-hook platformer built for speedrunners. Master momentum, speed and accuracy to perfect your runs. Race through 90 themed levels versus friends, or your own times.","*;, French, German, Spanish - Spain, Japanese, Portuguese - Brazil, Russian, Simplified Chinese, Turkish;*",,,,2025-07-19
game,Otterly Lost,3861710,Soulworks Interactive,Soulworks Interactive,,Single-player;Camera Comfort;Color Alternatives;Custom Volume Controls;Playable without Timed Input;Save Anytime;Stereo Sound;Surround Sound;Family Sharing,Adventure;Casual;Indie,https://store.steampowered.com/app/3861710,public_unreleased,full_details,False,2026,"Play as Otto, a curious sea otter swept far from home. In this story-rich adventure, explore wild forests, dive underwater, glide over rocky canyons, and climb your way back. Meet friendly animals, complete heartfelt quests, and enjoy soft challenges, at your own pace!",*;*,,,,2025-07-19
demo,Runic Prophecy Demo,3806950,RunicForge,RunicForge,https://runicforge.com/,Single-player;Game demo;Full controller support;Custom Volume Controls;Playable without Timed Input;Save Anytime;Stereo Sound,Action;Adventure;Indie;RPG,https://store.steampowered.com/app/3806950,public_unreleased,full_details,False,July 2025,"Runic Prophecy is a challenging third-person soulslike action RPG set in a dark fantasy world. Explore Eyjusheim, unleash magic and a dragon in combat, battle supernatural creatures, and uncover the hidden lore of a shattered world.",*;*,,,,2025-07-19
game,Tipsy Cat,3844830,Astergame,Astergame,,Single-player;Family Sharing,Indie,https://store.steampowered.com/app/3844830,public_unreleased,full_details,False,To be announced,"Tipcy Cat is a choice-based adventure novel game. The game progresses by players choosing which records to play that day. Records are either drawn by lottery or purchased with in-game currency, so players can choose their records in a variety of ways. Enjoy the novel part along with the music.",*;*,,,,2025-07-19
game,Rogue's Odyssey,3792120,Duggoman,Duggoman,http://roguesodyssey.com/,Single-player;Steam Achievements;Full controller support;Camera Comfort;Color Alternatives;Custom Volume Controls;Playable without Timed Input;Stereo Sound;Steam Cloud;Stats;Family Sharing,Action;Adventure;Casual;Indie;RPG,https://store.steampowered.com/app/3792120,public_unreleased,full_details,False,2026,"Confront hordes of monsters and challenging boss fights in a 2.5D class-based roguelike RPG where you can be a Warrior, Merchant, Alchemist — or even a Cat(🐾). Discover new classes, unlock new items, and forge a legend out of your Rogue’s Odyssey!",English,,,,2025-07-19
game,Computer Shrilow,3890990,JuiceBoxFactory,JuiceBoxFactory,https://juiceboxfactory.neocities.org,Single-player;Steam Achievements;Captions available;Camera Comfort;Color Alternatives;Custom Volume Controls;Adjustable Difficulty;Mouse Only Option;Playable without Timed Input;Save Anytime;Stereo Sound;Subtitle Options;Family Sharing,Casual;Indie,https://store.steampowered.com/app/3890990,public_unreleased,full_details,False,August 2025,"A Clicker Game, with less waiting around and more green dogs!",*;*,,,,2025-07-19
game,Microwave Yourself,3840810,Pallio Corp,Pallio Corp,,Single-player;VR Only;Playable without Timed Input;Stereo Sound;Surround Sound;Family Sharing,Indie,https://store.steampowered.com/app/3840810,public_unreleased,full_details,False,Coming soon,"Microwave Yourself is a casual VR puzzle game. Interact with items and combine them in a microwave (along with your head!) to unlock unique visual effects, music, and a message to advance your progress. Find all combinations to escape your torment...",*;*,,,,2025-07-19
game,The Vending Machine,3880210,GG Rising,GG Rising,,Single-player;Steam Achievements;Family Sharing,Action;Indie;Simulation,https://store.steampowered.com/app/3880210,public_unreleased,full_details,False,August 2025,"The Vending Machine is a survival stealth horror where you must sneak, run, and escape from an anomalous vending machine.",English;Thai,,,,2025-07-19
music,Nitronic Rush Soundtrack,3885880,Team Nitronic,DigiPen,,,Free To Play,https://store.steampowered.com/app/3885880,public_unreleased,full_details,False,"Nov 11, 2025","Nitronic Rush Original Soundtrack. By both Torcht, and The Quiggles.",,,,,2025-07-19
game,Combo Master,3879190,JunSsangGaming,JunSsangGaming,,Single-player;Custom Volume Controls;Family Sharing,Action;Casual;Strategy,https://store.steampowered.com/app/3879190,public_unreleased,full_details,False,August 2025,"Test your fighting game skills in Combo Master! Complete the ultimate combo, the flower of fighting games! Use all skills with rules exclusive to Combo Master to earn the title of Master!",English;Korean;Japanese,,,,2025-07-19
game,Fadeland: Fight Clubs,3765040,Fadeland Studio,Fadeland Studio,https://www.fadeland.com/,Single-player;Multi-player;MMO;PvP;Online PvP;Shared/Split Screen PvP;Shared/Split Screen;Cross-Platform Multiplayer;Full controller support;Remote Play Together;HDR available;Family Sharing,Action;Massively Multiplayer,https://store.steampowered.com/app/3765040,public_unreleased,full_details,False,"Feb 2, 2026","Fight. Earn. Build. In Fadeland, your fists shape your future. Engage in bloody battles, collect rewards, and create your dream life in an open world",*;*,,,,2025-07-19
game,Live Wallpaper,3863880,Fionnshare,Fionnshare,,,Animation & Modeling;Design & Illustration;Utilities,https://store.steampowered.com/app/3863880,public_unreleased,full_details,False,"Jul 28, 2025","Live Wallpaper is a desktop beautification software, offering thousands of HD dynamic and static wallpapers across 12 categories—from 4K landscapes and anime to futuristic CG and adorable pets. With one-click switching, and optimized performance, you can personalize your desktop effortlessly.",English;French;Italian;German;Spanish - Spain;Danish;Russian;Turkish;Japanese;Thai;Simplified Chinese;Traditional Chinese;Portuguese - Brazil;Portuguese - Portugal;Spanish - Latin America;Vietnamese;Arabic,,,,2025-07-19
game,Backrooms M.E.G,3867440,Null Point Interactive,Null Point Interactive,,Single-player;Multi-player;Co-op;Online Co-op;Full controller support;Family Sharing,Action;Adventure;Casual;Indie,https://store.steampowered.com/app/3867440,public_unreleased,full_details,False,To be announced,"Backrooms M.E.G is a 1–4 player multiplayer psychological horror game. Explore undocumented levels in the deepest corners of the Backrooms, collect data, and try to survive. Silence is your only ally… something might be watching you.","*;, Turkish, Simplified Chinese;*",,,,2025-07-19
demo,Norn's Dine Demo,3822410,HIC*,HIC*,,Game demo;Playable without Timed Input,,https://store.steampowered.com/app/3822410,public_unreleased,full_details,False,Coming soon,,English;Traditional Chinese;Japanese,,,,2025-07-19
game,Draw Sword,3886770,FishBox,FishBox,,Single-player;Family Sharing,Casual,https://store.steampowered.com/app/3886770,public_unreleased,full_details,False,Q3 2025,Draw Sword is a physics-based drawing game. You control a stickman by drawing lines to move and attack. Use smart thinking and timing to beat your opponent — every line is a fun sword fight!,English;French;Italian;German;Spanish - Spain;Danish;Ukrainian;Russian;Bulgarian;Hungarian;Indonesian;Turkish;Greek;Norwegian;Czech;Japanese;Polish;Thai;Swedish;Simplified Chinese;Traditional Chinese;Romanian;Finnish;Dutch;Portuguese - Brazil;Portuguese - Portugal;Spanish - Latin America;Vietnamese;Arabic;Korean;Uzbek;Urdu;Armenian;Igbo;Sindhi;Sinhala;Croatian;Icelandic;Cherokee;Galician;Catalan;Afrikaans;Kannada;Luxembourgish;Hindi;Gujarati;Kyrgyz;Kazakh;Turkmen;K'iche';Kinyarwanda;Tajik;Serbian;Odia;Welsh;Konkani;Bangla;Nepali;Basque;Hebrew;Latvian;Tigrinya;Slovak;Slovenian;Swahili;Punjabi (Gurmukhi);Punjabi (Shahmukhi);Georgian;Maori;Wolof;Bosnian;Persian;Telugu;Tamil;Irish;Estonian;Valencian;Belarusian;Quechua;Zulu;Xhosa;Lithuanian;Sotho;Sorani;Yoruba;Uyghur;Scots;Tswana;Filipino;Mongolian;Hausa;Dari;Azerbaijani;Amharic;Albanian;Assamese;Tatar;Macedonian;Marathi;Malayalam;Malay;Maltese;Khmer,,,,2025-07-19
game,Operation Dimera,3883840,SupKai,SupKai,,Single-player;Multi-player;Co-op;Online Co-op;Steam Cloud;Family Sharing,Action;Adventure,https://store.steampowered.com/app/3883840,public_unreleased,full_details,False,Coming soon,Operation Dimera is a co-op game for up to 3 players where you and your friends must save the world. Tackle diverse missions. Work together to solve puzzles that stand in your way and customize your weapons to be ready for anything! The fate of the world is in your hands!,*;*,,,,2025-07-19
game,rest: in a dark room,3889990,regular glove,regular glove,,Single-player;Custom Volume Controls;Mouse Only Option;Playable without Timed Input;Save Anytime;Subtitle Options;Touch Only Option;Family Sharing,Indie,https://store.steampowered.com/app/3889990,public_unreleased,full_details,False,Coming soon,"Two misanthropic teenagers attempt to be reborn through the world of sensory deprivation. A visual novel full of death, drugs, and dolphins.",English,,,,2025-07-19
game,When The Road Darkens,3867960,Oyusi,Oyusi,,Single-player;Multi-player;Co-op;Online Co-op;Steam Achievements;Camera Comfort;Custom Volume Controls;Adjustable Difficulty;Playable without Timed Input;Stereo Sound;Surround Sound;Family Sharing,Action;Indie;Early Access,https://store.steampowered.com/app/3867960,public_unreleased,full_details,False,Coming soon,"A cooperative action game where up to 4 players battle through themed arenas, dodge deadly attacks, upgrade unique abilities, and survive raid-style encounters in fast paced combat.",English,,,,2025-07-19
game,Save Granny,3848540,Andreas,Andreas,,Single-player;Custom Volume Controls;Stereo Sound;Surround Sound;Family Sharing,Action;Adventure;Indie,https://store.steampowered.com/app/3848540,public_unreleased,full_details,False,Coming soon,"Save Granny is a fast-paced 3D platformer where you play as Daniel, a desperate grandson racing through absurd, hazard-filled levels to deliver explosive diarrhea pills to his grandma before she detonates. Time’s ticking, and Granny’s fuse is short.",*;*,,,,2025-07-19
game,Slash,3880820,Bestest Games,Bestest Games,,Single-player;In-App Purchases;Partial Controller Support,Action;Casual;Indie;Free To Play,https://store.steampowered.com/app/3880820,public_unreleased,full_details,False,"Jul 28, 2025","A skill based game with lots of customizability, where you slash bullets with a sword before they hit the ground, to earn money and get new cosmetics.",English,,,,2025-07-19
game,Hotdog: The Videogame,3872110,Tenth Horizon Games,Tenth Horizon Games,,Single-player;Multi-player;Co-op;Online Co-op;Camera Comfort;Color Alternatives;Custom Volume Controls;Adjustable Difficulty;Playable without Timed Input;Save Anytime;Stereo Sound;Surround Sound;Partial Controller Support;Family Sharing,Casual;Indie;Simulation,https://store.steampowered.com/app/3872110,public_unreleased,full_details,False,Q3 2025,"Solo or with a friend, manage multiple hot dog stands in a dynamic and realistic business simulator. Sell fast food, customize it with unique toppings, upgrade your equipment and your stand to a food truck, and serve demanding customers against the clock to achieve efficient greatness.",English;French;Italian;German;Spanish - Spain;Simplified Chinese;Japanese;Portuguese - Brazil;Portuguese - Portugal;Russian;Spanish - Latin America,,,,2025-07-19
game,Drop 9,3806540,Bingo Studio,Bingo Studio,,Single-player;Family Sharing,Adventure,https://store.steampowered.com/app/3806540,public_unreleased,full_details,False,Q4 2025,"Underground work pays well—if you survive. Memorize codes, sneak through flooded tunnels, and avoid what's hunting you. Pack the crate, set the lock. One wrong move, and you’re the next missing delivery.",English;French;Italian;German;Spanish - Spain;Arabic;Bulgarian;Czech;Danish;Dutch;Finnish;Greek;Hungarian;Indonesian;Japanese;Korean;Norwegian;Polish;Portuguese - Brazil;Portuguese - Portugal;Romanian;Russian;Simplified Chinese;Spanish - Latin America;Swedish;Thai;Traditional Chinese;Turkish;Ukrainian;Vietnamese;Afrikaans;Albanian;Amharic;Armenian;Assamese;Azerbaijani;Bangla;Basque;Belarusian;Bosnian;Catalan;Cherokee;Croatian;Dari;Estonian;Filipino;Galician;Georgian;Gujarati;Hausa;Hebrew;Hindi;Icelandic;Igbo;Irish;K'iche';Kannada;Kazakh;Khmer;Kinyarwanda;Konkani;Kyrgyz;Latvian;Lithuanian;Luxembourgish;Macedonian;Malay;Malayalam;Maltese;Maori;Marathi;Mongolian;Nepali;Odia;Persian;Punjabi (Gurmukhi);Punjabi (Shahmukhi);Quechua;Scots;Serbian;Sindhi;Sinhala;Slovak;Slovenian;Sorani;Sotho;Swahili;Tajik;Tamil;Tatar;Telugu;Tigrinya;Tswana;Turkmen;Urdu;Uyghur;Uzbek;Valencian;Welsh;Wolof;Xhosa;Yoruba;Zulu,,,,2025-07-19
game,Neon Hyperdrive,3422100,Spiky Crumb,Fraoula,,Single-player;Full controller support;Keyboard Only Option;Playable without Timed Input;Stereo Sound;Family Sharing,Action;Indie,https://store.steampowered.com/app/3422100,public_unreleased,full_details,False,To be announced,"Neon Hyperdrive is a rhythm racer like you've never seen before: drift corners, surf waves, and fly through neon skies to the rhythm of the music. Multiple vehicles, shifting perspectives, and jaw-dropping visuals. Ready to chase the beat?",English,,,,2025-07-19
game,Vision Twist,3879270,Khima Chen,Otulatte,,,Utilities,https://store.steampowered.com/app/3879270,public_unreleased,full_details,False,July 2025,"Vision Twist harnesses the power of advanced AI technology to instantly transform your cherished 2D photos, artworks, and graphics into stunning 3D visuals with just one click.",English;Traditional Chinese,,,,2025-07-19
